Job Title,Company Name,Job Description,Tokenized,Stop Words Removed,Finished Text
-1,-1,"Spilman Thomas & Battle, PLLC is currently seeking an experienced Network Specialist to work in its Charleston WV office. Network Specialist will manage networks to ensure they function efficiently. Duties include collecting network performance data, monitoring network security, troubleshooting issues, anticipating problems and performing routine maintenance. Specialist will implement secure network access protocols, monitor, and evaluate for issues.
Successful candidate must be able to effectively and efficiently manage multiple projects and competing deadlines. Must have ability to work in a fast-paced environment, adapt to changing priorities, and remain flexible to meet client and attorney needs. Must have strong work ethic and demonstrate both deductive and inductive reasoning and be able to make sound decisions within a short period of time. Must be able to identify in-depth problems and analyze information to develop and evaluate possible options for solving problems. Must have experience in securing endpoints or entry points of end-user devices such as desktops, laptops, and mobile devices to protect against unauthorized access, modification, or destruction. Must work collaboratively with IT team to support Firm's overall technology needs, including participation in on-call rotation schedule.","['Spilman', 'Thomas', '&', 'Battle', ',', 'PLLC', 'is', 'currently', 'seeking', 'an', 'experienced', 'Network', 'Specialist', 'to', 'work', 'in', 'its', 'Charleston', 'WV', 'office', '.', 'Network', 'Specialist', 'will', 'manage', 'networks', 'to', 'ensure', 'they', 'function', 'efficiently', '.', 'Duties', 'include', 'collecting', 'network', 'performance', 'data', ',', 'monitoring', 'network', 'security', ',', 'troubleshooting', 'issues', ',', 'anticipating', 'problems', 'and', 'performing', 'routine', 'maintenance', '.', 'Specialist', 'will', 'implement', 'secure', 'network', 'access', 'protocols', ',', 'monitor', ',', 'and', 'evaluate', 'for', 'issues', '.', 'Successful', 'candidate', 'must', 'be', 'able', 'to', 'effectively', 'and', 'efficiently', 'manage', 'multiple', 'projects', 'and', 'competing', 'deadlines', '.', 'Must', 'have', 'ability', 'to', 'work', 'in', 'a', 'fast-paced', 'environment', ',', 'adapt', 'to', 'changing', 'priorities', ',', 'and', 'remain', 'flexible', 'to', 'meet', 'client', 'and', 'attorney', 'needs', '.', 'Must', 'have', 'strong', 'work', 'ethic', 'and', 'demonstrate', 'both', 'deductive', 'and', 'inductive', 'reasoning', 'and', 'be', 'able', 'to', 'make', 'sound', 'decisions', 'within', 'a', 'short', 'period', 'of', 'time', '.', 'Must', 'be', 'able', 'to', 'identify', 'in-depth', 'problems', 'and', 'analyze', 'information', 'to', 'develop', 'and', 'evaluate', 'possible', 'options', 'for', 'solving', 'problems', '.', 'Must', 'have', 'experience', 'in', 'securing', 'endpoints', 'or', 'entry', 'points', 'of', 'end-user', 'devices', 'such', 'as', 'desktops', ',', 'laptops', ',', 'and', 'mobile', 'devices', 'to', 'protect', 'against', 'unauthorized', 'access', ',', 'modification', ',', 'or', 'destruction', '.', 'Must', 'work', 'collaboratively', 'with', 'IT', 'team', 'to', 'support', 'Firm', ""'s"", 'overall', 'technology', 'needs', ',', 'including', 'participation', 'in', 'on-call', 'rotation', 'schedule', '.']","['Spilman', 'Thomas', '&', 'Battle', ',', 'PLLC', 'currently', 'seeking', 'experienced', 'Network', 'Specialist', 'work', 'Charleston', 'WV', 'office', '.', 'Network', 'Specialist', 'manage', 'networks', 'ensure', 'function', 'efficiently', '.', 'Duties', 'include', 'collecting', 'network', 'performance', 'data', ',', 'monitoring', 'network', 'security', ',', 'troubleshooting', 'issues', ',', 'anticipating', 'problems', 'performing', 'routine', 'maintenance', '.', 'Specialist', 'implement', 'secure', 'network', 'access', 'protocols', ',', 'monitor', ',', 'evaluate', 'issues', '.', 'Successful', 'candidate', 'must', 'able', 'effectively', 'efficiently', 'manage', 'multiple', 'projects', 'competing', 'deadlines', '.', 'Must', 'ability', 'work', 'fast-paced', 'environment', ',', 'adapt', 'changing', 'priorities', ',', 'remain', 'flexible', 'meet', 'client', 'attorney', 'needs', '.', 'Must', 'strong', 'work', 'ethic', 'demonstrate', 'deductive', 'inductive', 'reasoning', 'able', 'make', 'sound', 'decisions', 'within', 'short', 'period', 'time', '.', 'Must', 'able', 'identify', 'in-depth', 'problems', 'analyze', 'information', 'develop', 'evaluate', 'possible', 'options', 'solving', 'problems', '.', 'Must', 'experience', 'securing', 'endpoints', 'entry', 'points', 'end-user', 'devices', 'desktops', ',', 'laptops', ',', 'mobile', 'devices', 'protect', 'unauthorized', 'access', ',', 'modification', ',', 'destruction', '.', 'Must', 'work', 'collaboratively', 'IT', 'team', 'support', 'Firm', ""'s"", 'overall', 'technology', 'needs', ',', 'including', 'participation', 'on-call', 'rotation', 'schedule', '.']","Spilman Thomas & Battle , PLLC currently seeking experienced Network Specialist work Charleston WV office . Network Specialist manage networks ensure function efficiently . Duties include collecting network performance data , monitoring network security , troubleshooting issues , anticipating problems performing routine maintenance . Specialist implement secure network access protocols , monitor , evaluate issues . Successful candidate must able effectively efficiently manage multiple projects competing deadlines . Must ability work fast-paced environment , adapt changing priorities , remain flexible meet client attorney needs . Must strong work ethic demonstrate deductive inductive reasoning able make sound decisions within short period time . Must able identify in-depth problems analyze information develop evaluate possible options solving problems . Must experience securing endpoints entry points end-user devices desktops , laptops , mobile devices protect unauthorized access , modification , destruction . Must work collaboratively IT team support Firm 's overall technology needs , including participation on-call rotation schedule ."
-1,-1,"The Senior Network/Voice Engineer is responsible for a wide range of network functionality, from architecting and configuring PBXs to overseeing voice and network implementation projects. This includes managing all engineering projects for Network and VoIP initiatives, planning technology roadmaps and configuring and optimizing all VoIP/PBX telephone and network systems and services.
Job Duties:
Responsible for the development, implementation and support of a reliable, secure and scalable voice and data network.
Develop and deploy strategic voice and network plans to meet current and future business requirements.
Provide technical expertise and problem resolution for escalated requests. Support routers, PBX systems, VoIP phones, switches, WLAN's, firewalls, and remote access.","['The', 'Senior', 'Network/Voice', 'Engineer', 'is', 'responsible', 'for', 'a', 'wide', 'range', 'of', 'network', 'functionality', ',', 'from', 'architecting', 'and', 'configuring', 'PBXs', 'to', 'overseeing', 'voice', 'and', 'network', 'implementation', 'projects', '.', 'This', 'includes', 'managing', 'all', 'engineering', 'projects', 'for', 'Network', 'and', 'VoIP', 'initiatives', ',', 'planning', 'technology', 'roadmaps', 'and', 'configuring', 'and', 'optimizing', 'all', 'VoIP/PBX', 'telephone', 'and', 'network', 'systems', 'and', 'services', '.', 'Job', 'Duties', ':', 'Responsible', 'for', 'the', 'development', ',', 'implementation', 'and', 'support', 'of', 'a', 'reliable', ',', 'secure', 'and', 'scalable', 'voice', 'and', 'data', 'network', '.', 'Develop', 'and', 'deploy', 'strategic', 'voice', 'and', 'network', 'plans', 'to', 'meet', 'current', 'and', 'future', 'business', 'requirements', '.', 'Provide', 'technical', 'expertise', 'and', 'problem', 'resolution', 'for', 'escalated', 'requests', '.', 'Support', 'routers', ',', 'PBX', 'systems', ',', 'VoIP', 'phones', ',', 'switches', ',', 'WLAN', ""'s"", ',', 'firewalls', ',', 'and', 'remote', 'access', '.']","['The', 'Senior', 'Network/Voice', 'Engineer', 'responsible', 'wide', 'range', 'network', 'functionality', ',', 'architecting', 'configuring', 'PBXs', 'overseeing', 'voice', 'network', 'implementation', 'projects', '.', 'This', 'includes', 'managing', 'engineering', 'projects', 'Network', 'VoIP', 'initiatives', ',', 'planning', 'technology', 'roadmaps', 'configuring', 'optimizing', 'VoIP/PBX', 'telephone', 'network', 'systems', 'services', '.', 'Job', 'Duties', ':', 'Responsible', 'development', ',', 'implementation', 'support', 'reliable', ',', 'secure', 'scalable', 'voice', 'data', 'network', '.', 'Develop', 'deploy', 'strategic', 'voice', 'network', 'plans', 'meet', 'current', 'future', 'business', 'requirements', '.', 'Provide', 'technical', 'expertise', 'problem', 'resolution', 'escalated', 'requests', '.', 'Support', 'routers', ',', 'PBX', 'systems', ',', 'VoIP', 'phones', ',', 'switches', ',', 'WLAN', ""'s"", ',', 'firewalls', ',', 'remote', 'access', '.']","The Senior Network/Voice Engineer responsible wide range network functionality , architecting configuring PBXs overseeing voice network implementation projects . This includes managing engineering projects Network VoIP initiatives , planning technology roadmaps configuring optimizing VoIP/PBX telephone network systems services . Job Duties : Responsible development , implementation support reliable , secure scalable voice data network . Develop deploy strategic voice network plans meet current future business requirements . Provide technical expertise problem resolution escalated requests . Support routers , PBX systems , VoIP phones , switches , WLAN 's , firewalls , remote access ."
-1,-1,"We’re looking for problem solvers, innovators, and dreamers who are searching for anything but business as usual. Like us, you’re a high performer who’s an expert at your craft, constantly challenging the status quo. You value inclusivity and want to join a culture that empowers you to show up as your authentic self. You know that success hinges on commitment, that our differences make us stronger, and that the finish line is always sweeter when the whole team crosses together.
Alteryx is looking for a Customer Support Engineer in Broomfield, Irvine, or Plano Office.
We’re looking for problem solvers, innovators, and dreamers who are searching for anything but business as usual. Like us, you’re a high performer who’s an expert at your craft, constantly challenging the status quo. You value inclusivity and want to join a culture that empowers you to show up as your authentic self. You know that success hinges on commitment, that our differences make us stronger, and that the finish line is always sweeter when the whole team crosses together.","['We', '’', 're', 'looking', 'for', 'problem', 'solvers', ',', 'innovators', ',', 'and', 'dreamers', 'who', 'are', 'searching', 'for', 'anything', 'but', 'business', 'as', 'usual', '.', 'Like', 'us', ',', 'you', '’', 're', 'a', 'high', 'performer', 'who', '’', 's', 'an', 'expert', 'at', 'your', 'craft', ',', 'constantly', 'challenging', 'the', 'status', 'quo', '.', 'You', 'value', 'inclusivity', 'and', 'want', 'to', 'join', 'a', 'culture', 'that', 'empowers', 'you', 'to', 'show', 'up', 'as', 'your', 'authentic', 'self', '.', 'You', 'know', 'that', 'success', 'hinges', 'on', 'commitment', ',', 'that', 'our', 'differences', 'make', 'us', 'stronger', ',', 'and', 'that', 'the', 'finish', 'line', 'is', 'always', 'sweeter', 'when', 'the', 'whole', 'team', 'crosses', 'together', '.', 'Alteryx', 'is', 'looking', 'for', 'a', 'Customer', 'Support', 'Engineer', 'in', 'Broomfield', ',', 'Irvine', ',', 'or', 'Plano', 'Office', '.', 'We', '’', 're', 'looking', 'for', 'problem', 'solvers', ',', 'innovators', ',', 'and', 'dreamers', 'who', 'are', 'searching', 'for', 'anything', 'but', 'business', 'as', 'usual', '.', 'Like', 'us', ',', 'you', '’', 're', 'a', 'high', 'performer', 'who', '’', 's', 'an', 'expert', 'at', 'your', 'craft', ',', 'constantly', 'challenging', 'the', 'status', 'quo', '.', 'You', 'value', 'inclusivity', 'and', 'want', 'to', 'join', 'a', 'culture', 'that', 'empowers', 'you', 'to', 'show', 'up', 'as', 'your', 'authentic', 'self', '.', 'You', 'know', 'that', 'success', 'hinges', 'on', 'commitment', ',', 'that', 'our', 'differences', 'make', 'us', 'stronger', ',', 'and', 'that', 'the', 'finish', 'line', 'is', 'always', 'sweeter', 'when', 'the', 'whole', 'team', 'crosses', 'together', '.']","['We', '’', 'looking', 'problem', 'solvers', ',', 'innovators', ',', 'dreamers', 'searching', 'anything', 'business', 'usual', '.', 'Like', 'us', ',', '’', 'high', 'performer', '’', 'expert', 'craft', ',', 'constantly', 'challenging', 'status', 'quo', '.', 'You', 'value', 'inclusivity', 'want', 'join', 'culture', 'empowers', 'show', 'authentic', 'self', '.', 'You', 'know', 'success', 'hinges', 'commitment', ',', 'differences', 'make', 'us', 'stronger', ',', 'finish', 'line', 'always', 'sweeter', 'whole', 'team', 'crosses', 'together', '.', 'Alteryx', 'looking', 'Customer', 'Support', 'Engineer', 'Broomfield', ',', 'Irvine', ',', 'Plano', 'Office', '.', 'We', '’', 'looking', 'problem', 'solvers', ',', 'innovators', ',', 'dreamers', 'searching', 'anything', 'business', 'usual', '.', 'Like', 'us', ',', '’', 'high', 'performer', '’', 'expert', 'craft', ',', 'constantly', 'challenging', 'status', 'quo', '.', 'You', 'value', 'inclusivity', 'want', 'join', 'culture', 'empowers', 'show', 'authentic', 'self', '.', 'You', 'know', 'success', 'hinges', 'commitment', ',', 'differences', 'make', 'us', 'stronger', ',', 'finish', 'line', 'always', 'sweeter', 'whole', 'team', 'crosses', 'together', '.']","We ’ looking problem solvers , innovators , dreamers searching anything business usual . Like us , ’ high performer ’ expert craft , constantly challenging status quo . You value inclusivity want join culture empowers show authentic self . You know success hinges commitment , differences make us stronger , finish line always sweeter whole team crosses together . Alteryx looking Customer Support Engineer Broomfield , Irvine , Plano Office . We ’ looking problem solvers , innovators , dreamers searching anything business usual . Like us , ’ high performer ’ expert craft , constantly challenging status quo . You value inclusivity want join culture empowers show authentic self . You know success hinges commitment , differences make us stronger , finish line always sweeter whole team crosses together ."
-1,-1,"Provide a safe and healthy working environment implementing improvement systems to eliminate any work-related injuries and ensuring all employees understand all safety requirements.
Ensures that all practices, procedures, and criteria at the plant meet or exceed all standards and customer specifications.
Audits all production processes, equipment, and employee performances to assure that all prescribed quality procedures and systems are followed.
Work with cross functional teams to resolve quality and system issues. Support continuous improvement, preventative actions, and cross departmental decision making.
Translate customer requirements into systematic processes, production specifications, control plans, and process FMEAs using a cross-functional team.
Preferred","['Provide', 'a', 'safe', 'and', 'healthy', 'working', 'environment', 'implementing', 'improvement', 'systems', 'to', 'eliminate', 'any', 'work-related', 'injuries', 'and', 'ensuring', 'all', 'employees', 'understand', 'all', 'safety', 'requirements', '.', 'Ensures', 'that', 'all', 'practices', ',', 'procedures', ',', 'and', 'criteria', 'at', 'the', 'plant', 'meet', 'or', 'exceed', 'all', 'standards', 'and', 'customer', 'specifications', '.', 'Audits', 'all', 'production', 'processes', ',', 'equipment', ',', 'and', 'employee', 'performances', 'to', 'assure', 'that', 'all', 'prescribed', 'quality', 'procedures', 'and', 'systems', 'are', 'followed', '.', 'Work', 'with', 'cross', 'functional', 'teams', 'to', 'resolve', 'quality', 'and', 'system', 'issues', '.', 'Support', 'continuous', 'improvement', ',', 'preventative', 'actions', ',', 'and', 'cross', 'departmental', 'decision', 'making', '.', 'Translate', 'customer', 'requirements', 'into', 'systematic', 'processes', ',', 'production', 'specifications', ',', 'control', 'plans', ',', 'and', 'process', 'FMEAs', 'using', 'a', 'cross-functional', 'team', '.', 'Preferred']","['Provide', 'safe', 'healthy', 'working', 'environment', 'implementing', 'improvement', 'systems', 'eliminate', 'work-related', 'injuries', 'ensuring', 'employees', 'understand', 'safety', 'requirements', '.', 'Ensures', 'practices', ',', 'procedures', ',', 'criteria', 'plant', 'meet', 'exceed', 'standards', 'customer', 'specifications', '.', 'Audits', 'production', 'processes', ',', 'equipment', ',', 'employee', 'performances', 'assure', 'prescribed', 'quality', 'procedures', 'systems', 'followed', '.', 'Work', 'cross', 'functional', 'teams', 'resolve', 'quality', 'system', 'issues', '.', 'Support', 'continuous', 'improvement', ',', 'preventative', 'actions', ',', 'cross', 'departmental', 'decision', 'making', '.', 'Translate', 'customer', 'requirements', 'systematic', 'processes', ',', 'production', 'specifications', ',', 'control', 'plans', ',', 'process', 'FMEAs', 'using', 'cross-functional', 'team', '.', 'Preferred']","Provide safe healthy working environment implementing improvement systems eliminate work-related injuries ensuring employees understand safety requirements . Ensures practices , procedures , criteria plant meet exceed standards customer specifications . Audits production processes , equipment , employee performances assure prescribed quality procedures systems followed . Work cross functional teams resolve quality system issues . Support continuous improvement , preventative actions , cross departmental decision making . Translate customer requirements systematic processes , production specifications , control plans , process FMEAs using cross-functional team . Preferred"
-1,-1,"2nd Shift Server and Networking Engineer
The Network Server & Helpdesk Administrator ensures that users receive the highest level of customer service by managing task requests, promoting best practices for helpdesk and ticketing systems, and providing backup support as needed.
Responsibilities:
Providing helpdesk support to variable business unit end-users for technical support.
Responding to technical-related emails, telephone calls, and voicemail.
Resolving calls at either first or second levels of support and escalating as appropriate.
Providing backfill response and support for either phone-based support or deskside support.","['2nd', 'Shift', 'Server', 'and', 'Networking', 'Engineer', 'The', 'Network', 'Server', '&', 'Helpdesk', 'Administrator', 'ensures', 'that', 'users', 'receive', 'the', 'highest', 'level', 'of', 'customer', 'service', 'by', 'managing', 'task', 'requests', ',', 'promoting', 'best', 'practices', 'for', 'helpdesk', 'and', 'ticketing', 'systems', ',', 'and', 'providing', 'backup', 'support', 'as', 'needed', '.', 'Responsibilities', ':', 'Providing', 'helpdesk', 'support', 'to', 'variable', 'business', 'unit', 'end-users', 'for', 'technical', 'support', '.', 'Responding', 'to', 'technical-related', 'emails', ',', 'telephone', 'calls', ',', 'and', 'voicemail', '.', 'Resolving', 'calls', 'at', 'either', 'first', 'or', 'second', 'levels', 'of', 'support', 'and', 'escalating', 'as', 'appropriate', '.', 'Providing', 'backfill', 'response', 'and', 'support', 'for', 'either', 'phone-based', 'support', 'or', 'deskside', 'support', '.']","['2nd', 'Shift', 'Server', 'Networking', 'Engineer', 'The', 'Network', 'Server', '&', 'Helpdesk', 'Administrator', 'ensures', 'users', 'receive', 'highest', 'level', 'customer', 'service', 'managing', 'task', 'requests', ',', 'promoting', 'best', 'practices', 'helpdesk', 'ticketing', 'systems', ',', 'providing', 'backup', 'support', 'needed', '.', 'Responsibilities', ':', 'Providing', 'helpdesk', 'support', 'variable', 'business', 'unit', 'end-users', 'technical', 'support', '.', 'Responding', 'technical-related', 'emails', ',', 'telephone', 'calls', ',', 'voicemail', '.', 'Resolving', 'calls', 'either', 'first', 'second', 'levels', 'support', 'escalating', 'appropriate', '.', 'Providing', 'backfill', 'response', 'support', 'either', 'phone-based', 'support', 'deskside', 'support', '.']","2nd Shift Server Networking Engineer The Network Server & Helpdesk Administrator ensures users receive highest level customer service managing task requests , promoting best practices helpdesk ticketing systems , providing backup support needed . Responsibilities : Providing helpdesk support variable business unit end-users technical support . Responding technical-related emails , telephone calls , voicemail . Resolving calls either first second levels support escalating appropriate . Providing backfill response support either phone-based support deskside support ."
-1,-1,"Senior Network Engineer(Job Number: 2103232)
Description

Major Responsibilities:
Management, maintenance, and support of Company’s Windows/Linux servers and DellEMC storage platforms
Ensures proper change management processes are followed at all times
Analyze system / software performance and make adjustments based on any identified problems while insuring it is
utilized at its highest capacity
Perform disaster recovery planning and testing
performance","['Senior', 'Network', 'Engineer', '(', 'Job', 'Number', ':', '2103232', ')', 'Description', 'Major', 'Responsibilities', ':', 'Management', ',', 'maintenance', ',', 'and', 'support', 'of', 'Company', '’', 's', 'Windows/Linux', 'servers', 'and', 'DellEMC', 'storage', 'platforms', 'Ensures', 'proper', 'change', 'management', 'processes', 'are', 'followed', 'at', 'all', 'times', 'Analyze', 'system', '/', 'software', 'performance', 'and', 'make', 'adjustments', 'based', 'on', 'any', 'identified', 'problems', 'while', 'insuring', 'it', 'is', 'utilized', 'at', 'its', 'highest', 'capacity', 'Perform', 'disaster', 'recovery', 'planning', 'and', 'testing', 'performance']","['Senior', 'Network', 'Engineer', '(', 'Job', 'Number', ':', '2103232', ')', 'Description', 'Major', 'Responsibilities', ':', 'Management', ',', 'maintenance', ',', 'support', 'Company', '’', 'Windows/Linux', 'servers', 'DellEMC', 'storage', 'platforms', 'Ensures', 'proper', 'change', 'management', 'processes', 'followed', 'times', 'Analyze', 'system', '/', 'software', 'performance', 'make', 'adjustments', 'based', 'identified', 'problems', 'insuring', 'utilized', 'highest', 'capacity', 'Perform', 'disaster', 'recovery', 'planning', 'testing', 'performance']","Senior Network Engineer ( Job Number : 2103232 ) Description Major Responsibilities : Management , maintenance , support Company ’ Windows/Linux servers DellEMC storage platforms Ensures proper change management processes followed times Analyze system / software performance make adjustments based identified problems insuring utilized highest capacity Perform disaster recovery planning testing performance"
