Job Title,Company Name,Job Description,Tokenized,Stop Words Removed,Finished Text
-1,-1,"Don’t just land a job. Launch your future.

Our all-in-one software platform gives HR pros a way to easily manage daily tasks in payroll, benefits, talent, and workforce management.

But what makes us different is that our technology is backed by a culture that cares. We care about our team members, clients, and partners – because people matter most. And people have always been at the heart of our business.

Since our founding in 1997, this is the thing that's stayed the same, from our employees to the millions of users nationwide that access our platform. We pride ourselves on partnering with our clients to build the workplace they and their employees crave.

Let's go forward together.


Delivering one-of-a-kind cloud technology, accompanied by award winning customer service, Paylocityis a software development company in a category of its own. We are a publicly traded company that offers an Employee Stock Purchase Program (ESPP) which enables employees to share in the long-term growth and future success of the company.

Poised to revolutionize the world of human capital management for hundreds of thousands of small and medium sized businesses, we are seeking the best and the brightest to help us create the future of our talent solutions –enabling our customers to better develop their employees and supervisors.

Our talent anywhere philosophy nurtures a diverse and dynamic group of colleagues with a shared mission to make great products and have fun doing it.

The Network Engineer is responsible for administration and availability of our network infrastructure systems. In this role you will be responsible to monitor network connectivity and ensure reliable and consistent data transmission while providing technical support to various departments and users with regards to LAN/WAN and cloud-based networks. In addition, you will also maintain network availability, resolve daily incidents, and lead projects through to completion.

As a member of Paylocity’s Tech Delivery and Enablement (TDE) team, this person would be looked upon as a resource for all areas of technology. Our TDE department enjoys finding the right tool for the job, so we use a combination of commercial, open source, and custom-built solutions. Our team’s unique structure allows each member the freedom to perform tasks in their own way. Because we manage a wide variety of systems, one will rarely be locked into working on a single task. Additionally, each TDE member is encouraged to grow in experience and technical knowledge by pursuing certifications and experimenting with new technology.

Are you the teammate we are looking for?

Schaumburg, IL

TDE Manager



Small, self-sufficient teams with an entrepreneurial spirit

We don’t add more folks to our teams, we add additional teams to scale

Casual, collaborative, agile environment which embraces and operates under our shared principles

Complete transparency with open, honest discussions about our progress

Close working relationship between executive stakeholders and customers


Lean enabling process that focuses on putting our customers in the best position to succeed

A commitment to investing in our products, hiring the best talent, and giving them the chance to meaningfully contribute to a vast market opportunity

A subscription to an Online Training Forum for all technology colleagues


Performed maintenance, and upgrade of networks, including routers, switches, firewalls, and network management systems

Designed and implemented projects within multiple infrastructure domains including switches, load balancers, and firewalls with a focus on traffic optimization

Lead projects to completion with minimal supervision

Participated in high level architecture design sessions with vendors

Utilized lab or virtual environments to prove out potential solutions through mature proof of concept

Presented networking technical changes to a Change Advisory board

Partnered with stakeholders to collaborate on tools, solutions and drive efficiencies

Ensured continuous health of network through monitoring/alerting tools

Created and updated scripts to automate manual processes

Participated in on-call rotation and perform off-hours work as needed


7+years of relevant work experience in a networking and infrastructure role

Current Cisco professional certifications CCNP/CCIE (routing and switching, data center, security)

Expert with networking and virtualization technologies, certification or equivalent skillset

Expert working on enterprise level networking across multiple data centers

Proficient with next generation firewalls and security best practices

Proficient with one or more scripting languages such as PowerShell or Python

Proficient understanding of monitoring and security best practices

Strong knowledge of HTTPS and load-balancing

Working knowledge and experience in disaster recovery and best practices

Experience with public cloud offerings and working in hybrid cloud architectures

Ability to multitask, while still meeting ticket and project deadlines

Lead projects working across multiple disciplines in order to produce results

Experience orchestrating large deployments of network devices through scripting technologies

Ability to work both independently and as part of a team

5 –10% travel required annually


A strong love of learning and a willingness to take on new challenges

Excellent written and verbal communication skills and the ability to interact effectively with both technical and non-technical individuals

Curious and interested in staying current by leveraging new technologies to our advantage

Able to work in a collaborative environment with a willingness to share your ideas

Able to work independently and complete tasks with high quality, but unafraid to seek out suggestions from other team members

Driven to seek out complete technical comprehension for complex problems

If you are a Colorado resident, you may be eligible to receive additional information about the compensation and benefits for this role, which we will provide upon your request. You may contact recruitment@paylocity for assistance.

Our journey forward.

Paylocity strives to create an organizational culture where every employee has a voice, feels truly welcome, appreciated, and free to be themselves, and is empowered and enabled to do their best work. A strong commitment to diversity, equity, and inclusion is critical to creating such a culture.

We’ve made great strides to support diversity, equity, and inclusion. That being said, we realize there’s still room for improvement. Our current focus is on the following initiatives:

Education & Awareness

Client Community

Company Representation

Advocacy & Support

Fairness & Equality

PCTY Gives
Want to learn more, click here to access our DEI flipbook. https://www.flipsnack.com/paylocitycom/diversity-equity-and-inclusion.html

This job description has been written to provide an accurate reflection of the current job and to include the general nature of work performed. It is not designed to contain a comprehensive detailed inventory of all duties, responsibilities, and qualifications required of the employees assigned to the job. Management reserves the right to revise the job or require that other or different tasks be performed when circumstances change.","['Don', '’', 't', 'just', 'land', 'a', 'job', '.', 'Launch', 'your', 'future', '.', 'Our', 'all-in-one', 'software', 'platform', 'gives', 'HR', 'pros', 'a', 'way', 'to', 'easily', 'manage', 'daily', 'tasks', 'in', 'payroll', ',', 'benefits', ',', 'talent', ',', 'and', 'workforce', 'management', '.', 'But', 'what', 'makes', 'us', 'different', 'is', 'that', 'our', 'technology', 'is', 'backed', 'by', 'a', 'culture', 'that', 'cares', '.', 'We', 'care', 'about', 'our', 'team', 'members', ',', 'clients', ',', 'and', 'partners', '–', 'because', 'people', 'matter', 'most', '.', 'And', 'people', 'have', 'always', 'been', 'at', 'the', 'heart', 'of', 'our', 'business', '.', 'Since', 'our', 'founding', 'in', '1997', ',', 'this', 'is', 'the', 'thing', 'that', ""'s"", 'stayed', 'the', 'same', ',', 'from', 'our', 'employees', 'to', 'the', 'millions', 'of', 'users', 'nationwide', 'that', 'access', 'our', 'platform', '.', 'We', 'pride', 'ourselves', 'on', 'partnering', 'with', 'our', 'clients', 'to', 'build', 'the', 'workplace', 'they', 'and', 'their', 'employees', 'crave', '.', 'Let', ""'s"", 'go', 'forward', 'together', '.', 'Delivering', 'one-of-a-kind', 'cloud', 'technology', ',', 'accompanied', 'by', 'award', 'winning', 'customer', 'service', ',', 'Paylocityis', 'a', 'software', 'development', 'company', 'in', 'a', 'category', 'of', 'its', 'own', '.', 'We', 'are', 'a', 'publicly', 'traded', 'company', 'that', 'offers', 'an', 'Employee', 'Stock', 'Purchase', 'Program', '(', 'ESPP', ')', 'which', 'enables', 'employees', 'to', 'share', 'in', 'the', 'long-term', 'growth', 'and', 'future', 'success', 'of', 'the', 'company', '.', 'Poised', 'to', 'revolutionize', 'the', 'world', 'of', 'human', 'capital', 'management', 'for', 'hundreds', 'of', 'thousands', 'of', 'small', 'and', 'medium', 'sized', 'businesses', ',', 'we', 'are', 'seeking', 'the', 'best', 'and', 'the', 'brightest', 'to', 'help', 'us', 'create', 'the', 'future', 'of', 'our', 'talent', 'solutions', '–enabling', 'our', 'customers', 'to', 'better', 'develop', 'their', 'employees', 'and', 'supervisors', '.', 'Our', 'talent', 'anywhere', 'philosophy', 'nurtures', 'a', 'diverse', 'and', 'dynamic', 'group', 'of', 'colleagues', 'with', 'a', 'shared', 'mission', 'to', 'make', 'great', 'products', 'and', 'have', 'fun', 'doing', 'it', '.', 'The', 'Network', 'Engineer', 'is', 'responsible', 'for', 'administration', 'and', 'availability', 'of', 'our', 'network', 'infrastructure', 'systems', '.', 'In', 'this', 'role', 'you', 'will', 'be', 'responsible', 'to', 'monitor', 'network', 'connectivity', 'and', 'ensure', 'reliable', 'and', 'consistent', 'data', 'transmission', 'while', 'providing', 'technical', 'support', 'to', 'various', 'departments', 'and', 'users', 'with', 'regards', 'to', 'LAN/WAN', 'and', 'cloud-based', 'networks', '.', 'In', 'addition', ',', 'you', 'will', 'also', 'maintain', 'network', 'availability', ',', 'resolve', 'daily', 'incidents', ',', 'and', 'lead', 'projects', 'through', 'to', 'completion', '.', 'As', 'a', 'member', 'of', 'Paylocity', '’', 's', 'Tech', 'Delivery', 'and', 'Enablement', '(', 'TDE', ')', 'team', ',', 'this', 'person', 'would', 'be', 'looked', 'upon', 'as', 'a', 'resource', 'for', 'all', 'areas', 'of', 'technology', '.', 'Our', 'TDE', 'department', 'enjoys', 'finding', 'the', 'right', 'tool', 'for', 'the', 'job', ',', 'so', 'we', 'use', 'a', 'combination', 'of', 'commercial', ',', 'open', 'source', ',', 'and', 'custom-built', 'solutions', '.', 'Our', 'team', '’', 's', 'unique', 'structure', 'allows', 'each', 'member', 'the', 'freedom', 'to', 'perform', 'tasks', 'in', 'their', 'own', 'way', '.', 'Because', 'we', 'manage', 'a', 'wide', 'variety', 'of', 'systems', ',', 'one', 'will', 'rarely', 'be', 'locked', 'into', 'working', 'on', 'a', 'single', 'task', '.', 'Additionally', ',', 'each', 'TDE', 'member', 'is', 'encouraged', 'to', 'grow', 'in', 'experience', 'and', 'technical', 'knowledge', 'by', 'pursuing', 'certifications', 'and', 'experimenting', 'with', 'new', 'technology', '.', 'Are', 'you', 'the', 'teammate', 'we', 'are', 'looking', 'for', '?', 'Schaumburg', ',', 'IL', 'TDE', 'Manager', 'Small', ',', 'self-sufficient', 'teams', 'with', 'an', 'entrepreneurial', 'spirit', 'We', 'don', '’', 't', 'add', 'more', 'folks', 'to', 'our', 'teams', ',', 'we', 'add', 'additional', 'teams', 'to', 'scale', 'Casual', ',', 'collaborative', ',', 'agile', 'environment', 'which', 'embraces', 'and', 'operates', 'under', 'our', 'shared', 'principles', 'Complete', 'transparency', 'with', 'open', ',', 'honest', 'discussions', 'about', 'our', 'progress', 'Close', 'working', 'relationship', 'between', 'executive', 'stakeholders', 'and', 'customers', 'Lean', 'enabling', 'process', 'that', 'focuses', 'on', 'putting', 'our', 'customers', 'in', 'the', 'best', 'position', 'to', 'succeed', 'A', 'commitment', 'to', 'investing', 'in', 'our', 'products', ',', 'hiring', 'the', 'best', 'talent', ',', 'and', 'giving', 'them', 'the', 'chance', 'to', 'meaningfully', 'contribute', 'to', 'a', 'vast', 'market', 'opportunity', 'A', 'subscription', 'to', 'an', 'Online', 'Training', 'Forum', 'for', 'all', 'technology', 'colleagues', 'Performed', 'maintenance', ',', 'and', 'upgrade', 'of', 'networks', ',', 'including', 'routers', ',', 'switches', ',', 'firewalls', ',', 'and', 'network', 'management', 'systems', 'Designed', 'and', 'implemented', 'projects', 'within', 'multiple', 'infrastructure', 'domains', 'including', 'switches', ',', 'load', 'balancers', ',', 'and', 'firewalls', 'with', 'a', 'focus', 'on', 'traffic', 'optimization', 'Lead', 'projects', 'to', 'completion', 'with', 'minimal', 'supervision', 'Participated', 'in', 'high', 'level', 'architecture', 'design', 'sessions', 'with', 'vendors', 'Utilized', 'lab', 'or', 'virtual', 'environments', 'to', 'prove', 'out', 'potential', 'solutions', 'through', 'mature', 'proof', 'of', 'concept', 'Presented', 'networking', 'technical', 'changes', 'to', 'a', 'Change', 'Advisory', 'board', 'Partnered', 'with', 'stakeholders', 'to', 'collaborate', 'on', 'tools', ',', 'solutions', 'and', 'drive', 'efficiencies', 'Ensured', 'continuous', 'health', 'of', 'network', 'through', 'monitoring/alerting', 'tools', 'Created', 'and', 'updated', 'scripts', 'to', 'automate', 'manual', 'processes', 'Participated', 'in', 'on-call', 'rotation', 'and', 'perform', 'off-hours', 'work', 'as', 'needed', '7+years', 'of', 'relevant', 'work', 'experience', 'in', 'a', 'networking', 'and', 'infrastructure', 'role', 'Current', 'Cisco', 'professional', 'certifications', 'CCNP/CCIE', '(', 'routing', 'and', 'switching', ',', 'data', 'center', ',', 'security', ')', 'Expert', 'with', 'networking', 'and', 'virtualization', 'technologies', ',', 'certification', 'or', 'equivalent', 'skillset', 'Expert', 'working', 'on', 'enterprise', 'level', 'networking', 'across', 'multiple', 'data', 'centers', 'Proficient', 'with', 'next', 'generation', 'firewalls', 'and', 'security', 'best', 'practices', 'Proficient', 'with', 'one', 'or', 'more', 'scripting', 'languages', 'such', 'as', 'PowerShell', 'or', 'Python', 'Proficient', 'understanding', 'of', 'monitoring', 'and', 'security', 'best', 'practices', 'Strong', 'knowledge', 'of', 'HTTPS', 'and', 'load-balancing', 'Working', 'knowledge', 'and', 'experience', 'in', 'disaster', 'recovery', 'and', 'best', 'practices', 'Experience', 'with', 'public', 'cloud', 'offerings', 'and', 'working', 'in', 'hybrid', 'cloud', 'architectures', 'Ability', 'to', 'multitask', ',', 'while', 'still', 'meeting', 'ticket', 'and', 'project', 'deadlines', 'Lead', 'projects', 'working', 'across', 'multiple', 'disciplines', 'in', 'order', 'to', 'produce', 'results', 'Experience', 'orchestrating', 'large', 'deployments', 'of', 'network', 'devices', 'through', 'scripting', 'technologies', 'Ability', 'to', 'work', 'both', 'independently', 'and', 'as', 'part', 'of', 'a', 'team', '5', '–10', '%', 'travel', 'required', 'annually', 'A', 'strong', 'love', 'of', 'learning', 'and', 'a', 'willingness', 'to', 'take', 'on', 'new', 'challenges', 'Excellent', 'written', 'and', 'verbal', 'communication', 'skills', 'and', 'the', 'ability', 'to', 'interact', 'effectively', 'with', 'both', 'technical', 'and', 'non-technical', 'individuals', 'Curious', 'and', 'interested', 'in', 'staying', 'current', 'by', 'leveraging', 'new', 'technologies', 'to', 'our', 'advantage', 'Able', 'to', 'work', 'in', 'a', 'collaborative', 'environment', 'with', 'a', 'willingness', 'to', 'share', 'your', 'ideas', 'Able', 'to', 'work', 'independently', 'and', 'complete', 'tasks', 'with', 'high', 'quality', ',', 'but', 'unafraid', 'to', 'seek', 'out', 'suggestions', 'from', 'other', 'team', 'members', 'Driven', 'to', 'seek', 'out', 'complete', 'technical', 'comprehension', 'for', 'complex', 'problems', 'If', 'you', 'are', 'a', 'Colorado', 'resident', ',', 'you', 'may', 'be', 'eligible', 'to', 'receive', 'additional', 'information', 'about', 'the', 'compensation', 'and', 'benefits', 'for', 'this', 'role', ',', 'which', 'we', 'will', 'provide', 'upon', 'your', 'request', '.', 'You', 'may', 'contact', 'recruitment', '@', 'paylocity', 'for', 'assistance', '.', 'Our', 'journey', 'forward', '.', 'Paylocity', 'strives', 'to', 'create', 'an', 'organizational', 'culture', 'where', 'every', 'employee', 'has', 'a', 'voice', ',', 'feels', 'truly', 'welcome', ',', 'appreciated', ',', 'and', 'free', 'to', 'be', 'themselves', ',', 'and', 'is', 'empowered', 'and', 'enabled', 'to', 'do', 'their', 'best', 'work', '.', 'A', 'strong', 'commitment', 'to', 'diversity', ',', 'equity', ',', 'and', 'inclusion', 'is', 'critical', 'to', 'creating', 'such', 'a', 'culture', '.', 'We', '’', 've', 'made', 'great', 'strides', 'to', 'support', 'diversity', ',', 'equity', ',', 'and', 'inclusion', '.', 'That', 'being', 'said', ',', 'we', 'realize', 'there', '’', 's', 'still', 'room', 'for', 'improvement', '.', 'Our', 'current', 'focus', 'is', 'on', 'the', 'following', 'initiatives', ':', 'Education', '&', 'Awareness', 'Client', 'Community', 'Company', 'Representation', 'Advocacy', '&', 'Support', 'Fairness', '&', 'Equality', 'PCTY', 'Gives', 'Want', 'to', 'learn', 'more', ',', 'click', 'here', 'to', 'access', 'our', 'DEI', 'flipbook', '.', 'https', ':', '//www.flipsnack.com/paylocitycom/diversity-equity-and-inclusion.html', 'This', 'job', 'description', 'has', 'been', 'written', 'to', 'provide', 'an', 'accurate', 'reflection', 'of', 'the', 'current', 'job', 'and', 'to', 'include', 'the', 'general', 'nature', 'of', 'work', 'performed', '.', 'It', 'is', 'not', 'designed', 'to', 'contain', 'a', 'comprehensive', 'detailed', 'inventory', 'of', 'all', 'duties', ',', 'responsibilities', ',', 'and', 'qualifications', 'required', 'of', 'the', 'employees', 'assigned', 'to', 'the', 'job', '.', 'Management', 'reserves', 'the', 'right', 'to', 'revise', 'the', 'job', 'or', 'require', 'that', 'other', 'or', 'different', 'tasks', 'be', 'performed', 'when', 'circumstances', 'change', '.']","['Don', '’', 'land', 'job', '.', 'Launch', 'future', '.', 'Our', 'all-in-one', 'software', 'platform', 'gives', 'HR', 'pros', 'way', 'easily', 'manage', 'daily', 'tasks', 'payroll', ',', 'benefits', ',', 'talent', ',', 'workforce', 'management', '.', 'But', 'makes', 'us', 'different', 'technology', 'backed', 'culture', 'cares', '.', 'We', 'care', 'team', 'members', ',', 'clients', ',', 'partners', '–', 'people', 'matter', '.', 'And', 'people', 'always', 'heart', 'business', '.', 'Since', 'founding', '1997', ',', 'thing', ""'s"", 'stayed', ',', 'employees', 'millions', 'users', 'nationwide', 'access', 'platform', '.', 'We', 'pride', 'partnering', 'clients', 'build', 'workplace', 'employees', 'crave', '.', 'Let', ""'s"", 'go', 'forward', 'together', '.', 'Delivering', 'one-of-a-kind', 'cloud', 'technology', ',', 'accompanied', 'award', 'winning', 'customer', 'service', ',', 'Paylocityis', 'software', 'development', 'company', 'category', '.', 'We', 'publicly', 'traded', 'company', 'offers', 'Employee', 'Stock', 'Purchase', 'Program', '(', 'ESPP', ')', 'enables', 'employees', 'share', 'long-term', 'growth', 'future', 'success', 'company', '.', 'Poised', 'revolutionize', 'world', 'human', 'capital', 'management', 'hundreds', 'thousands', 'small', 'medium', 'sized', 'businesses', ',', 'seeking', 'best', 'brightest', 'help', 'us', 'create', 'future', 'talent', 'solutions', '–enabling', 'customers', 'better', 'develop', 'employees', 'supervisors', '.', 'Our', 'talent', 'anywhere', 'philosophy', 'nurtures', 'diverse', 'dynamic', 'group', 'colleagues', 'shared', 'mission', 'make', 'great', 'products', 'fun', '.', 'The', 'Network', 'Engineer', 'responsible', 'administration', 'availability', 'network', 'infrastructure', 'systems', '.', 'In', 'role', 'responsible', 'monitor', 'network', 'connectivity', 'ensure', 'reliable', 'consistent', 'data', 'transmission', 'providing', 'technical', 'support', 'various', 'departments', 'users', 'regards', 'LAN/WAN', 'cloud-based', 'networks', '.', 'In', 'addition', ',', 'also', 'maintain', 'network', 'availability', ',', 'resolve', 'daily', 'incidents', ',', 'lead', 'projects', 'completion', '.', 'As', 'member', 'Paylocity', '’', 'Tech', 'Delivery', 'Enablement', '(', 'TDE', ')', 'team', ',', 'person', 'would', 'looked', 'upon', 'resource', 'areas', 'technology', '.', 'Our', 'TDE', 'department', 'enjoys', 'finding', 'right', 'tool', 'job', ',', 'use', 'combination', 'commercial', ',', 'open', 'source', ',', 'custom-built', 'solutions', '.', 'Our', 'team', '’', 'unique', 'structure', 'allows', 'member', 'freedom', 'perform', 'tasks', 'way', '.', 'Because', 'manage', 'wide', 'variety', 'systems', ',', 'one', 'rarely', 'locked', 'working', 'single', 'task', '.', 'Additionally', ',', 'TDE', 'member', 'encouraged', 'grow', 'experience', 'technical', 'knowledge', 'pursuing', 'certifications', 'experimenting', 'new', 'technology', '.', 'Are', 'teammate', 'looking', '?', 'Schaumburg', ',', 'IL', 'TDE', 'Manager', 'Small', ',', 'self-sufficient', 'teams', 'entrepreneurial', 'spirit', 'We', '’', 'add', 'folks', 'teams', ',', 'add', 'additional', 'teams', 'scale', 'Casual', ',', 'collaborative', ',', 'agile', 'environment', 'embraces', 'operates', 'shared', 'principles', 'Complete', 'transparency', 'open', ',', 'honest', 'discussions', 'progress', 'Close', 'working', 'relationship', 'executive', 'stakeholders', 'customers', 'Lean', 'enabling', 'process', 'focuses', 'putting', 'customers', 'best', 'position', 'succeed', 'A', 'commitment', 'investing', 'products', ',', 'hiring', 'best', 'talent', ',', 'giving', 'chance', 'meaningfully', 'contribute', 'vast', 'market', 'opportunity', 'A', 'subscription', 'Online', 'Training', 'Forum', 'technology', 'colleagues', 'Performed', 'maintenance', ',', 'upgrade', 'networks', ',', 'including', 'routers', ',', 'switches', ',', 'firewalls', ',', 'network', 'management', 'systems', 'Designed', 'implemented', 'projects', 'within', 'multiple', 'infrastructure', 'domains', 'including', 'switches', ',', 'load', 'balancers', ',', 'firewalls', 'focus', 'traffic', 'optimization', 'Lead', 'projects', 'completion', 'minimal', 'supervision', 'Participated', 'high', 'level', 'architecture', 'design', 'sessions', 'vendors', 'Utilized', 'lab', 'virtual', 'environments', 'prove', 'potential', 'solutions', 'mature', 'proof', 'concept', 'Presented', 'networking', 'technical', 'changes', 'Change', 'Advisory', 'board', 'Partnered', 'stakeholders', 'collaborate', 'tools', ',', 'solutions', 'drive', 'efficiencies', 'Ensured', 'continuous', 'health', 'network', 'monitoring/alerting', 'tools', 'Created', 'updated', 'scripts', 'automate', 'manual', 'processes', 'Participated', 'on-call', 'rotation', 'perform', 'off-hours', 'work', 'needed', '7+years', 'relevant', 'work', 'experience', 'networking', 'infrastructure', 'role', 'Current', 'Cisco', 'professional', 'certifications', 'CCNP/CCIE', '(', 'routing', 'switching', ',', 'data', 'center', ',', 'security', ')', 'Expert', 'networking', 'virtualization', 'technologies', ',', 'certification', 'equivalent', 'skillset', 'Expert', 'working', 'enterprise', 'level', 'networking', 'across', 'multiple', 'data', 'centers', 'Proficient', 'next', 'generation', 'firewalls', 'security', 'best', 'practices', 'Proficient', 'one', 'scripting', 'languages', 'PowerShell', 'Python', 'Proficient', 'understanding', 'monitoring', 'security', 'best', 'practices', 'Strong', 'knowledge', 'HTTPS', 'load-balancing', 'Working', 'knowledge', 'experience', 'disaster', 'recovery', 'best', 'practices', 'Experience', 'public', 'cloud', 'offerings', 'working', 'hybrid', 'cloud', 'architectures', 'Ability', 'multitask', ',', 'still', 'meeting', 'ticket', 'project', 'deadlines', 'Lead', 'projects', 'working', 'across', 'multiple', 'disciplines', 'order', 'produce', 'results', 'Experience', 'orchestrating', 'large', 'deployments', 'network', 'devices', 'scripting', 'technologies', 'Ability', 'work', 'independently', 'part', 'team', '5', '–10', '%', 'travel', 'required', 'annually', 'A', 'strong', 'love', 'learning', 'willingness', 'take', 'new', 'challenges', 'Excellent', 'written', 'verbal', 'communication', 'skills', 'ability', 'interact', 'effectively', 'technical', 'non-technical', 'individuals', 'Curious', 'interested', 'staying', 'current', 'leveraging', 'new', 'technologies', 'advantage', 'Able', 'work', 'collaborative', 'environment', 'willingness', 'share', 'ideas', 'Able', 'work', 'independently', 'complete', 'tasks', 'high', 'quality', ',', 'unafraid', 'seek', 'suggestions', 'team', 'members', 'Driven', 'seek', 'complete', 'technical', 'comprehension', 'complex', 'problems', 'If', 'Colorado', 'resident', ',', 'may', 'eligible', 'receive', 'additional', 'information', 'compensation', 'benefits', 'role', ',', 'provide', 'upon', 'request', '.', 'You', 'may', 'contact', 'recruitment', '@', 'paylocity', 'assistance', '.', 'Our', 'journey', 'forward', '.', 'Paylocity', 'strives', 'create', 'organizational', 'culture', 'every', 'employee', 'voice', ',', 'feels', 'truly', 'welcome', ',', 'appreciated', ',', 'free', ',', 'empowered', 'enabled', 'best', 'work', '.', 'A', 'strong', 'commitment', 'diversity', ',', 'equity', ',', 'inclusion', 'critical', 'creating', 'culture', '.', 'We', '’', 'made', 'great', 'strides', 'support', 'diversity', ',', 'equity', ',', 'inclusion', '.', 'That', 'said', ',', 'realize', '’', 'still', 'room', 'improvement', '.', 'Our', 'current', 'focus', 'following', 'initiatives', ':', 'Education', '&', 'Awareness', 'Client', 'Community', 'Company', 'Representation', 'Advocacy', '&', 'Support', 'Fairness', '&', 'Equality', 'PCTY', 'Gives', 'Want', 'learn', ',', 'click', 'access', 'DEI', 'flipbook', '.', 'https', ':', '//www.flipsnack.com/paylocitycom/diversity-equity-and-inclusion.html', 'This', 'job', 'description', 'written', 'provide', 'accurate', 'reflection', 'current', 'job', 'include', 'general', 'nature', 'work', 'performed', '.', 'It', 'designed', 'contain', 'comprehensive', 'detailed', 'inventory', 'duties', ',', 'responsibilities', ',', 'qualifications', 'required', 'employees', 'assigned', 'job', '.', 'Management', 'reserves', 'right', 'revise', 'job', 'require', 'different', 'tasks', 'performed', 'circumstances', 'change', '.']","Don ’ land job . Launch future . Our all-in-one software platform gives HR pros way easily manage daily tasks payroll , benefits , talent , workforce management . But makes us different technology backed culture cares . We care team members , clients , partners – people matter . And people always heart business . Since founding 1997 , thing 's stayed , employees millions users nationwide access platform . We pride partnering clients build workplace employees crave . Let 's go forward together . Delivering one-of-a-kind cloud technology , accompanied award winning customer service , Paylocityis software development company category . We publicly traded company offers Employee Stock Purchase Program ( ESPP ) enables employees share long-term growth future success company . Poised revolutionize world human capital management hundreds thousands small medium sized businesses , seeking best brightest help us create future talent solutions –enabling customers better develop employees supervisors . Our talent anywhere philosophy nurtures diverse dynamic group colleagues shared mission make great products fun . The Network Engineer responsible administration availability network infrastructure systems . In role responsible monitor network connectivity ensure reliable consistent data transmission providing technical support various departments users regards LAN/WAN cloud-based networks . In addition , also maintain network availability , resolve daily incidents , lead projects completion . As member Paylocity ’ Tech Delivery Enablement ( TDE ) team , person would looked upon resource areas technology . Our TDE department enjoys finding right tool job , use combination commercial , open source , custom-built solutions . Our team ’ unique structure allows member freedom perform tasks way . Because manage wide variety systems , one rarely locked working single task . Additionally , TDE member encouraged grow experience technical knowledge pursuing certifications experimenting new technology . Are teammate looking ? Schaumburg , IL TDE Manager Small , self-sufficient teams entrepreneurial spirit We ’ add folks teams , add additional teams scale Casual , collaborative , agile environment embraces operates shared principles Complete transparency open , honest discussions progress Close working relationship executive stakeholders customers Lean enabling process focuses putting customers best position succeed A commitment investing products , hiring best talent , giving chance meaningfully contribute vast market opportunity A subscription Online Training Forum technology colleagues Performed maintenance , upgrade networks , including routers , switches , firewalls , network management systems Designed implemented projects within multiple infrastructure domains including switches , load balancers , firewalls focus traffic optimization Lead projects completion minimal supervision Participated high level architecture design sessions vendors Utilized lab virtual environments prove potential solutions mature proof concept Presented networking technical changes Change Advisory board Partnered stakeholders collaborate tools , solutions drive efficiencies Ensured continuous health network monitoring/alerting tools Created updated scripts automate manual processes Participated on-call rotation perform off-hours work needed 7+years relevant work experience networking infrastructure role Current Cisco professional certifications CCNP/CCIE ( routing switching , data center , security ) Expert networking virtualization technologies , certification equivalent skillset Expert working enterprise level networking across multiple data centers Proficient next generation firewalls security best practices Proficient one scripting languages PowerShell Python Proficient understanding monitoring security best practices Strong knowledge HTTPS load-balancing Working knowledge experience disaster recovery best practices Experience public cloud offerings working hybrid cloud architectures Ability multitask , still meeting ticket project deadlines Lead projects working across multiple disciplines order produce results Experience orchestrating large deployments network devices scripting technologies Ability work independently part team 5 –10 % travel required annually A strong love learning willingness take new challenges Excellent written verbal communication skills ability interact effectively technical non-technical individuals Curious interested staying current leveraging new technologies advantage Able work collaborative environment willingness share ideas Able work independently complete tasks high quality , unafraid seek suggestions team members Driven seek complete technical comprehension complex problems If Colorado resident , may eligible receive additional information compensation benefits role , provide upon request . You may contact recruitment @ paylocity assistance . Our journey forward . Paylocity strives create organizational culture every employee voice , feels truly welcome , appreciated , free , empowered enabled best work . A strong commitment diversity , equity , inclusion critical creating culture . We ’ made great strides support diversity , equity , inclusion . That said , realize ’ still room improvement . Our current focus following initiatives : Education & Awareness Client Community Company Representation Advocacy & Support Fairness & Equality PCTY Gives Want learn , click access DEI flipbook . https : //www.flipsnack.com/paylocitycom/diversity-equity-and-inclusion.html This job description written provide accurate reflection current job include general nature work performed . It designed contain comprehensive detailed inventory duties , responsibilities , qualifications required employees assigned job . Management reserves right revise job require different tasks performed circumstances change ."
