Job Title,Company Name,Job Description,Tokenized,Stop Words Removed,Finished Text
-1,-1,"Altran is the world leader in engineering and R&D services. We offer our clients a unique value proposition to meet their transformation and innovation challenges. We support our clients, from concept through industrialization, to develop the products and services of tomorrow and have been working for more than 35 years with major players in many sectors: automotive, aeronautics, space, defense & naval, rail, infrastructure & transportation, industrial & consumer products, life sciences, communications, semiconductor & electronics, software & internet, finance & public sector. Altran has more than 50,000 employees operating in over 30 countries. In April 2020, we became part of Capgemini, a global leader in consulting, digital transformation, technology and engineering services. Visit us at www.altran.com.
Job Title – Virtualization Network Consulting Engineer (Mobility)
Contract","['Altran', 'is', 'the', 'world', 'leader', 'in', 'engineering', 'and', 'R', '&', 'D', 'services', '.', 'We', 'offer', 'our', 'clients', 'a', 'unique', 'value', 'proposition', 'to', 'meet', 'their', 'transformation', 'and', 'innovation', 'challenges', '.', 'We', 'support', 'our', 'clients', ',', 'from', 'concept', 'through', 'industrialization', ',', 'to', 'develop', 'the', 'products', 'and', 'services', 'of', 'tomorrow', 'and', 'have', 'been', 'working', 'for', 'more', 'than', '35', 'years', 'with', 'major', 'players', 'in', 'many', 'sectors', ':', 'automotive', ',', 'aeronautics', ',', 'space', ',', 'defense', '&', 'naval', ',', 'rail', ',', 'infrastructure', '&', 'transportation', ',', 'industrial', '&', 'consumer', 'products', ',', 'life', 'sciences', ',', 'communications', ',', 'semiconductor', '&', 'electronics', ',', 'software', '&', 'internet', ',', 'finance', '&', 'public', 'sector', '.', 'Altran', 'has', 'more', 'than', '50,000', 'employees', 'operating', 'in', 'over', '30', 'countries', '.', 'In', 'April', '2020', ',', 'we', 'became', 'part', 'of', 'Capgemini', ',', 'a', 'global', 'leader', 'in', 'consulting', ',', 'digital', 'transformation', ',', 'technology', 'and', 'engineering', 'services', '.', 'Visit', 'us', 'at', 'www.altran.com', '.', 'Job', 'Title', '–', 'Virtualization', 'Network', 'Consulting', 'Engineer', '(', 'Mobility', ')', 'Contract']","['Altran', 'world', 'leader', 'engineering', 'R', '&', 'D', 'services', '.', 'We', 'offer', 'clients', 'unique', 'value', 'proposition', 'meet', 'transformation', 'innovation', 'challenges', '.', 'We', 'support', 'clients', ',', 'concept', 'industrialization', ',', 'develop', 'products', 'services', 'tomorrow', 'working', '35', 'years', 'major', 'players', 'many', 'sectors', ':', 'automotive', ',', 'aeronautics', ',', 'space', ',', 'defense', '&', 'naval', ',', 'rail', ',', 'infrastructure', '&', 'transportation', ',', 'industrial', '&', 'consumer', 'products', ',', 'life', 'sciences', ',', 'communications', ',', 'semiconductor', '&', 'electronics', ',', 'software', '&', 'internet', ',', 'finance', '&', 'public', 'sector', '.', 'Altran', '50,000', 'employees', 'operating', '30', 'countries', '.', 'In', 'April', '2020', ',', 'became', 'part', 'Capgemini', ',', 'global', 'leader', 'consulting', ',', 'digital', 'transformation', ',', 'technology', 'engineering', 'services', '.', 'Visit', 'us', 'www.altran.com', '.', 'Job', 'Title', '–', 'Virtualization', 'Network', 'Consulting', 'Engineer', '(', 'Mobility', ')', 'Contract']","Altran world leader engineering R & D services . We offer clients unique value proposition meet transformation innovation challenges . We support clients , concept industrialization , develop products services tomorrow working 35 years major players many sectors : automotive , aeronautics , space , defense & naval , rail , infrastructure & transportation , industrial & consumer products , life sciences , communications , semiconductor & electronics , software & internet , finance & public sector . Altran 50,000 employees operating 30 countries . In April 2020 , became part Capgemini , global leader consulting , digital transformation , technology engineering services . Visit us www.altran.com . Job Title – Virtualization Network Consulting Engineer ( Mobility ) Contract"
-1,-1,"Sr Network\Systems Engineer – Managed Service Provider (MSP)
We are seeking a Sr Network Engineer to join our growing Services Team. This team(Sr Projects) is the heart and soul of our Professional Services Team and provides solutions, projects and deployments to the Cloud. This can include O365, VMware, Advanced Networking and Proactive Managed Services onboarding setup.
The Sr. Network Engineer will be joining a privately-held 40+ employee IT company, servicing the small to mid-size market businesses with clients located across the US for the past 23 years. This is a team-oriented position, that requires interacting with clients (often times C level) to understand project needs and interfacing with your teammates/vendors/partners to develop and deliver outstanding solutions in a timely fashion.","['Sr', 'Network\\Systems', 'Engineer', '–', 'Managed', 'Service', 'Provider', '(', 'MSP', ')', 'We', 'are', 'seeking', 'a', 'Sr', 'Network', 'Engineer', 'to', 'join', 'our', 'growing', 'Services', 'Team', '.', 'This', 'team', '(', 'Sr', 'Projects', ')', 'is', 'the', 'heart', 'and', 'soul', 'of', 'our', 'Professional', 'Services', 'Team', 'and', 'provides', 'solutions', ',', 'projects', 'and', 'deployments', 'to', 'the', 'Cloud', '.', 'This', 'can', 'include', 'O365', ',', 'VMware', ',', 'Advanced', 'Networking', 'and', 'Proactive', 'Managed', 'Services', 'onboarding', 'setup', '.', 'The', 'Sr.', 'Network', 'Engineer', 'will', 'be', 'joining', 'a', 'privately-held', '40+', 'employee', 'IT', 'company', ',', 'servicing', 'the', 'small', 'to', 'mid-size', 'market', 'businesses', 'with', 'clients', 'located', 'across', 'the', 'US', 'for', 'the', 'past', '23', 'years', '.', 'This', 'is', 'a', 'team-oriented', 'position', ',', 'that', 'requires', 'interacting', 'with', 'clients', '(', 'often', 'times', 'C', 'level', ')', 'to', 'understand', 'project', 'needs', 'and', 'interfacing', 'with', 'your', 'teammates/vendors/partners', 'to', 'develop', 'and', 'deliver', 'outstanding', 'solutions', 'in', 'a', 'timely', 'fashion', '.']","['Sr', 'Network\\Systems', 'Engineer', '–', 'Managed', 'Service', 'Provider', '(', 'MSP', ')', 'We', 'seeking', 'Sr', 'Network', 'Engineer', 'join', 'growing', 'Services', 'Team', '.', 'This', 'team', '(', 'Sr', 'Projects', ')', 'heart', 'soul', 'Professional', 'Services', 'Team', 'provides', 'solutions', ',', 'projects', 'deployments', 'Cloud', '.', 'This', 'include', 'O365', ',', 'VMware', ',', 'Advanced', 'Networking', 'Proactive', 'Managed', 'Services', 'onboarding', 'setup', '.', 'The', 'Sr.', 'Network', 'Engineer', 'joining', 'privately-held', '40+', 'employee', 'IT', 'company', ',', 'servicing', 'small', 'mid-size', 'market', 'businesses', 'clients', 'located', 'across', 'US', 'past', '23', 'years', '.', 'This', 'team-oriented', 'position', ',', 'requires', 'interacting', 'clients', '(', 'often', 'times', 'C', 'level', ')', 'understand', 'project', 'needs', 'interfacing', 'teammates/vendors/partners', 'develop', 'deliver', 'outstanding', 'solutions', 'timely', 'fashion', '.']","Sr Network\Systems Engineer – Managed Service Provider ( MSP ) We seeking Sr Network Engineer join growing Services Team . This team ( Sr Projects ) heart soul Professional Services Team provides solutions , projects deployments Cloud . This include O365 , VMware , Advanced Networking Proactive Managed Services onboarding setup . The Sr. Network Engineer joining privately-held 40+ employee IT company , servicing small mid-size market businesses clients located across US past 23 years . This team-oriented position , requires interacting clients ( often times C level ) understand project needs interfacing teammates/vendors/partners develop deliver outstanding solutions timely fashion ."
-1,-1,"Are you a skilled problem solver and enjoy working with people? Are you highly motivated and self-disciplined? Do you have a real focus for customer satisfaction? If you answered yes to these question then we have the perfect career for you.
The perfect candidate must:
Demonstrate ability to identify and resolve problems in a timely and efficient manner
Demonstrate ability to communicate effectively with customers
Prove superior writing and oral communication skills
Prove desire to keep current with technologies relevant to business
Prove ability to manage difficult customer situations, respond promptly to the customer needs and solicit customer feedback to improve service","['Are', 'you', 'a', 'skilled', 'problem', 'solver', 'and', 'enjoy', 'working', 'with', 'people', '?', 'Are', 'you', 'highly', 'motivated', 'and', 'self-disciplined', '?', 'Do', 'you', 'have', 'a', 'real', 'focus', 'for', 'customer', 'satisfaction', '?', 'If', 'you', 'answered', 'yes', 'to', 'these', 'question', 'then', 'we', 'have', 'the', 'perfect', 'career', 'for', 'you', '.', 'The', 'perfect', 'candidate', 'must', ':', 'Demonstrate', 'ability', 'to', 'identify', 'and', 'resolve', 'problems', 'in', 'a', 'timely', 'and', 'efficient', 'manner', 'Demonstrate', 'ability', 'to', 'communicate', 'effectively', 'with', 'customers', 'Prove', 'superior', 'writing', 'and', 'oral', 'communication', 'skills', 'Prove', 'desire', 'to', 'keep', 'current', 'with', 'technologies', 'relevant', 'to', 'business', 'Prove', 'ability', 'to', 'manage', 'difficult', 'customer', 'situations', ',', 'respond', 'promptly', 'to', 'the', 'customer', 'needs', 'and', 'solicit', 'customer', 'feedback', 'to', 'improve', 'service']","['Are', 'skilled', 'problem', 'solver', 'enjoy', 'working', 'people', '?', 'Are', 'highly', 'motivated', 'self-disciplined', '?', 'Do', 'real', 'focus', 'customer', 'satisfaction', '?', 'If', 'answered', 'yes', 'question', 'perfect', 'career', '.', 'The', 'perfect', 'candidate', 'must', ':', 'Demonstrate', 'ability', 'identify', 'resolve', 'problems', 'timely', 'efficient', 'manner', 'Demonstrate', 'ability', 'communicate', 'effectively', 'customers', 'Prove', 'superior', 'writing', 'oral', 'communication', 'skills', 'Prove', 'desire', 'keep', 'current', 'technologies', 'relevant', 'business', 'Prove', 'ability', 'manage', 'difficult', 'customer', 'situations', ',', 'respond', 'promptly', 'customer', 'needs', 'solicit', 'customer', 'feedback', 'improve', 'service']","Are skilled problem solver enjoy working people ? Are highly motivated self-disciplined ? Do real focus customer satisfaction ? If answered yes question perfect career . The perfect candidate must : Demonstrate ability identify resolve problems timely efficient manner Demonstrate ability communicate effectively customers Prove superior writing oral communication skills Prove desire keep current technologies relevant business Prove ability manage difficult customer situations , respond promptly customer needs solicit customer feedback improve service"
-1,-1,"Overview:
Charlie’s Produce - Who We Are

Charlie's Produce is a privately owned wholesale produce company. We are the largest privately owned produce wholesaler on the West Coast, with distribution centers in Seattle, Spokane, Portland, Anchorage, Boise, Los Angeles, and Salt Lake City. The secret to our 40+ years of success in this industry is PEOPLE! We strive to hire the best and we reward them with a working environment that fosters loyalty, stability, innovation, and growth.
Charlie's provides a healthy employee stock ownership program, competitive Medical/Dental/Vision and Life Insurance plans. And our newest benefit offers Pre-Paid Fully Funded College Tuition to our employees and the dependent children of our employees after 1 year!

Responsibilities:






Qualifications:","['Overview', ':', 'Charlie', '’', 's', 'Produce', '-', 'Who', 'We', 'Are', 'Charlie', ""'s"", 'Produce', 'is', 'a', 'privately', 'owned', 'wholesale', 'produce', 'company', '.', 'We', 'are', 'the', 'largest', 'privately', 'owned', 'produce', 'wholesaler', 'on', 'the', 'West', 'Coast', ',', 'with', 'distribution', 'centers', 'in', 'Seattle', ',', 'Spokane', ',', 'Portland', ',', 'Anchorage', ',', 'Boise', ',', 'Los', 'Angeles', ',', 'and', 'Salt', 'Lake', 'City', '.', 'The', 'secret', 'to', 'our', '40+', 'years', 'of', 'success', 'in', 'this', 'industry', 'is', 'PEOPLE', '!', 'We', 'strive', 'to', 'hire', 'the', 'best', 'and', 'we', 'reward', 'them', 'with', 'a', 'working', 'environment', 'that', 'fosters', 'loyalty', ',', 'stability', ',', 'innovation', ',', 'and', 'growth', '.', 'Charlie', ""'s"", 'provides', 'a', 'healthy', 'employee', 'stock', 'ownership', 'program', ',', 'competitive', 'Medical/Dental/Vision', 'and', 'Life', 'Insurance', 'plans', '.', 'And', 'our', 'newest', 'benefit', 'offers', 'Pre-Paid', 'Fully', 'Funded', 'College', 'Tuition', 'to', 'our', 'employees', 'and', 'the', 'dependent', 'children', 'of', 'our', 'employees', 'after', '1', 'year', '!', 'Responsibilities', ':', 'Qualifications', ':']","['Overview', ':', 'Charlie', '’', 'Produce', '-', 'Who', 'We', 'Are', 'Charlie', ""'s"", 'Produce', 'privately', 'owned', 'wholesale', 'produce', 'company', '.', 'We', 'largest', 'privately', 'owned', 'produce', 'wholesaler', 'West', 'Coast', ',', 'distribution', 'centers', 'Seattle', ',', 'Spokane', ',', 'Portland', ',', 'Anchorage', ',', 'Boise', ',', 'Los', 'Angeles', ',', 'Salt', 'Lake', 'City', '.', 'The', 'secret', '40+', 'years', 'success', 'industry', 'PEOPLE', '!', 'We', 'strive', 'hire', 'best', 'reward', 'working', 'environment', 'fosters', 'loyalty', ',', 'stability', ',', 'innovation', ',', 'growth', '.', 'Charlie', ""'s"", 'provides', 'healthy', 'employee', 'stock', 'ownership', 'program', ',', 'competitive', 'Medical/Dental/Vision', 'Life', 'Insurance', 'plans', '.', 'And', 'newest', 'benefit', 'offers', 'Pre-Paid', 'Fully', 'Funded', 'College', 'Tuition', 'employees', 'dependent', 'children', 'employees', '1', 'year', '!', 'Responsibilities', ':', 'Qualifications', ':']","Overview : Charlie ’ Produce - Who We Are Charlie 's Produce privately owned wholesale produce company . We largest privately owned produce wholesaler West Coast , distribution centers Seattle , Spokane , Portland , Anchorage , Boise , Los Angeles , Salt Lake City . The secret 40+ years success industry PEOPLE ! We strive hire best reward working environment fosters loyalty , stability , innovation , growth . Charlie 's provides healthy employee stock ownership program , competitive Medical/Dental/Vision Life Insurance plans . And newest benefit offers Pre-Paid Fully Funded College Tuition employees dependent children employees 1 year ! Responsibilities : Qualifications :"
-1,-1,"Network Account Engineer
Duties & Responsibilities:
Perform and manage project-based work in regards to servers, networks, cloud based architecture and more
Network and server management
Communicate with customers to resolve problems, design infrastructure, assist with growth planning, and provide best practice analysis
Communicate with vendors & 3rd parties to ensure completion of tasks in a timely manner and to customer's satisfaction
Perform and oversee software and application development, installation, and upgrades","['Network', 'Account', 'Engineer', 'Duties', '&', 'Responsibilities', ':', 'Perform', 'and', 'manage', 'project-based', 'work', 'in', 'regards', 'to', 'servers', ',', 'networks', ',', 'cloud', 'based', 'architecture', 'and', 'more', 'Network', 'and', 'server', 'management', 'Communicate', 'with', 'customers', 'to', 'resolve', 'problems', ',', 'design', 'infrastructure', ',', 'assist', 'with', 'growth', 'planning', ',', 'and', 'provide', 'best', 'practice', 'analysis', 'Communicate', 'with', 'vendors', '&', '3rd', 'parties', 'to', 'ensure', 'completion', 'of', 'tasks', 'in', 'a', 'timely', 'manner', 'and', 'to', 'customer', ""'s"", 'satisfaction', 'Perform', 'and', 'oversee', 'software', 'and', 'application', 'development', ',', 'installation', ',', 'and', 'upgrades']","['Network', 'Account', 'Engineer', 'Duties', '&', 'Responsibilities', ':', 'Perform', 'manage', 'project-based', 'work', 'regards', 'servers', ',', 'networks', ',', 'cloud', 'based', 'architecture', 'Network', 'server', 'management', 'Communicate', 'customers', 'resolve', 'problems', ',', 'design', 'infrastructure', ',', 'assist', 'growth', 'planning', ',', 'provide', 'best', 'practice', 'analysis', 'Communicate', 'vendors', '&', '3rd', 'parties', 'ensure', 'completion', 'tasks', 'timely', 'manner', 'customer', ""'s"", 'satisfaction', 'Perform', 'oversee', 'software', 'application', 'development', ',', 'installation', ',', 'upgrades']","Network Account Engineer Duties & Responsibilities : Perform manage project-based work regards servers , networks , cloud based architecture Network server management Communicate customers resolve problems , design infrastructure , assist growth planning , provide best practice analysis Communicate vendors & 3rd parties ensure completion tasks timely manner customer 's satisfaction Perform oversee software application development , installation , upgrades"
-1,-1,"Ready to make an impact? If so, read on!
The Monitoring and Event Management Team is looking for a highly-motivated, Azure Monitoring Engineer with an application engineering background to help administer and operate our Cloud Monitoring platforms. The candidate should have a strong technical aptitude and be comfortable providing excellent customer service. An ideal candidate will have knowledge with monitoring technologies such as Microsoft Azure Monitor (AppInsights, OMS, NPM), Dynatrace, Splunk, ThousandEyes, etc. The position also requires scripting to automate deployments with Monitoring and Event management solutions, ensuring 24/7 visibility of GEICO’s application and service portfolio.
Job Responsibilities:
Lead efforts to upgrade/consolidate monitoring tools in our portfolio and remediate any gaps in monitoring.","['Ready', 'to', 'make', 'an', 'impact', '?', 'If', 'so', ',', 'read', 'on', '!', 'The', 'Monitoring', 'and', 'Event', 'Management', 'Team', 'is', 'looking', 'for', 'a', 'highly-motivated', ',', 'Azure', 'Monitoring', 'Engineer', 'with', 'an', 'application', 'engineering', 'background', 'to', 'help', 'administer', 'and', 'operate', 'our', 'Cloud', 'Monitoring', 'platforms', '.', 'The', 'candidate', 'should', 'have', 'a', 'strong', 'technical', 'aptitude', 'and', 'be', 'comfortable', 'providing', 'excellent', 'customer', 'service', '.', 'An', 'ideal', 'candidate', 'will', 'have', 'knowledge', 'with', 'monitoring', 'technologies', 'such', 'as', 'Microsoft', 'Azure', 'Monitor', '(', 'AppInsights', ',', 'OMS', ',', 'NPM', ')', ',', 'Dynatrace', ',', 'Splunk', ',', 'ThousandEyes', ',', 'etc', '.', 'The', 'position', 'also', 'requires', 'scripting', 'to', 'automate', 'deployments', 'with', 'Monitoring', 'and', 'Event', 'management', 'solutions', ',', 'ensuring', '24/7', 'visibility', 'of', 'GEICO', '’', 's', 'application', 'and', 'service', 'portfolio', '.', 'Job', 'Responsibilities', ':', 'Lead', 'efforts', 'to', 'upgrade/consolidate', 'monitoring', 'tools', 'in', 'our', 'portfolio', 'and', 'remediate', 'any', 'gaps', 'in', 'monitoring', '.']","['Ready', 'make', 'impact', '?', 'If', ',', 'read', '!', 'The', 'Monitoring', 'Event', 'Management', 'Team', 'looking', 'highly-motivated', ',', 'Azure', 'Monitoring', 'Engineer', 'application', 'engineering', 'background', 'help', 'administer', 'operate', 'Cloud', 'Monitoring', 'platforms', '.', 'The', 'candidate', 'strong', 'technical', 'aptitude', 'comfortable', 'providing', 'excellent', 'customer', 'service', '.', 'An', 'ideal', 'candidate', 'knowledge', 'monitoring', 'technologies', 'Microsoft', 'Azure', 'Monitor', '(', 'AppInsights', ',', 'OMS', ',', 'NPM', ')', ',', 'Dynatrace', ',', 'Splunk', ',', 'ThousandEyes', ',', 'etc', '.', 'The', 'position', 'also', 'requires', 'scripting', 'automate', 'deployments', 'Monitoring', 'Event', 'management', 'solutions', ',', 'ensuring', '24/7', 'visibility', 'GEICO', '’', 'application', 'service', 'portfolio', '.', 'Job', 'Responsibilities', ':', 'Lead', 'efforts', 'upgrade/consolidate', 'monitoring', 'tools', 'portfolio', 'remediate', 'gaps', 'monitoring', '.']","Ready make impact ? If , read ! The Monitoring Event Management Team looking highly-motivated , Azure Monitoring Engineer application engineering background help administer operate Cloud Monitoring platforms . The candidate strong technical aptitude comfortable providing excellent customer service . An ideal candidate knowledge monitoring technologies Microsoft Azure Monitor ( AppInsights , OMS , NPM ) , Dynatrace , Splunk , ThousandEyes , etc . The position also requires scripting automate deployments Monitoring Event management solutions , ensuring 24/7 visibility GEICO ’ application service portfolio . Job Responsibilities : Lead efforts upgrade/consolidate monitoring tools portfolio remediate gaps monitoring ."
-1,-1,"ThermOmegaTech, and industry leader in the valve/rail/space/aerospace/commercial/industrial markets is looking for a PLM Systems Administrator to lead the creation, management and standardization of engineering documentation control, companywide product life cycle data and drive improvements to process and procedures for improving communication and flow of project data throughout the organization. ThermOmegaTech promotes a culture of engineering excellence and innovation where our technical staff can explore the limits of creativity to support business growth and personal development.
Responsibilities:
· Implementation of the PLM system and ongoing management of the system health.
· Lead training in the use of PLM as applicable to various functional areas of the company. Ensure user knowledge and abilities are maintained at a high level to ensure efficient use of the PLM system. Support day to day user activity to ensure data integrity.","['ThermOmegaTech', ',', 'and', 'industry', 'leader', 'in', 'the', 'valve/rail/space/aerospace/commercial/industrial', 'markets', 'is', 'looking', 'for', 'a', 'PLM', 'Systems', 'Administrator', 'to', 'lead', 'the', 'creation', ',', 'management', 'and', 'standardization', 'of', 'engineering', 'documentation', 'control', ',', 'companywide', 'product', 'life', 'cycle', 'data', 'and', 'drive', 'improvements', 'to', 'process', 'and', 'procedures', 'for', 'improving', 'communication', 'and', 'flow', 'of', 'project', 'data', 'throughout', 'the', 'organization', '.', 'ThermOmegaTech', 'promotes', 'a', 'culture', 'of', 'engineering', 'excellence', 'and', 'innovation', 'where', 'our', 'technical', 'staff', 'can', 'explore', 'the', 'limits', 'of', 'creativity', 'to', 'support', 'business', 'growth', 'and', 'personal', 'development', '.', 'Responsibilities', ':', '·', 'Implementation', 'of', 'the', 'PLM', 'system', 'and', 'ongoing', 'management', 'of', 'the', 'system', 'health', '.', '·', 'Lead', 'training', 'in', 'the', 'use', 'of', 'PLM', 'as', 'applicable', 'to', 'various', 'functional', 'areas', 'of', 'the', 'company', '.', 'Ensure', 'user', 'knowledge', 'and', 'abilities', 'are', 'maintained', 'at', 'a', 'high', 'level', 'to', 'ensure', 'efficient', 'use', 'of', 'the', 'PLM', 'system', '.', 'Support', 'day', 'to', 'day', 'user', 'activity', 'to', 'ensure', 'data', 'integrity', '.']","['ThermOmegaTech', ',', 'industry', 'leader', 'valve/rail/space/aerospace/commercial/industrial', 'markets', 'looking', 'PLM', 'Systems', 'Administrator', 'lead', 'creation', ',', 'management', 'standardization', 'engineering', 'documentation', 'control', ',', 'companywide', 'product', 'life', 'cycle', 'data', 'drive', 'improvements', 'process', 'procedures', 'improving', 'communication', 'flow', 'project', 'data', 'throughout', 'organization', '.', 'ThermOmegaTech', 'promotes', 'culture', 'engineering', 'excellence', 'innovation', 'technical', 'staff', 'explore', 'limits', 'creativity', 'support', 'business', 'growth', 'personal', 'development', '.', 'Responsibilities', ':', '·', 'Implementation', 'PLM', 'system', 'ongoing', 'management', 'system', 'health', '.', '·', 'Lead', 'training', 'use', 'PLM', 'applicable', 'various', 'functional', 'areas', 'company', '.', 'Ensure', 'user', 'knowledge', 'abilities', 'maintained', 'high', 'level', 'ensure', 'efficient', 'use', 'PLM', 'system', '.', 'Support', 'day', 'day', 'user', 'activity', 'ensure', 'data', 'integrity', '.']","ThermOmegaTech , industry leader valve/rail/space/aerospace/commercial/industrial markets looking PLM Systems Administrator lead creation , management standardization engineering documentation control , companywide product life cycle data drive improvements process procedures improving communication flow project data throughout organization . ThermOmegaTech promotes culture engineering excellence innovation technical staff explore limits creativity support business growth personal development . Responsibilities : · Implementation PLM system ongoing management system health . · Lead training use PLM applicable various functional areas company . Ensure user knowledge abilities maintained high level ensure efficient use PLM system . Support day day user activity ensure data integrity ."
