Job Title,Company Name,Job Description,Tokenized,Stop Words Removed,Finished Text
-1,-1,"MBA is seeking A Senior Software Engineer with over 5 years of relevant experience to support our customer, the US Government Client Engineering Package Sorting Technology (PST) Team. The PST team has many different type of mail equipment sorters. The software engineer's primary role is to support US Government Client Package Sorting Equipment. In this role, you will engage with an experienced, cross-disciplinary staff to conceive and design equipment. You will have a hands-on role designing, engineering, and exploring prototypes and test solutions for supporting End of Life (EOL) parts with new innovations that support mail processing. You will continually find new and better ways to solve complex problems within constrained environments. You will demonstrate cross-functional expertise to accomplish your goals. You will play a role in defining the approaches and solutions being developed by the entire team. You must be responsive, flexible, and able to succeed within an open, collaborative, peer environment. You will need to travel occasionally to support testing/deployment/installation for software and hardware at US Government Client mail processing centers or vendor facilities within the United States.","['MBA', 'is', 'seeking', 'A', 'Senior', 'Software', 'Engineer', 'with', 'over', '5', 'years', 'of', 'relevant', 'experience', 'to', 'support', 'our', 'customer', ',', 'the', 'US', 'Government', 'Client', 'Engineering', 'Package', 'Sorting', 'Technology', '(', 'PST', ')', 'Team', '.', 'The', 'PST', 'team', 'has', 'many', 'different', 'type', 'of', 'mail', 'equipment', 'sorters', '.', 'The', 'software', 'engineer', ""'s"", 'primary', 'role', 'is', 'to', 'support', 'US', 'Government', 'Client', 'Package', 'Sorting', 'Equipment', '.', 'In', 'this', 'role', ',', 'you', 'will', 'engage', 'with', 'an', 'experienced', ',', 'cross-disciplinary', 'staff', 'to', 'conceive', 'and', 'design', 'equipment', '.', 'You', 'will', 'have', 'a', 'hands-on', 'role', 'designing', ',', 'engineering', ',', 'and', 'exploring', 'prototypes', 'and', 'test', 'solutions', 'for', 'supporting', 'End', 'of', 'Life', '(', 'EOL', ')', 'parts', 'with', 'new', 'innovations', 'that', 'support', 'mail', 'processing', '.', 'You', 'will', 'continually', 'find', 'new', 'and', 'better', 'ways', 'to', 'solve', 'complex', 'problems', 'within', 'constrained', 'environments', '.', 'You', 'will', 'demonstrate', 'cross-functional', 'expertise', 'to', 'accomplish', 'your', 'goals', '.', 'You', 'will', 'play', 'a', 'role', 'in', 'defining', 'the', 'approaches', 'and', 'solutions', 'being', 'developed', 'by', 'the', 'entire', 'team', '.', 'You', 'must', 'be', 'responsive', ',', 'flexible', ',', 'and', 'able', 'to', 'succeed', 'within', 'an', 'open', ',', 'collaborative', ',', 'peer', 'environment', '.', 'You', 'will', 'need', 'to', 'travel', 'occasionally', 'to', 'support', 'testing/deployment/installation', 'for', 'software', 'and', 'hardware', 'at', 'US', 'Government', 'Client', 'mail', 'processing', 'centers', 'or', 'vendor', 'facilities', 'within', 'the', 'United', 'States', '.']","['MBA', 'seeking', 'A', 'Senior', 'Software', 'Engineer', '5', 'years', 'relevant', 'experience', 'support', 'customer', ',', 'US', 'Government', 'Client', 'Engineering', 'Package', 'Sorting', 'Technology', '(', 'PST', ')', 'Team', '.', 'The', 'PST', 'team', 'many', 'different', 'type', 'mail', 'equipment', 'sorters', '.', 'The', 'software', 'engineer', ""'s"", 'primary', 'role', 'support', 'US', 'Government', 'Client', 'Package', 'Sorting', 'Equipment', '.', 'In', 'role', ',', 'engage', 'experienced', ',', 'cross-disciplinary', 'staff', 'conceive', 'design', 'equipment', '.', 'You', 'hands-on', 'role', 'designing', ',', 'engineering', ',', 'exploring', 'prototypes', 'test', 'solutions', 'supporting', 'End', 'Life', '(', 'EOL', ')', 'parts', 'new', 'innovations', 'support', 'mail', 'processing', '.', 'You', 'continually', 'find', 'new', 'better', 'ways', 'solve', 'complex', 'problems', 'within', 'constrained', 'environments', '.', 'You', 'demonstrate', 'cross-functional', 'expertise', 'accomplish', 'goals', '.', 'You', 'play', 'role', 'defining', 'approaches', 'solutions', 'developed', 'entire', 'team', '.', 'You', 'must', 'responsive', ',', 'flexible', ',', 'able', 'succeed', 'within', 'open', ',', 'collaborative', ',', 'peer', 'environment', '.', 'You', 'need', 'travel', 'occasionally', 'support', 'testing/deployment/installation', 'software', 'hardware', 'US', 'Government', 'Client', 'mail', 'processing', 'centers', 'vendor', 'facilities', 'within', 'United', 'States', '.']","MBA seeking A Senior Software Engineer 5 years relevant experience support customer , US Government Client Engineering Package Sorting Technology ( PST ) Team . The PST team many different type mail equipment sorters . The software engineer 's primary role support US Government Client Package Sorting Equipment . In role , engage experienced , cross-disciplinary staff conceive design equipment . You hands-on role designing , engineering , exploring prototypes test solutions supporting End Life ( EOL ) parts new innovations support mail processing . You continually find new better ways solve complex problems within constrained environments . You demonstrate cross-functional expertise accomplish goals . You play role defining approaches solutions developed entire team . You must responsive , flexible , able succeed within open , collaborative , peer environment . You need travel occasionally support testing/deployment/installation software hardware US Government Client mail processing centers vendor facilities within United States ."
-1,-1,"Introduction
ASML US brings together the most creative minds in science and technology to develop lithography machines that are key to producing faster, cheaper, more energy-efficient microchips. We design, develop, integrate, market and service these advanced machines, which enable our customers - the world’s leading chipmakers - to reduce the size and increase the functionality of their microchips, which in turn leads to smaller, more powerful consumer electronics. Our headquarters are in Veldhoven, the Netherlands, and we have 18 office locations around the United States including main offices in Chandler Arizona, San Jose and San Diego California, Wilton Connecticut, and Hillsboro Oregon.
Job Mission","['Introduction', 'ASML', 'US', 'brings', 'together', 'the', 'most', 'creative', 'minds', 'in', 'science', 'and', 'technology', 'to', 'develop', 'lithography', 'machines', 'that', 'are', 'key', 'to', 'producing', 'faster', ',', 'cheaper', ',', 'more', 'energy-efficient', 'microchips', '.', 'We', 'design', ',', 'develop', ',', 'integrate', ',', 'market', 'and', 'service', 'these', 'advanced', 'machines', ',', 'which', 'enable', 'our', 'customers', '-', 'the', 'world', '’', 's', 'leading', 'chipmakers', '-', 'to', 'reduce', 'the', 'size', 'and', 'increase', 'the', 'functionality', 'of', 'their', 'microchips', ',', 'which', 'in', 'turn', 'leads', 'to', 'smaller', ',', 'more', 'powerful', 'consumer', 'electronics', '.', 'Our', 'headquarters', 'are', 'in', 'Veldhoven', ',', 'the', 'Netherlands', ',', 'and', 'we', 'have', '18', 'office', 'locations', 'around', 'the', 'United', 'States', 'including', 'main', 'offices', 'in', 'Chandler', 'Arizona', ',', 'San', 'Jose', 'and', 'San', 'Diego', 'California', ',', 'Wilton', 'Connecticut', ',', 'and', 'Hillsboro', 'Oregon', '.', 'Job', 'Mission']","['Introduction', 'ASML', 'US', 'brings', 'together', 'creative', 'minds', 'science', 'technology', 'develop', 'lithography', 'machines', 'key', 'producing', 'faster', ',', 'cheaper', ',', 'energy-efficient', 'microchips', '.', 'We', 'design', ',', 'develop', ',', 'integrate', ',', 'market', 'service', 'advanced', 'machines', ',', 'enable', 'customers', '-', 'world', '’', 'leading', 'chipmakers', '-', 'reduce', 'size', 'increase', 'functionality', 'microchips', ',', 'turn', 'leads', 'smaller', ',', 'powerful', 'consumer', 'electronics', '.', 'Our', 'headquarters', 'Veldhoven', ',', 'Netherlands', ',', '18', 'office', 'locations', 'around', 'United', 'States', 'including', 'main', 'offices', 'Chandler', 'Arizona', ',', 'San', 'Jose', 'San', 'Diego', 'California', ',', 'Wilton', 'Connecticut', ',', 'Hillsboro', 'Oregon', '.', 'Job', 'Mission']","Introduction ASML US brings together creative minds science technology develop lithography machines key producing faster , cheaper , energy-efficient microchips . We design , develop , integrate , market service advanced machines , enable customers - world ’ leading chipmakers - reduce size increase functionality microchips , turn leads smaller , powerful consumer electronics . Our headquarters Veldhoven , Netherlands , 18 office locations around United States including main offices Chandler Arizona , San Jose San Diego California , Wilton Connecticut , Hillsboro Oregon . Job Mission"
-1,-1,"IAI is looking for a talented research scientist to contribute to research and development efforts in machine learning, graph theory, and scientific software development. The candidate will incorporate novel ideas and improve the state of the art on advanced projects related to processing of large networks, analyzing data in high dimensions and implementing high performance computing software. Additionally, the candidate will develop a portfolio of related research by extending existing work and proposing new methods with novel application domains.

You are highly encouraged to apply if you enjoy working with data and algorithms, passionate about understanding how things work, want to solve complex problems and strive to stay current on the technology and literature in areas of high performance computing, network analysis and machine learning.","['IAI', 'is', 'looking', 'for', 'a', 'talented', 'research', 'scientist', 'to', 'contribute', 'to', 'research', 'and', 'development', 'efforts', 'in', 'machine', 'learning', ',', 'graph', 'theory', ',', 'and', 'scientific', 'software', 'development', '.', 'The', 'candidate', 'will', 'incorporate', 'novel', 'ideas', 'and', 'improve', 'the', 'state', 'of', 'the', 'art', 'on', 'advanced', 'projects', 'related', 'to', 'processing', 'of', 'large', 'networks', ',', 'analyzing', 'data', 'in', 'high', 'dimensions', 'and', 'implementing', 'high', 'performance', 'computing', 'software', '.', 'Additionally', ',', 'the', 'candidate', 'will', 'develop', 'a', 'portfolio', 'of', 'related', 'research', 'by', 'extending', 'existing', 'work', 'and', 'proposing', 'new', 'methods', 'with', 'novel', 'application', 'domains', '.', 'You', 'are', 'highly', 'encouraged', 'to', 'apply', 'if', 'you', 'enjoy', 'working', 'with', 'data', 'and', 'algorithms', ',', 'passionate', 'about', 'understanding', 'how', 'things', 'work', ',', 'want', 'to', 'solve', 'complex', 'problems', 'and', 'strive', 'to', 'stay', 'current', 'on', 'the', 'technology', 'and', 'literature', 'in', 'areas', 'of', 'high', 'performance', 'computing', ',', 'network', 'analysis', 'and', 'machine', 'learning', '.']","['IAI', 'looking', 'talented', 'research', 'scientist', 'contribute', 'research', 'development', 'efforts', 'machine', 'learning', ',', 'graph', 'theory', ',', 'scientific', 'software', 'development', '.', 'The', 'candidate', 'incorporate', 'novel', 'ideas', 'improve', 'state', 'art', 'advanced', 'projects', 'related', 'processing', 'large', 'networks', ',', 'analyzing', 'data', 'high', 'dimensions', 'implementing', 'high', 'performance', 'computing', 'software', '.', 'Additionally', ',', 'candidate', 'develop', 'portfolio', 'related', 'research', 'extending', 'existing', 'work', 'proposing', 'new', 'methods', 'novel', 'application', 'domains', '.', 'You', 'highly', 'encouraged', 'apply', 'enjoy', 'working', 'data', 'algorithms', ',', 'passionate', 'understanding', 'things', 'work', ',', 'want', 'solve', 'complex', 'problems', 'strive', 'stay', 'current', 'technology', 'literature', 'areas', 'high', 'performance', 'computing', ',', 'network', 'analysis', 'machine', 'learning', '.']","IAI looking talented research scientist contribute research development efforts machine learning , graph theory , scientific software development . The candidate incorporate novel ideas improve state art advanced projects related processing large networks , analyzing data high dimensions implementing high performance computing software . Additionally , candidate develop portfolio related research extending existing work proposing new methods novel application domains . You highly encouraged apply enjoy working data algorithms , passionate understanding things work , want solve complex problems strive stay current technology literature areas high performance computing , network analysis machine learning ."
-1,-1,"Senior Software Engineer
United States citizenship is required_ due to need to pass a US Government-initiated background check for security clearance purposes_
Do you crave challenging problems and dream in code? Do you have a desire to work on an Agile team tasked with solving some of the most difficult problems faced by the US Department of Defense and Intelligence Community? Does building the next generation of software solutions that integrate cutting edge machine learning techniques with elegant code sound like a dream job? Look no further than Expedition Technology because we have opportunities for you!
EXP is currently seeking experienced, mid-career to senior level software engineers who will develop next generation software applications that integrate the latest machine learning algorithms and models into a robust information pipeline. You’ll join a motivated, collaborative, creative team that uses Agile methodology to constantly iterate innovative solutions for our customers. Your responsibilities will span the design and implementation of robust software systems that include state of the art machine learning algorithms for cutting edge systems, along with creating new tools and applications using the latest languages, frameworks and libraries.
If you believe you are up for the challenge and meet or exceed the criteria below, we want to hear from you!","['Senior', 'Software', 'Engineer', 'United', 'States', 'citizenship', 'is', 'required_', 'due', 'to', 'need', 'to', 'pass', 'a', 'US', 'Government-initiated', 'background', 'check', 'for', 'security', 'clearance', 'purposes_', 'Do', 'you', 'crave', 'challenging', 'problems', 'and', 'dream', 'in', 'code', '?', 'Do', 'you', 'have', 'a', 'desire', 'to', 'work', 'on', 'an', 'Agile', 'team', 'tasked', 'with', 'solving', 'some', 'of', 'the', 'most', 'difficult', 'problems', 'faced', 'by', 'the', 'US', 'Department', 'of', 'Defense', 'and', 'Intelligence', 'Community', '?', 'Does', 'building', 'the', 'next', 'generation', 'of', 'software', 'solutions', 'that', 'integrate', 'cutting', 'edge', 'machine', 'learning', 'techniques', 'with', 'elegant', 'code', 'sound', 'like', 'a', 'dream', 'job', '?', 'Look', 'no', 'further', 'than', 'Expedition', 'Technology', 'because', 'we', 'have', 'opportunities', 'for', 'you', '!', 'EXP', 'is', 'currently', 'seeking', 'experienced', ',', 'mid-career', 'to', 'senior', 'level', 'software', 'engineers', 'who', 'will', 'develop', 'next', 'generation', 'software', 'applications', 'that', 'integrate', 'the', 'latest', 'machine', 'learning', 'algorithms', 'and', 'models', 'into', 'a', 'robust', 'information', 'pipeline', '.', 'You', '’', 'll', 'join', 'a', 'motivated', ',', 'collaborative', ',', 'creative', 'team', 'that', 'uses', 'Agile', 'methodology', 'to', 'constantly', 'iterate', 'innovative', 'solutions', 'for', 'our', 'customers', '.', 'Your', 'responsibilities', 'will', 'span', 'the', 'design', 'and', 'implementation', 'of', 'robust', 'software', 'systems', 'that', 'include', 'state', 'of', 'the', 'art', 'machine', 'learning', 'algorithms', 'for', 'cutting', 'edge', 'systems', ',', 'along', 'with', 'creating', 'new', 'tools', 'and', 'applications', 'using', 'the', 'latest', 'languages', ',', 'frameworks', 'and', 'libraries', '.', 'If', 'you', 'believe', 'you', 'are', 'up', 'for', 'the', 'challenge', 'and', 'meet', 'or', 'exceed', 'the', 'criteria', 'below', ',', 'we', 'want', 'to', 'hear', 'from', 'you', '!']","['Senior', 'Software', 'Engineer', 'United', 'States', 'citizenship', 'required_', 'due', 'need', 'pass', 'US', 'Government-initiated', 'background', 'check', 'security', 'clearance', 'purposes_', 'Do', 'crave', 'challenging', 'problems', 'dream', 'code', '?', 'Do', 'desire', 'work', 'Agile', 'team', 'tasked', 'solving', 'difficult', 'problems', 'faced', 'US', 'Department', 'Defense', 'Intelligence', 'Community', '?', 'Does', 'building', 'next', 'generation', 'software', 'solutions', 'integrate', 'cutting', 'edge', 'machine', 'learning', 'techniques', 'elegant', 'code', 'sound', 'like', 'dream', 'job', '?', 'Look', 'Expedition', 'Technology', 'opportunities', '!', 'EXP', 'currently', 'seeking', 'experienced', ',', 'mid-career', 'senior', 'level', 'software', 'engineers', 'develop', 'next', 'generation', 'software', 'applications', 'integrate', 'latest', 'machine', 'learning', 'algorithms', 'models', 'robust', 'information', 'pipeline', '.', 'You', '’', 'join', 'motivated', ',', 'collaborative', ',', 'creative', 'team', 'uses', 'Agile', 'methodology', 'constantly', 'iterate', 'innovative', 'solutions', 'customers', '.', 'Your', 'responsibilities', 'span', 'design', 'implementation', 'robust', 'software', 'systems', 'include', 'state', 'art', 'machine', 'learning', 'algorithms', 'cutting', 'edge', 'systems', ',', 'along', 'creating', 'new', 'tools', 'applications', 'using', 'latest', 'languages', ',', 'frameworks', 'libraries', '.', 'If', 'believe', 'challenge', 'meet', 'exceed', 'criteria', ',', 'want', 'hear', '!']","Senior Software Engineer United States citizenship required_ due need pass US Government-initiated background check security clearance purposes_ Do crave challenging problems dream code ? Do desire work Agile team tasked solving difficult problems faced US Department Defense Intelligence Community ? Does building next generation software solutions integrate cutting edge machine learning techniques elegant code sound like dream job ? Look Expedition Technology opportunities ! EXP currently seeking experienced , mid-career senior level software engineers develop next generation software applications integrate latest machine learning algorithms models robust information pipeline . You ’ join motivated , collaborative , creative team uses Agile methodology constantly iterate innovative solutions customers . Your responsibilities span design implementation robust software systems include state art machine learning algorithms cutting edge systems , along creating new tools applications using latest languages , frameworks libraries . If believe challenge meet exceed criteria , want hear !"
-1,-1,"Why choose between doing meaningful work and having a fulfilling life? At MITRE, you can have both. That's because MITRE people are committed to tackling our nation's toughest challenges—and we're committed to the long-term well-being of our employees. MITRE is different from most technology companies. We are a not-for-profit corporation chartered to work for the public interest, with no commercial conflicts to influence what we do. The R&D centers we operate for the government create lasting impact in fields as diverse as cybersecurity, healthcare, aviation, defense, and enterprise transformation. We're making a difference every day—working for a safer, healthier, and more secure nation and world. Our workplace reflects our values. We offer competitive benefits, exceptional professional development opportunities, and a culture of innovation that embraces diversity, inclusion, flexibility, collaboration, and career growth. If this sounds like the choice you want to make, then choose MITRE—and make a difference with us.
Polygraph","['Why', 'choose', 'between', 'doing', 'meaningful', 'work', 'and', 'having', 'a', 'fulfilling', 'life', '?', 'At', 'MITRE', ',', 'you', 'can', 'have', 'both', '.', 'That', ""'s"", 'because', 'MITRE', 'people', 'are', 'committed', 'to', 'tackling', 'our', 'nation', ""'s"", 'toughest', 'challenges—and', 'we', ""'re"", 'committed', 'to', 'the', 'long-term', 'well-being', 'of', 'our', 'employees', '.', 'MITRE', 'is', 'different', 'from', 'most', 'technology', 'companies', '.', 'We', 'are', 'a', 'not-for-profit', 'corporation', 'chartered', 'to', 'work', 'for', 'the', 'public', 'interest', ',', 'with', 'no', 'commercial', 'conflicts', 'to', 'influence', 'what', 'we', 'do', '.', 'The', 'R', '&', 'D', 'centers', 'we', 'operate', 'for', 'the', 'government', 'create', 'lasting', 'impact', 'in', 'fields', 'as', 'diverse', 'as', 'cybersecurity', ',', 'healthcare', ',', 'aviation', ',', 'defense', ',', 'and', 'enterprise', 'transformation', '.', 'We', ""'re"", 'making', 'a', 'difference', 'every', 'day—working', 'for', 'a', 'safer', ',', 'healthier', ',', 'and', 'more', 'secure', 'nation', 'and', 'world', '.', 'Our', 'workplace', 'reflects', 'our', 'values', '.', 'We', 'offer', 'competitive', 'benefits', ',', 'exceptional', 'professional', 'development', 'opportunities', ',', 'and', 'a', 'culture', 'of', 'innovation', 'that', 'embraces', 'diversity', ',', 'inclusion', ',', 'flexibility', ',', 'collaboration', ',', 'and', 'career', 'growth', '.', 'If', 'this', 'sounds', 'like', 'the', 'choice', 'you', 'want', 'to', 'make', ',', 'then', 'choose', 'MITRE—and', 'make', 'a', 'difference', 'with', 'us', '.', 'Polygraph']","['Why', 'choose', 'meaningful', 'work', 'fulfilling', 'life', '?', 'At', 'MITRE', ',', '.', 'That', ""'s"", 'MITRE', 'people', 'committed', 'tackling', 'nation', ""'s"", 'toughest', 'challenges—and', ""'re"", 'committed', 'long-term', 'well-being', 'employees', '.', 'MITRE', 'different', 'technology', 'companies', '.', 'We', 'not-for-profit', 'corporation', 'chartered', 'work', 'public', 'interest', ',', 'commercial', 'conflicts', 'influence', '.', 'The', 'R', '&', 'D', 'centers', 'operate', 'government', 'create', 'lasting', 'impact', 'fields', 'diverse', 'cybersecurity', ',', 'healthcare', ',', 'aviation', ',', 'defense', ',', 'enterprise', 'transformation', '.', 'We', ""'re"", 'making', 'difference', 'every', 'day—working', 'safer', ',', 'healthier', ',', 'secure', 'nation', 'world', '.', 'Our', 'workplace', 'reflects', 'values', '.', 'We', 'offer', 'competitive', 'benefits', ',', 'exceptional', 'professional', 'development', 'opportunities', ',', 'culture', 'innovation', 'embraces', 'diversity', ',', 'inclusion', ',', 'flexibility', ',', 'collaboration', ',', 'career', 'growth', '.', 'If', 'sounds', 'like', 'choice', 'want', 'make', ',', 'choose', 'MITRE—and', 'make', 'difference', 'us', '.', 'Polygraph']","Why choose meaningful work fulfilling life ? At MITRE , . That 's MITRE people committed tackling nation 's toughest challenges—and 're committed long-term well-being employees . MITRE different technology companies . We not-for-profit corporation chartered work public interest , commercial conflicts influence . The R & D centers operate government create lasting impact fields diverse cybersecurity , healthcare , aviation , defense , enterprise transformation . We 're making difference every day—working safer , healthier , secure nation world . Our workplace reflects values . We offer competitive benefits , exceptional professional development opportunities , culture innovation embraces diversity , inclusion , flexibility , collaboration , career growth . If sounds like choice want make , choose MITRE—and make difference us . Polygraph"
