Job Title,Company Name,Job Description,Tokenized,Stop Words Removed,Finished Text
-1,-1,"Working at Macro Solutions, a leading provider of IT and management consulting services, is an opportunity to collaborate with great people who have a passion for the services they provide to our clients. We have an immediate need for a Software Engineer Jrto join our team at Linthicum, MD. This position requires an active TS/SCI Poly.

The software Engineer will perform application integration and configuration of the Wolters Kluwer's TeamMate+ software in a Windows environment. Other scripting maybe required for PKI integration.

Responsibilities
Develop, maintain, and enhance complex and diverse software systems (e.g., processing-intensive analytics, novel algorithm development, manipulation of extremely large data sets, real-time systems, and business management information systems) based upon documented requirements.
Macro Solutions is a woman-owned IT and management consulting firm that helps government organizations select, implement, integrate and maintain critical business solutions. A relationship company at our core, we pride ourselves on building high-touch, high-trust environments for our clients and partners, at every level of our business. Assessed at CMMI Maturity Level 3 for both Development and Services and ISO 9001:2015 certification, Macro delivers honest, powerful results from the inside, outward.

Deeply invested in advancing long lasting employee relationships, our distinctive Consultant Care program ensures that our employees are always a priority at every level of the organization and has been integral to our 94% employee retention rate.

Along with a supportive environment and culture that thrives on dreaming big, getting things done and having fun together, Macro Solutions offers employees a full suite of competitive benefits, including health, dental, 401(k), and paid time off.

If you would like to learn more about Macro Solutions, are interested in joining our team, or would like to learn more about our Consultant Care program visit our website.

Macro Solutions is an Equal Opportunity Employer.","['Working', 'at', 'Macro', 'Solutions', ',', 'a', 'leading', 'provider', 'of', 'IT', 'and', 'management', 'consulting', 'services', ',', 'is', 'an', 'opportunity', 'to', 'collaborate', 'with', 'great', 'people', 'who', 'have', 'a', 'passion', 'for', 'the', 'services', 'they', 'provide', 'to', 'our', 'clients', '.', 'We', 'have', 'an', 'immediate', 'need', 'for', 'a', 'Software', 'Engineer', 'Jrto', 'join', 'our', 'team', 'at', 'Linthicum', ',', 'MD', '.', 'This', 'position', 'requires', 'an', 'active', 'TS/SCI', 'Poly', '.', 'The', 'software', 'Engineer', 'will', 'perform', 'application', 'integration', 'and', 'configuration', 'of', 'the', 'Wolters', 'Kluwer', ""'s"", 'TeamMate+', 'software', 'in', 'a', 'Windows', 'environment', '.', 'Other', 'scripting', 'maybe', 'required', 'for', 'PKI', 'integration', '.', 'Responsibilities', 'Develop', ',', 'maintain', ',', 'and', 'enhance', 'complex', 'and', 'diverse', 'software', 'systems', '(', 'e.g.', ',', 'processing-intensive', 'analytics', ',', 'novel', 'algorithm', 'development', ',', 'manipulation', 'of', 'extremely', 'large', 'data', 'sets', ',', 'real-time', 'systems', ',', 'and', 'business', 'management', 'information', 'systems', ')', 'based', 'upon', 'documented', 'requirements', '.', 'Macro', 'Solutions', 'is', 'a', 'woman-owned', 'IT', 'and', 'management', 'consulting', 'firm', 'that', 'helps', 'government', 'organizations', 'select', ',', 'implement', ',', 'integrate', 'and', 'maintain', 'critical', 'business', 'solutions', '.', 'A', 'relationship', 'company', 'at', 'our', 'core', ',', 'we', 'pride', 'ourselves', 'on', 'building', 'high-touch', ',', 'high-trust', 'environments', 'for', 'our', 'clients', 'and', 'partners', ',', 'at', 'every', 'level', 'of', 'our', 'business', '.', 'Assessed', 'at', 'CMMI', 'Maturity', 'Level', '3', 'for', 'both', 'Development', 'and', 'Services', 'and', 'ISO', '9001:2015', 'certification', ',', 'Macro', 'delivers', 'honest', ',', 'powerful', 'results', 'from', 'the', 'inside', ',', 'outward', '.', 'Deeply', 'invested', 'in', 'advancing', 'long', 'lasting', 'employee', 'relationships', ',', 'our', 'distinctive', 'Consultant', 'Care', 'program', 'ensures', 'that', 'our', 'employees', 'are', 'always', 'a', 'priority', 'at', 'every', 'level', 'of', 'the', 'organization', 'and', 'has', 'been', 'integral', 'to', 'our', '94', '%', 'employee', 'retention', 'rate', '.', 'Along', 'with', 'a', 'supportive', 'environment', 'and', 'culture', 'that', 'thrives', 'on', 'dreaming', 'big', ',', 'getting', 'things', 'done', 'and', 'having', 'fun', 'together', ',', 'Macro', 'Solutions', 'offers', 'employees', 'a', 'full', 'suite', 'of', 'competitive', 'benefits', ',', 'including', 'health', ',', 'dental', ',', '401', '(', 'k', ')', ',', 'and', 'paid', 'time', 'off', '.', 'If', 'you', 'would', 'like', 'to', 'learn', 'more', 'about', 'Macro', 'Solutions', ',', 'are', 'interested', 'in', 'joining', 'our', 'team', ',', 'or', 'would', 'like', 'to', 'learn', 'more', 'about', 'our', 'Consultant', 'Care', 'program', 'visit', 'our', 'website', '.', 'Macro', 'Solutions', 'is', 'an', 'Equal', 'Opportunity', 'Employer', '.']","['Working', 'Macro', 'Solutions', ',', 'leading', 'provider', 'IT', 'management', 'consulting', 'services', ',', 'opportunity', 'collaborate', 'great', 'people', 'passion', 'services', 'provide', 'clients', '.', 'We', 'immediate', 'need', 'Software', 'Engineer', 'Jrto', 'join', 'team', 'Linthicum', ',', 'MD', '.', 'This', 'position', 'requires', 'active', 'TS/SCI', 'Poly', '.', 'The', 'software', 'Engineer', 'perform', 'application', 'integration', 'configuration', 'Wolters', 'Kluwer', ""'s"", 'TeamMate+', 'software', 'Windows', 'environment', '.', 'Other', 'scripting', 'maybe', 'required', 'PKI', 'integration', '.', 'Responsibilities', 'Develop', ',', 'maintain', ',', 'enhance', 'complex', 'diverse', 'software', 'systems', '(', 'e.g.', ',', 'processing-intensive', 'analytics', ',', 'novel', 'algorithm', 'development', ',', 'manipulation', 'extremely', 'large', 'data', 'sets', ',', 'real-time', 'systems', ',', 'business', 'management', 'information', 'systems', ')', 'based', 'upon', 'documented', 'requirements', '.', 'Macro', 'Solutions', 'woman-owned', 'IT', 'management', 'consulting', 'firm', 'helps', 'government', 'organizations', 'select', ',', 'implement', ',', 'integrate', 'maintain', 'critical', 'business', 'solutions', '.', 'A', 'relationship', 'company', 'core', ',', 'pride', 'building', 'high-touch', ',', 'high-trust', 'environments', 'clients', 'partners', ',', 'every', 'level', 'business', '.', 'Assessed', 'CMMI', 'Maturity', 'Level', '3', 'Development', 'Services', 'ISO', '9001:2015', 'certification', ',', 'Macro', 'delivers', 'honest', ',', 'powerful', 'results', 'inside', ',', 'outward', '.', 'Deeply', 'invested', 'advancing', 'long', 'lasting', 'employee', 'relationships', ',', 'distinctive', 'Consultant', 'Care', 'program', 'ensures', 'employees', 'always', 'priority', 'every', 'level', 'organization', 'integral', '94', '%', 'employee', 'retention', 'rate', '.', 'Along', 'supportive', 'environment', 'culture', 'thrives', 'dreaming', 'big', ',', 'getting', 'things', 'done', 'fun', 'together', ',', 'Macro', 'Solutions', 'offers', 'employees', 'full', 'suite', 'competitive', 'benefits', ',', 'including', 'health', ',', 'dental', ',', '401', '(', 'k', ')', ',', 'paid', 'time', '.', 'If', 'would', 'like', 'learn', 'Macro', 'Solutions', ',', 'interested', 'joining', 'team', ',', 'would', 'like', 'learn', 'Consultant', 'Care', 'program', 'visit', 'website', '.', 'Macro', 'Solutions', 'Equal', 'Opportunity', 'Employer', '.']","Working Macro Solutions , leading provider IT management consulting services , opportunity collaborate great people passion services provide clients . We immediate need Software Engineer Jrto join team Linthicum , MD . This position requires active TS/SCI Poly . The software Engineer perform application integration configuration Wolters Kluwer 's TeamMate+ software Windows environment . Other scripting maybe required PKI integration . Responsibilities Develop , maintain , enhance complex diverse software systems ( e.g. , processing-intensive analytics , novel algorithm development , manipulation extremely large data sets , real-time systems , business management information systems ) based upon documented requirements . Macro Solutions woman-owned IT management consulting firm helps government organizations select , implement , integrate maintain critical business solutions . A relationship company core , pride building high-touch , high-trust environments clients partners , every level business . Assessed CMMI Maturity Level 3 Development Services ISO 9001:2015 certification , Macro delivers honest , powerful results inside , outward . Deeply invested advancing long lasting employee relationships , distinctive Consultant Care program ensures employees always priority every level organization integral 94 % employee retention rate . Along supportive environment culture thrives dreaming big , getting things done fun together , Macro Solutions offers employees full suite competitive benefits , including health , dental , 401 ( k ) , paid time . If would like learn Macro Solutions , interested joining team , would like learn Consultant Care program visit website . Macro Solutions Equal Opportunity Employer ."
-1,-1,"Plastipak Packaging is a global industry leader in the design, manufacturing, and recycling of plastic rigid containers. Our list of customers include some of the worlds most recognized and respected brands such as Procter & Gamble, Kraft Foods and Pepsi, just to name a few. Our commitment to our employees is demonstrated in numerous awards for innovation, environmental sustainability, and corporate citizenship.
Plastipak follows industry leading protocols to address COVID-19, including regular disinfection, electrostatic cleaning and temperature sensing kiosks at most locations. We strictly adhere to all CDC guidelines to provide a safe working environment for our associates and visitors; including face coverings, social distancing, and hand sanitizer stations.
Named one of America's Best Employers in Michigan by Forbes in 2020, Plastipak offers many great benefits, including:","['Plastipak', 'Packaging', 'is', 'a', 'global', 'industry', 'leader', 'in', 'the', 'design', ',', 'manufacturing', ',', 'and', 'recycling', 'of', 'plastic', 'rigid', 'containers', '.', 'Our', 'list', 'of', 'customers', 'include', 'some', 'of', 'the', 'worlds', 'most', 'recognized', 'and', 'respected', 'brands', 'such', 'as', 'Procter', '&', 'Gamble', ',', 'Kraft', 'Foods', 'and', 'Pepsi', ',', 'just', 'to', 'name', 'a', 'few', '.', 'Our', 'commitment', 'to', 'our', 'employees', 'is', 'demonstrated', 'in', 'numerous', 'awards', 'for', 'innovation', ',', 'environmental', 'sustainability', ',', 'and', 'corporate', 'citizenship', '.', 'Plastipak', 'follows', 'industry', 'leading', 'protocols', 'to', 'address', 'COVID-19', ',', 'including', 'regular', 'disinfection', ',', 'electrostatic', 'cleaning', 'and', 'temperature', 'sensing', 'kiosks', 'at', 'most', 'locations', '.', 'We', 'strictly', 'adhere', 'to', 'all', 'CDC', 'guidelines', 'to', 'provide', 'a', 'safe', 'working', 'environment', 'for', 'our', 'associates', 'and', 'visitors', ';', 'including', 'face', 'coverings', ',', 'social', 'distancing', ',', 'and', 'hand', 'sanitizer', 'stations', '.', 'Named', 'one', 'of', 'America', ""'s"", 'Best', 'Employers', 'in', 'Michigan', 'by', 'Forbes', 'in', '2020', ',', 'Plastipak', 'offers', 'many', 'great', 'benefits', ',', 'including', ':']","['Plastipak', 'Packaging', 'global', 'industry', 'leader', 'design', ',', 'manufacturing', ',', 'recycling', 'plastic', 'rigid', 'containers', '.', 'Our', 'list', 'customers', 'include', 'worlds', 'recognized', 'respected', 'brands', 'Procter', '&', 'Gamble', ',', 'Kraft', 'Foods', 'Pepsi', ',', 'name', '.', 'Our', 'commitment', 'employees', 'demonstrated', 'numerous', 'awards', 'innovation', ',', 'environmental', 'sustainability', ',', 'corporate', 'citizenship', '.', 'Plastipak', 'follows', 'industry', 'leading', 'protocols', 'address', 'COVID-19', ',', 'including', 'regular', 'disinfection', ',', 'electrostatic', 'cleaning', 'temperature', 'sensing', 'kiosks', 'locations', '.', 'We', 'strictly', 'adhere', 'CDC', 'guidelines', 'provide', 'safe', 'working', 'environment', 'associates', 'visitors', ';', 'including', 'face', 'coverings', ',', 'social', 'distancing', ',', 'hand', 'sanitizer', 'stations', '.', 'Named', 'one', 'America', ""'s"", 'Best', 'Employers', 'Michigan', 'Forbes', '2020', ',', 'Plastipak', 'offers', 'many', 'great', 'benefits', ',', 'including', ':']","Plastipak Packaging global industry leader design , manufacturing , recycling plastic rigid containers . Our list customers include worlds recognized respected brands Procter & Gamble , Kraft Foods Pepsi , name . Our commitment employees demonstrated numerous awards innovation , environmental sustainability , corporate citizenship . Plastipak follows industry leading protocols address COVID-19 , including regular disinfection , electrostatic cleaning temperature sensing kiosks locations . We strictly adhere CDC guidelines provide safe working environment associates visitors ; including face coverings , social distancing , hand sanitizer stations . Named one America 's Best Employers Michigan Forbes 2020 , Plastipak offers many great benefits , including :"
-1,-1,"Overview


ProSphere is seeking a Data Scientist to provide services in development of new and enhancement of existing capabilities for information technology systems and applications for the Department of Veterans Affairs. The Data Scientist will lead efforts to expand the data science capabilities of customer’s analytics platform. The individual in this position will have a solid background in production-level machine learning systems with broad exposure to a wide variety of algorithmic techniques. Experience and demonstrable proof of impactful work in areas such as natural language processing, explainability driven deep learning and time-series forecasting is valuable. Our team particularly values experience in building inferential algorithms for high-stake decisions while dealing with noisy, diverse, distributed datasets. Being able to communicate complex concepts in simple language to diverse stakeholders with an unwavering commitment to empathy and customer obsession is highly desired. The candidate will work with the Senior Data Scientist to develop and automate algorithms that integrate with various parts of our customer’s organization, improve customer experience, and drive operational efficiency. The candidate will be able to translate data clearly and dynamically into a coherent and relevant story that will resonate with the customer’s data science initiatives and roadmap. Knowledge and practical work experience with the job functions listed below is highly desirable. This is a full-time remote position. Veterans are encouraged to apply.","['Overview', 'ProSphere', 'is', 'seeking', 'a', 'Data', 'Scientist', 'to', 'provide', 'services', 'in', 'development', 'of', 'new', 'and', 'enhancement', 'of', 'existing', 'capabilities', 'for', 'information', 'technology', 'systems', 'and', 'applications', 'for', 'the', 'Department', 'of', 'Veterans', 'Affairs', '.', 'The', 'Data', 'Scientist', 'will', 'lead', 'efforts', 'to', 'expand', 'the', 'data', 'science', 'capabilities', 'of', 'customer', '’', 's', 'analytics', 'platform', '.', 'The', 'individual', 'in', 'this', 'position', 'will', 'have', 'a', 'solid', 'background', 'in', 'production-level', 'machine', 'learning', 'systems', 'with', 'broad', 'exposure', 'to', 'a', 'wide', 'variety', 'of', 'algorithmic', 'techniques', '.', 'Experience', 'and', 'demonstrable', 'proof', 'of', 'impactful', 'work', 'in', 'areas', 'such', 'as', 'natural', 'language', 'processing', ',', 'explainability', 'driven', 'deep', 'learning', 'and', 'time-series', 'forecasting', 'is', 'valuable', '.', 'Our', 'team', 'particularly', 'values', 'experience', 'in', 'building', 'inferential', 'algorithms', 'for', 'high-stake', 'decisions', 'while', 'dealing', 'with', 'noisy', ',', 'diverse', ',', 'distributed', 'datasets', '.', 'Being', 'able', 'to', 'communicate', 'complex', 'concepts', 'in', 'simple', 'language', 'to', 'diverse', 'stakeholders', 'with', 'an', 'unwavering', 'commitment', 'to', 'empathy', 'and', 'customer', 'obsession', 'is', 'highly', 'desired', '.', 'The', 'candidate', 'will', 'work', 'with', 'the', 'Senior', 'Data', 'Scientist', 'to', 'develop', 'and', 'automate', 'algorithms', 'that', 'integrate', 'with', 'various', 'parts', 'of', 'our', 'customer', '’', 's', 'organization', ',', 'improve', 'customer', 'experience', ',', 'and', 'drive', 'operational', 'efficiency', '.', 'The', 'candidate', 'will', 'be', 'able', 'to', 'translate', 'data', 'clearly', 'and', 'dynamically', 'into', 'a', 'coherent', 'and', 'relevant', 'story', 'that', 'will', 'resonate', 'with', 'the', 'customer', '’', 's', 'data', 'science', 'initiatives', 'and', 'roadmap', '.', 'Knowledge', 'and', 'practical', 'work', 'experience', 'with', 'the', 'job', 'functions', 'listed', 'below', 'is', 'highly', 'desirable', '.', 'This', 'is', 'a', 'full-time', 'remote', 'position', '.', 'Veterans', 'are', 'encouraged', 'to', 'apply', '.']","['Overview', 'ProSphere', 'seeking', 'Data', 'Scientist', 'provide', 'services', 'development', 'new', 'enhancement', 'existing', 'capabilities', 'information', 'technology', 'systems', 'applications', 'Department', 'Veterans', 'Affairs', '.', 'The', 'Data', 'Scientist', 'lead', 'efforts', 'expand', 'data', 'science', 'capabilities', 'customer', '’', 'analytics', 'platform', '.', 'The', 'individual', 'position', 'solid', 'background', 'production-level', 'machine', 'learning', 'systems', 'broad', 'exposure', 'wide', 'variety', 'algorithmic', 'techniques', '.', 'Experience', 'demonstrable', 'proof', 'impactful', 'work', 'areas', 'natural', 'language', 'processing', ',', 'explainability', 'driven', 'deep', 'learning', 'time-series', 'forecasting', 'valuable', '.', 'Our', 'team', 'particularly', 'values', 'experience', 'building', 'inferential', 'algorithms', 'high-stake', 'decisions', 'dealing', 'noisy', ',', 'diverse', ',', 'distributed', 'datasets', '.', 'Being', 'able', 'communicate', 'complex', 'concepts', 'simple', 'language', 'diverse', 'stakeholders', 'unwavering', 'commitment', 'empathy', 'customer', 'obsession', 'highly', 'desired', '.', 'The', 'candidate', 'work', 'Senior', 'Data', 'Scientist', 'develop', 'automate', 'algorithms', 'integrate', 'various', 'parts', 'customer', '’', 'organization', ',', 'improve', 'customer', 'experience', ',', 'drive', 'operational', 'efficiency', '.', 'The', 'candidate', 'able', 'translate', 'data', 'clearly', 'dynamically', 'coherent', 'relevant', 'story', 'resonate', 'customer', '’', 'data', 'science', 'initiatives', 'roadmap', '.', 'Knowledge', 'practical', 'work', 'experience', 'job', 'functions', 'listed', 'highly', 'desirable', '.', 'This', 'full-time', 'remote', 'position', '.', 'Veterans', 'encouraged', 'apply', '.']","Overview ProSphere seeking Data Scientist provide services development new enhancement existing capabilities information technology systems applications Department Veterans Affairs . The Data Scientist lead efforts expand data science capabilities customer ’ analytics platform . The individual position solid background production-level machine learning systems broad exposure wide variety algorithmic techniques . Experience demonstrable proof impactful work areas natural language processing , explainability driven deep learning time-series forecasting valuable . Our team particularly values experience building inferential algorithms high-stake decisions dealing noisy , diverse , distributed datasets . Being able communicate complex concepts simple language diverse stakeholders unwavering commitment empathy customer obsession highly desired . The candidate work Senior Data Scientist develop automate algorithms integrate various parts customer ’ organization , improve customer experience , drive operational efficiency . The candidate able translate data clearly dynamically coherent relevant story resonate customer ’ data science initiatives roadmap . Knowledge practical work experience job functions listed highly desirable . This full-time remote position . Veterans encouraged apply ."
-1,-1,"Who We Are
WillowTree is an award-winning digital product agency driven by innovation and grounded in strategy and user-centered design. We create long-term partnerships with the world's leading brands to design and build digital flagship products crucial to their core business. We are one of the largest independent digital firms in the US. Some of our clients include HBO, National Geographic, Anheuser-Busch, and PepsiCo.
The Opportunity
As a Senior Software Engineer at WillowTree, you'll have the opportunity to impact teammates throughout various stages of their careers. You'll have clear oversight of how engineering runs day-to-day and will influence project outcomes.","['Who', 'We', 'Are', 'WillowTree', 'is', 'an', 'award-winning', 'digital', 'product', 'agency', 'driven', 'by', 'innovation', 'and', 'grounded', 'in', 'strategy', 'and', 'user-centered', 'design', '.', 'We', 'create', 'long-term', 'partnerships', 'with', 'the', 'world', ""'s"", 'leading', 'brands', 'to', 'design', 'and', 'build', 'digital', 'flagship', 'products', 'crucial', 'to', 'their', 'core', 'business', '.', 'We', 'are', 'one', 'of', 'the', 'largest', 'independent', 'digital', 'firms', 'in', 'the', 'US', '.', 'Some', 'of', 'our', 'clients', 'include', 'HBO', ',', 'National', 'Geographic', ',', 'Anheuser-Busch', ',', 'and', 'PepsiCo', '.', 'The', 'Opportunity', 'As', 'a', 'Senior', 'Software', 'Engineer', 'at', 'WillowTree', ',', 'you', ""'ll"", 'have', 'the', 'opportunity', 'to', 'impact', 'teammates', 'throughout', 'various', 'stages', 'of', 'their', 'careers', '.', 'You', ""'ll"", 'have', 'clear', 'oversight', 'of', 'how', 'engineering', 'runs', 'day-to-day', 'and', 'will', 'influence', 'project', 'outcomes', '.']","['Who', 'We', 'Are', 'WillowTree', 'award-winning', 'digital', 'product', 'agency', 'driven', 'innovation', 'grounded', 'strategy', 'user-centered', 'design', '.', 'We', 'create', 'long-term', 'partnerships', 'world', ""'s"", 'leading', 'brands', 'design', 'build', 'digital', 'flagship', 'products', 'crucial', 'core', 'business', '.', 'We', 'one', 'largest', 'independent', 'digital', 'firms', 'US', '.', 'Some', 'clients', 'include', 'HBO', ',', 'National', 'Geographic', ',', 'Anheuser-Busch', ',', 'PepsiCo', '.', 'The', 'Opportunity', 'As', 'Senior', 'Software', 'Engineer', 'WillowTree', ',', ""'ll"", 'opportunity', 'impact', 'teammates', 'throughout', 'various', 'stages', 'careers', '.', 'You', ""'ll"", 'clear', 'oversight', 'engineering', 'runs', 'day-to-day', 'influence', 'project', 'outcomes', '.']","Who We Are WillowTree award-winning digital product agency driven innovation grounded strategy user-centered design . We create long-term partnerships world 's leading brands design build digital flagship products crucial core business . We one largest independent digital firms US . Some clients include HBO , National Geographic , Anheuser-Busch , PepsiCo . The Opportunity As Senior Software Engineer WillowTree , 'll opportunity impact teammates throughout various stages careers . You 'll clear oversight engineering runs day-to-day influence project outcomes ."
