Job Title,Company Name,Job Description,Tokenized,Stop Words Removed,Finished Text
-1,-1,"Position Overview
Our Senior IT Systems & Network Engineers hold a wealth of knowledge regarding complex LAN and WAN network infrastructure. They are able to provide the highest level of network system maintenance and support, and are expected to have leading-class knowledge of hardware, software, networking, and security. A Senior Systems & Network Engineer should have years of experience working in the field, and should have a strong background in customer service and team leadership. Individuals must possess excellent technical and troubleshooting skills, and must also have outstanding personal skills as working closely with customers is imperative.
Note: This position is generally not remote. We may consider select remote candidates who are located within Iowa. Candidates outside of Iowa will be required to relocate to the Iowa Great Lakes region.","['Position', 'Overview', 'Our', 'Senior', 'IT', 'Systems', '&', 'Network', 'Engineers', 'hold', 'a', 'wealth', 'of', 'knowledge', 'regarding', 'complex', 'LAN', 'and', 'WAN', 'network', 'infrastructure', '.', 'They', 'are', 'able', 'to', 'provide', 'the', 'highest', 'level', 'of', 'network', 'system', 'maintenance', 'and', 'support', ',', 'and', 'are', 'expected', 'to', 'have', 'leading-class', 'knowledge', 'of', 'hardware', ',', 'software', ',', 'networking', ',', 'and', 'security', '.', 'A', 'Senior', 'Systems', '&', 'Network', 'Engineer', 'should', 'have', 'years', 'of', 'experience', 'working', 'in', 'the', 'field', ',', 'and', 'should', 'have', 'a', 'strong', 'background', 'in', 'customer', 'service', 'and', 'team', 'leadership', '.', 'Individuals', 'must', 'possess', 'excellent', 'technical', 'and', 'troubleshooting', 'skills', ',', 'and', 'must', 'also', 'have', 'outstanding', 'personal', 'skills', 'as', 'working', 'closely', 'with', 'customers', 'is', 'imperative', '.', 'Note', ':', 'This', 'position', 'is', 'generally', 'not', 'remote', '.', 'We', 'may', 'consider', 'select', 'remote', 'candidates', 'who', 'are', 'located', 'within', 'Iowa', '.', 'Candidates', 'outside', 'of', 'Iowa', 'will', 'be', 'required', 'to', 'relocate', 'to', 'the', 'Iowa', 'Great', 'Lakes', 'region', '.']","['Position', 'Overview', 'Our', 'Senior', 'IT', 'Systems', '&', 'Network', 'Engineers', 'hold', 'wealth', 'knowledge', 'regarding', 'complex', 'LAN', 'WAN', 'network', 'infrastructure', '.', 'They', 'able', 'provide', 'highest', 'level', 'network', 'system', 'maintenance', 'support', ',', 'expected', 'leading-class', 'knowledge', 'hardware', ',', 'software', ',', 'networking', ',', 'security', '.', 'A', 'Senior', 'Systems', '&', 'Network', 'Engineer', 'years', 'experience', 'working', 'field', ',', 'strong', 'background', 'customer', 'service', 'team', 'leadership', '.', 'Individuals', 'must', 'possess', 'excellent', 'technical', 'troubleshooting', 'skills', ',', 'must', 'also', 'outstanding', 'personal', 'skills', 'working', 'closely', 'customers', 'imperative', '.', 'Note', ':', 'This', 'position', 'generally', 'remote', '.', 'We', 'may', 'consider', 'select', 'remote', 'candidates', 'located', 'within', 'Iowa', '.', 'Candidates', 'outside', 'Iowa', 'required', 'relocate', 'Iowa', 'Great', 'Lakes', 'region', '.']","Position Overview Our Senior IT Systems & Network Engineers hold wealth knowledge regarding complex LAN WAN network infrastructure . They able provide highest level network system maintenance support , expected leading-class knowledge hardware , software , networking , security . A Senior Systems & Network Engineer years experience working field , strong background customer service team leadership . Individuals must possess excellent technical troubleshooting skills , must also outstanding personal skills working closely customers imperative . Note : This position generally remote . We may consider select remote candidates located within Iowa . Candidates outside Iowa required relocate Iowa Great Lakes region ."
-1,-1,"Control Systems Project Engineer
Location: Eagle Mountain, Utah
Experience: 5+ Years
Relocation/Signing Bonus Offered.
Data Center Development will be Huge Over the Next 20 Years!
Join a world class automation engineering firm! Thermo Systems seeks energetic team members who strive to succeed and make a difference in a fast-paced, hands-on, engineering environment. Our greatest asset is our team and we work hard to create a rewarding environment. Be part of something unique; excel and enjoy.","['Control', 'Systems', 'Project', 'Engineer', 'Location', ':', 'Eagle', 'Mountain', ',', 'Utah', 'Experience', ':', '5+', 'Years', 'Relocation/Signing', 'Bonus', 'Offered', '.', 'Data', 'Center', 'Development', 'will', 'be', 'Huge', 'Over', 'the', 'Next', '20', 'Years', '!', 'Join', 'a', 'world', 'class', 'automation', 'engineering', 'firm', '!', 'Thermo', 'Systems', 'seeks', 'energetic', 'team', 'members', 'who', 'strive', 'to', 'succeed', 'and', 'make', 'a', 'difference', 'in', 'a', 'fast-paced', ',', 'hands-on', ',', 'engineering', 'environment', '.', 'Our', 'greatest', 'asset', 'is', 'our', 'team', 'and', 'we', 'work', 'hard', 'to', 'create', 'a', 'rewarding', 'environment', '.', 'Be', 'part', 'of', 'something', 'unique', ';', 'excel', 'and', 'enjoy', '.']","['Control', 'Systems', 'Project', 'Engineer', 'Location', ':', 'Eagle', 'Mountain', ',', 'Utah', 'Experience', ':', '5+', 'Years', 'Relocation/Signing', 'Bonus', 'Offered', '.', 'Data', 'Center', 'Development', 'Huge', 'Over', 'Next', '20', 'Years', '!', 'Join', 'world', 'class', 'automation', 'engineering', 'firm', '!', 'Thermo', 'Systems', 'seeks', 'energetic', 'team', 'members', 'strive', 'succeed', 'make', 'difference', 'fast-paced', ',', 'hands-on', ',', 'engineering', 'environment', '.', 'Our', 'greatest', 'asset', 'team', 'work', 'hard', 'create', 'rewarding', 'environment', '.', 'Be', 'part', 'something', 'unique', ';', 'excel', 'enjoy', '.']","Control Systems Project Engineer Location : Eagle Mountain , Utah Experience : 5+ Years Relocation/Signing Bonus Offered . Data Center Development Huge Over Next 20 Years ! Join world class automation engineering firm ! Thermo Systems seeks energetic team members strive succeed make difference fast-paced , hands-on , engineering environment . Our greatest asset team work hard create rewarding environment . Be part something unique ; excel enjoy ."
-1,-1,"NIDEC-SHIMPO AMERICA is a leading global manufacturer of high precision gearing technologies for motion control applications. Established in 1952, NIDEC-SHIMPO is based out of Kyoto, Japan with manufacturing facilities throughout the Asia-Pacific, Europe and North America . With traditional roots that began imbedded in the development of mechanical variable speed drives, NIDEC-SHIMPO has grown and evolved into a manufacturer of several gearing technologies that cover a wide range of applications. Our products help drive the most productive equipment in the world.
NIDEC-SHIMPO AMERICA has been supporting the North American market for over 40 years out of our facility in Glendale Heights, Illinois. We are continuously expanding our resources and capabilities to facilitate our long-term growth plans for North America.
We are seeking a highly motivated, self-driven Application Engineer that has the ability to perform in a dynamic environment. The primary responsibility of the person in this position will be to assist and support existing and potential customers in the selection, application and commissioning of the proper precision gearing products that deliver the optimum solution for the customer’s machine and process applications. To further leverage their product knowledge, this individual will organize, create and provide the information, tools and training necessary for the effective sales and support of NIDEC-SHIMPO products in the market. In addition to directly supporting our customers and sales team, the applications engineer will provide valuable feedback to the company management and R&D organization to enhance existing products and develop appropriate new products for the target customer markets.","['NIDEC-SHIMPO', 'AMERICA', 'is', 'a', 'leading', 'global', 'manufacturer', 'of', 'high', 'precision', 'gearing', 'technologies', 'for', 'motion', 'control', 'applications', '.', 'Established', 'in', '1952', ',', 'NIDEC-SHIMPO', 'is', 'based', 'out', 'of', 'Kyoto', ',', 'Japan', 'with', 'manufacturing', 'facilities', 'throughout', 'the', 'Asia-Pacific', ',', 'Europe', 'and', 'North', 'America', '.', 'With', 'traditional', 'roots', 'that', 'began', 'imbedded', 'in', 'the', 'development', 'of', 'mechanical', 'variable', 'speed', 'drives', ',', 'NIDEC-SHIMPO', 'has', 'grown', 'and', 'evolved', 'into', 'a', 'manufacturer', 'of', 'several', 'gearing', 'technologies', 'that', 'cover', 'a', 'wide', 'range', 'of', 'applications', '.', 'Our', 'products', 'help', 'drive', 'the', 'most', 'productive', 'equipment', 'in', 'the', 'world', '.', 'NIDEC-SHIMPO', 'AMERICA', 'has', 'been', 'supporting', 'the', 'North', 'American', 'market', 'for', 'over', '40', 'years', 'out', 'of', 'our', 'facility', 'in', 'Glendale', 'Heights', ',', 'Illinois', '.', 'We', 'are', 'continuously', 'expanding', 'our', 'resources', 'and', 'capabilities', 'to', 'facilitate', 'our', 'long-term', 'growth', 'plans', 'for', 'North', 'America', '.', 'We', 'are', 'seeking', 'a', 'highly', 'motivated', ',', 'self-driven', 'Application', 'Engineer', 'that', 'has', 'the', 'ability', 'to', 'perform', 'in', 'a', 'dynamic', 'environment', '.', 'The', 'primary', 'responsibility', 'of', 'the', 'person', 'in', 'this', 'position', 'will', 'be', 'to', 'assist', 'and', 'support', 'existing', 'and', 'potential', 'customers', 'in', 'the', 'selection', ',', 'application', 'and', 'commissioning', 'of', 'the', 'proper', 'precision', 'gearing', 'products', 'that', 'deliver', 'the', 'optimum', 'solution', 'for', 'the', 'customer', '’', 's', 'machine', 'and', 'process', 'applications', '.', 'To', 'further', 'leverage', 'their', 'product', 'knowledge', ',', 'this', 'individual', 'will', 'organize', ',', 'create', 'and', 'provide', 'the', 'information', ',', 'tools', 'and', 'training', 'necessary', 'for', 'the', 'effective', 'sales', 'and', 'support', 'of', 'NIDEC-SHIMPO', 'products', 'in', 'the', 'market', '.', 'In', 'addition', 'to', 'directly', 'supporting', 'our', 'customers', 'and', 'sales', 'team', ',', 'the', 'applications', 'engineer', 'will', 'provide', 'valuable', 'feedback', 'to', 'the', 'company', 'management', 'and', 'R', '&', 'D', 'organization', 'to', 'enhance', 'existing', 'products', 'and', 'develop', 'appropriate', 'new', 'products', 'for', 'the', 'target', 'customer', 'markets', '.']","['NIDEC-SHIMPO', 'AMERICA', 'leading', 'global', 'manufacturer', 'high', 'precision', 'gearing', 'technologies', 'motion', 'control', 'applications', '.', 'Established', '1952', ',', 'NIDEC-SHIMPO', 'based', 'Kyoto', ',', 'Japan', 'manufacturing', 'facilities', 'throughout', 'Asia-Pacific', ',', 'Europe', 'North', 'America', '.', 'With', 'traditional', 'roots', 'began', 'imbedded', 'development', 'mechanical', 'variable', 'speed', 'drives', ',', 'NIDEC-SHIMPO', 'grown', 'evolved', 'manufacturer', 'several', 'gearing', 'technologies', 'cover', 'wide', 'range', 'applications', '.', 'Our', 'products', 'help', 'drive', 'productive', 'equipment', 'world', '.', 'NIDEC-SHIMPO', 'AMERICA', 'supporting', 'North', 'American', 'market', '40', 'years', 'facility', 'Glendale', 'Heights', ',', 'Illinois', '.', 'We', 'continuously', 'expanding', 'resources', 'capabilities', 'facilitate', 'long-term', 'growth', 'plans', 'North', 'America', '.', 'We', 'seeking', 'highly', 'motivated', ',', 'self-driven', 'Application', 'Engineer', 'ability', 'perform', 'dynamic', 'environment', '.', 'The', 'primary', 'responsibility', 'person', 'position', 'assist', 'support', 'existing', 'potential', 'customers', 'selection', ',', 'application', 'commissioning', 'proper', 'precision', 'gearing', 'products', 'deliver', 'optimum', 'solution', 'customer', '’', 'machine', 'process', 'applications', '.', 'To', 'leverage', 'product', 'knowledge', ',', 'individual', 'organize', ',', 'create', 'provide', 'information', ',', 'tools', 'training', 'necessary', 'effective', 'sales', 'support', 'NIDEC-SHIMPO', 'products', 'market', '.', 'In', 'addition', 'directly', 'supporting', 'customers', 'sales', 'team', ',', 'applications', 'engineer', 'provide', 'valuable', 'feedback', 'company', 'management', 'R', '&', 'D', 'organization', 'enhance', 'existing', 'products', 'develop', 'appropriate', 'new', 'products', 'target', 'customer', 'markets', '.']","NIDEC-SHIMPO AMERICA leading global manufacturer high precision gearing technologies motion control applications . Established 1952 , NIDEC-SHIMPO based Kyoto , Japan manufacturing facilities throughout Asia-Pacific , Europe North America . With traditional roots began imbedded development mechanical variable speed drives , NIDEC-SHIMPO grown evolved manufacturer several gearing technologies cover wide range applications . Our products help drive productive equipment world . NIDEC-SHIMPO AMERICA supporting North American market 40 years facility Glendale Heights , Illinois . We continuously expanding resources capabilities facilitate long-term growth plans North America . We seeking highly motivated , self-driven Application Engineer ability perform dynamic environment . The primary responsibility person position assist support existing potential customers selection , application commissioning proper precision gearing products deliver optimum solution customer ’ machine process applications . To leverage product knowledge , individual organize , create provide information , tools training necessary effective sales support NIDEC-SHIMPO products market . In addition directly supporting customers sales team , applications engineer provide valuable feedback company management R & D organization enhance existing products develop appropriate new products target customer markets ."
-1,-1,"WHO WE ARE:
Voted one of the Top 100 Fastest Growing Companies in the Bay Area for 2020, Freedom Financial Network is a family of companies that takes a people-first approach to financial services, using technology to empower consumers to overcome debt and create a brighter financial future. The company was founded in 2002 by Brad Stroh and Andrew Housser on the belief that by staying committed to helping people, you can ensure better financial outcomes for both the customer and the business. This Heart/$ philosophy still guides the vision of our growing company, which has helped millions of people find solutions for their financial needs.
What began with 2 people in a spare bedroom has now rapidly expanded to a vibrant business that employs over 2000 employees (known internally as The Freedom Family) in two locations: San Mateo, CA and Tempe, AZ. When you visit either of our offices, you’ll understand why our employees have voted us the Best Place to Work for the last several years. It’s a place where the Heart/$ philosophy continues to thrive, where we believe that success is only achieved by doing what’s right for our customers, our employees, and our communities.
Some of the key responsibilities for the Analytic Scientist will include:","['WHO', 'WE', 'ARE', ':', 'Voted', 'one', 'of', 'the', 'Top', '100', 'Fastest', 'Growing', 'Companies', 'in', 'the', 'Bay', 'Area', 'for', '2020', ',', 'Freedom', 'Financial', 'Network', 'is', 'a', 'family', 'of', 'companies', 'that', 'takes', 'a', 'people-first', 'approach', 'to', 'financial', 'services', ',', 'using', 'technology', 'to', 'empower', 'consumers', 'to', 'overcome', 'debt', 'and', 'create', 'a', 'brighter', 'financial', 'future', '.', 'The', 'company', 'was', 'founded', 'in', '2002', 'by', 'Brad', 'Stroh', 'and', 'Andrew', 'Housser', 'on', 'the', 'belief', 'that', 'by', 'staying', 'committed', 'to', 'helping', 'people', ',', 'you', 'can', 'ensure', 'better', 'financial', 'outcomes', 'for', 'both', 'the', 'customer', 'and', 'the', 'business', '.', 'This', 'Heart/', '$', 'philosophy', 'still', 'guides', 'the', 'vision', 'of', 'our', 'growing', 'company', ',', 'which', 'has', 'helped', 'millions', 'of', 'people', 'find', 'solutions', 'for', 'their', 'financial', 'needs', '.', 'What', 'began', 'with', '2', 'people', 'in', 'a', 'spare', 'bedroom', 'has', 'now', 'rapidly', 'expanded', 'to', 'a', 'vibrant', 'business', 'that', 'employs', 'over', '2000', 'employees', '(', 'known', 'internally', 'as', 'The', 'Freedom', 'Family', ')', 'in', 'two', 'locations', ':', 'San', 'Mateo', ',', 'CA', 'and', 'Tempe', ',', 'AZ', '.', 'When', 'you', 'visit', 'either', 'of', 'our', 'offices', ',', 'you', '’', 'll', 'understand', 'why', 'our', 'employees', 'have', 'voted', 'us', 'the', 'Best', 'Place', 'to', 'Work', 'for', 'the', 'last', 'several', 'years', '.', 'It', '’', 's', 'a', 'place', 'where', 'the', 'Heart/', '$', 'philosophy', 'continues', 'to', 'thrive', ',', 'where', 'we', 'believe', 'that', 'success', 'is', 'only', 'achieved', 'by', 'doing', 'what', '’', 's', 'right', 'for', 'our', 'customers', ',', 'our', 'employees', ',', 'and', 'our', 'communities', '.', 'Some', 'of', 'the', 'key', 'responsibilities', 'for', 'the', 'Analytic', 'Scientist', 'will', 'include', ':']","['WHO', 'WE', 'ARE', ':', 'Voted', 'one', 'Top', '100', 'Fastest', 'Growing', 'Companies', 'Bay', 'Area', '2020', ',', 'Freedom', 'Financial', 'Network', 'family', 'companies', 'takes', 'people-first', 'approach', 'financial', 'services', ',', 'using', 'technology', 'empower', 'consumers', 'overcome', 'debt', 'create', 'brighter', 'financial', 'future', '.', 'The', 'company', 'founded', '2002', 'Brad', 'Stroh', 'Andrew', 'Housser', 'belief', 'staying', 'committed', 'helping', 'people', ',', 'ensure', 'better', 'financial', 'outcomes', 'customer', 'business', '.', 'This', 'Heart/', '$', 'philosophy', 'still', 'guides', 'vision', 'growing', 'company', ',', 'helped', 'millions', 'people', 'find', 'solutions', 'financial', 'needs', '.', 'What', 'began', '2', 'people', 'spare', 'bedroom', 'rapidly', 'expanded', 'vibrant', 'business', 'employs', '2000', 'employees', '(', 'known', 'internally', 'The', 'Freedom', 'Family', ')', 'two', 'locations', ':', 'San', 'Mateo', ',', 'CA', 'Tempe', ',', 'AZ', '.', 'When', 'visit', 'either', 'offices', ',', '’', 'understand', 'employees', 'voted', 'us', 'Best', 'Place', 'Work', 'last', 'several', 'years', '.', 'It', '’', 'place', 'Heart/', '$', 'philosophy', 'continues', 'thrive', ',', 'believe', 'success', 'achieved', '’', 'right', 'customers', ',', 'employees', ',', 'communities', '.', 'Some', 'key', 'responsibilities', 'Analytic', 'Scientist', 'include', ':']","WHO WE ARE : Voted one Top 100 Fastest Growing Companies Bay Area 2020 , Freedom Financial Network family companies takes people-first approach financial services , using technology empower consumers overcome debt create brighter financial future . The company founded 2002 Brad Stroh Andrew Housser belief staying committed helping people , ensure better financial outcomes customer business . This Heart/ $ philosophy still guides vision growing company , helped millions people find solutions financial needs . What began 2 people spare bedroom rapidly expanded vibrant business employs 2000 employees ( known internally The Freedom Family ) two locations : San Mateo , CA Tempe , AZ . When visit either offices , ’ understand employees voted us Best Place Work last several years . It ’ place Heart/ $ philosophy continues thrive , believe success achieved ’ right customers , employees , communities . Some key responsibilities Analytic Scientist include :"
-1,-1,"Job Description:
At Fidelity’s Artificial Intelligence Center of Excellence (COE), you won’t be just tinkering around the edges, you’ll be building critical solutions that will benefit our clients for years to come. We work closely with business stakeholders, collect requirements and deliver high value AI/ML solutions that drive customer and business value. Those of us who love to work with data see this as the pinnacle of opportunities that you cannot find anywhere else in the industry.
The AI COE is seeking a Principal Data Scientist with experience in Virtual Assistants or chatbots, Natural Language Processing/text analytics, machine learning, various deep learning related technologies, predictive and prescriptive analytics.","['Job', 'Description', ':', 'At', 'Fidelity', '’', 's', 'Artificial', 'Intelligence', 'Center', 'of', 'Excellence', '(', 'COE', ')', ',', 'you', 'won', '’', 't', 'be', 'just', 'tinkering', 'around', 'the', 'edges', ',', 'you', '’', 'll', 'be', 'building', 'critical', 'solutions', 'that', 'will', 'benefit', 'our', 'clients', 'for', 'years', 'to', 'come', '.', 'We', 'work', 'closely', 'with', 'business', 'stakeholders', ',', 'collect', 'requirements', 'and', 'deliver', 'high', 'value', 'AI/ML', 'solutions', 'that', 'drive', 'customer', 'and', 'business', 'value', '.', 'Those', 'of', 'us', 'who', 'love', 'to', 'work', 'with', 'data', 'see', 'this', 'as', 'the', 'pinnacle', 'of', 'opportunities', 'that', 'you', 'can', 'not', 'find', 'anywhere', 'else', 'in', 'the', 'industry', '.', 'The', 'AI', 'COE', 'is', 'seeking', 'a', 'Principal', 'Data', 'Scientist', 'with', 'experience', 'in', 'Virtual', 'Assistants', 'or', 'chatbots', ',', 'Natural', 'Language', 'Processing/text', 'analytics', ',', 'machine', 'learning', ',', 'various', 'deep', 'learning', 'related', 'technologies', ',', 'predictive', 'and', 'prescriptive', 'analytics', '.']","['Job', 'Description', ':', 'At', 'Fidelity', '’', 'Artificial', 'Intelligence', 'Center', 'Excellence', '(', 'COE', ')', ',', '’', 'tinkering', 'around', 'edges', ',', '’', 'building', 'critical', 'solutions', 'benefit', 'clients', 'years', 'come', '.', 'We', 'work', 'closely', 'business', 'stakeholders', ',', 'collect', 'requirements', 'deliver', 'high', 'value', 'AI/ML', 'solutions', 'drive', 'customer', 'business', 'value', '.', 'Those', 'us', 'love', 'work', 'data', 'see', 'pinnacle', 'opportunities', 'find', 'anywhere', 'else', 'industry', '.', 'The', 'AI', 'COE', 'seeking', 'Principal', 'Data', 'Scientist', 'experience', 'Virtual', 'Assistants', 'chatbots', ',', 'Natural', 'Language', 'Processing/text', 'analytics', ',', 'machine', 'learning', ',', 'various', 'deep', 'learning', 'related', 'technologies', ',', 'predictive', 'prescriptive', 'analytics', '.']","Job Description : At Fidelity ’ Artificial Intelligence Center Excellence ( COE ) , ’ tinkering around edges , ’ building critical solutions benefit clients years come . We work closely business stakeholders , collect requirements deliver high value AI/ML solutions drive customer business value . Those us love work data see pinnacle opportunities find anywhere else industry . The AI COE seeking Principal Data Scientist experience Virtual Assistants chatbots , Natural Language Processing/text analytics , machine learning , various deep learning related technologies , predictive prescriptive analytics ."
