Company Name,Job Title,Job Location,Job Description
Meta,"Data Scientist, AI Machine Learning - Product Analytics",Remote,"As a Machine Learning Data Scientist at Meta, you will have the opportunity to do groundbreaking applied machine learning work that will shape the industry and the future of people-facing and business-facing advanced AI solutions we build to solve problems and make user experience better across Meta. Our work spans the spectrum from near-term (working closely with product teams to improve people’s experience within a given half) to medium-term (inventing AI solutions that we then inspire product teams to adopt), to long-term (blue-sky AI research without any specific applications in mind).By applying your Machine Learning/AI knowledge and technical skills, analytical mindset, and product intuition to one of the richest data sets in the world, you will help define the experiences we build for billions of people and hundreds of millions of businesses around the world. You will collaborate on a wide array of product and business problems with a diverse set of cross-functional partners across Product, Engineering, Research, Data Engineering, Marketing, Sales, Finance and others. You will use Machine Learning/AI knowledge, data and analysis to identify and solve advanced AI research and product development’s biggest challenges. You will influence AI research and product strategy and investment decisions with data, be focused on impact, and collaborate with other teams. By joining Meta, you will become part of a world-class analytics community dedicated to skill development and career growth in analytics, data science, machine learning, AI and beyond.About the role:Product leadership: You will use data to understand the product and business ecosystem, quantify new opportunities, identify upcoming challenges, and shape product development to bring value to people, businesses, and Meta. You will help develop strategy and support leadership in prioritizing what to build and setting goals for execution. You will evaluate tradeoffs of shipped features/ML systems, and drive large efforts across multiple teams to reduce technical debt.Analytics: You will guide product teams using data and insights. You will focus on developing hypotheses and employ a diverse toolkit of rigorous analytical approaches, different methodologies, frameworks, and technical approaches including ML to test them. You will research challenging ML questions to inform experimentation and ML development, build and code measurement frameworks, tools, and instrumentation to measure and analyze data used within the ML lifecycle.Communication and influence: You won’t simply present data, but tell data-driven stories. You will convince and influence leaders using clear insights and recommendations. You will build credibility through structure and clarity, and be a trusted strategic partner.














Facebook's mission is to give people the power to build community and bring the world closer together. Through our family of apps and services, we're building a different kind of company that connects billions of people around the world, gives them ways to share what matters most to them, and helps bring people closer together. Whether we're creating new products or helping a small business expand its reach, people at Facebook are builders at heart. Our global teams are constantly iterating, solving problems, and working together to empower people around the world to build community and connect in meaningful ways. Together, we can help people build stronger communities - we're just getting started.

Facebook is proud to be an Equal Opportunity and Affirmative Action employer. We do not discriminate based upon race, religion, color, national origin, sex (including pregnancy, childbirth, or related medical conditions), sexual orientation, gender, gender identity, gender expression, transgender status, sexual stereotypes, age, status as a protected veteran, status as an individual with a disability, or other applicable legally protected characteristics. We also consider qualified applicants with criminal histories, consistent with applicable federal, state and local law.Facebook is committed to providing reasonable accommodations for candidates with disabilities in our recruiting process. If you need any assistance or accommodations due to a disability, please let us know at accommodations-ext@fb.com."
Vinformatix,Sr. Data Scientist,Remote,"About us
Founded in Baton Rouge, LA in 2008, Vinformatix, LLC helps customers in the public and private sectors to meet complex challenges with custom web-based solutions that are user-friendly, reliable, and scalable. As a leading representative of Louisiana’s emerging home-grown digital economy; we create software and web-based solutions that help public sector agencies increase productivity, mobility, effectiveness, and the security of public information. Our services include multi-platform web and mobile application development, software and hardware systems integration, data analytics development, GIS related services, and business automation and consulting services.
Purpose
Our client seeks to augment their staff of highly qualified scientific and technical personnel in order to meet its scientific mandates and responsibilities. The selected candidate will support the organization’s mission to improve the health workforce through scientific research, evaluation of federal workforce programs, data collection, and statistical analyses; and, support designing and conducting statistical analyses and research projects concerning the characteristics of dynamics and interrelationships within and utilization of occupations in the U.S. health care workforce. The expected outcome is to expand the organization’s capabilities to analyze the U.S. health care workforce and evaluate workforce programs administered by the Bureau of Health Workforce."
Advantage Technical,Data Scientist,"Laurel, MD","Job Title: Data Scientist
Job Location: Laurel, MD
Hourly Rate: Up to $81.93/hr depending on experience
Length of Assignment: 7 Months+

Job Summary:
Come join our team! We currently have an outstanding contract position for a Data Scientist / Operations Research Analyst with a minimum 2 years of professional experience in data science, advanced analytics, or operations research, including projects requiring statistics and data visualization expertise to join a leading research company located in Laurel, MD.
Job Description:
We are seeking data science and operations research expertise to support the national COVID-19 response.
Responsibilities:
Required:
Preferred:
Note:"
Liberty Mutual Insurance,Data Scientist/ Data Science Analyst I,Remote,"At Liberty Mutual, our purpose is to help people embrace today and confidently pursue tomorrow. That's why we provide an environment focused on openness, inclusion, trust and respect. Here, you'll discover our expansive range of roles, and a workplace where we aim to help turn your passion into a rewarding profession.
Liberty Mutual has proudly been recognized as a “Great Place to Work” by Great Place to Work® US for the past several years. We were also selected as one of the “100 Best Places to Work in IT” on IDG's Insider Pro and Computerworld's 2020 list. For many years running, we have been named by Forbes as one of America's Best Employers for Women and one of America's Best Employers for New Graduates—as well as one of America's Best Employers for Diversity. To learn more about our commitment to diversity and inclusion please visit: https://jobs.libertymutualgroup.com/diversity-inclusion
We value your hard work, integrity and commitment to make things better, and we put people first by offering you benefits that support your life and well-being. To learn more about our benefit offerings please visit: https://LMI.co/Benefits
Liberty Mutual is an equal opportunity employer. We will not tolerate discrimination on the basis of race, color, national origin, sex, sexual orientation, gender identity, religion, age, disability, veteran's status, pregnancy, genetic information or on any basis prohibited by federal, state or local law.

Bachelor's Degree
17"
NIKE INC,Data Scientist,"Carlton, OR","Become a Part of the NIKE, Inc. Team


NIKE, Inc. does more than outfit the world’s best athletes. It is a place to explore potential, obliterate boundaries and push out the edges of what can be. The company looks for people who can grow, think, dream and create. Its culture thrives by embracing diversity and rewarding imagination. The brand seeks achievers, leaders and visionaries. At NIKE, Inc. it’s about each person bringing skills and passion to a challenging and constantly evolving game.

Nike Analytics encompasses multiple teams across the enterprise. As a Nike Data Science Engineer you will be responsible for assessing and analyzing data, building predictive models and delivering valuable insights to key stakeholders across the business. We want to make every Nike decision better because of data! Data Science interns will have the opportunity to work on one of the teams described below.

Commercial Analytics:























Preferred qualifications:"
The Home Depot,"Data Scientist, Marketing & Online (Remote)","Atlanta, GA","The Home Depot is able to offer virtual employment of this position in the following states: AL, AK, AZ, AR, DE, DC, FL, GA, HI, ID, IL, IN, IA, KS, KY, LA, ME, MD, MA, MI, MN, MS, MO, MT, NE, NH, NJ, NM, NY, NC, ND, OH, OK, OR, PA, RI, SC, SD, TN, TX, UT, VT, VA, WA, WV, WI, WY

Position Purpose:
The Data Scientist is responsible for supporting data science initiatives that drive business profitability, increased efficiencies and improved customer experience. This role applies industry-leading analytical methodologies for working with large datasets to extract meaningful business insight and creatively solve business problems. Data Scientists are also responsible for ensuring that developed codes are documented into a library of reusable algorithms. Based on the specific data science team, this role would need to be knowledgeable in one or more data science specializations, such as optimization, computer vision, recommendation, search or NLP.

As a Data Scientist, you will apply advanced analytics methods and algorithms for identifying trends and providing business solutions. This role is expected to present insights and recommendations to non-technical audiences and explain the benefits and impacts of the recommended solutions. In addition, Data Scientists collaborate with business partners and cross-functional teams, requiring effective communication skills, building relationships, and focus on understanding the overall business area being supported.




This position typically reports to Manager or above

This position has 0 Direct Reports



1. Located in a comfortable indoor area. Any unpleasant conditions would be infrequent and not objectionable.

Typically requires overnight travel less than 10% of the time.

























-"
"The Travelers Companies, Inc.",Data Scientist,"Hartford, CT","Company Summary
Taking care of our customers, our communities and each other. That’s the Travelers Promise. By honoring this commitment, we have maintained our reputation as one of the best property casualty insurers in the industry for over 160 years. Join us to discover a culture that is rooted in innovation and thrives on collaboration. Imagine loving what you do and where you do it.
Job Category
Analytics & Research
Target Openings
1
Travelers Data Scientists are taking the organization to the next level of intelligence by using advanced statistical techniques and machine learning algorithms. As a Data Scientist, you will work with business partners to tell the story using data by identifying challenges and opportunities for data analysis and experiments. You will build models that solve key business challenges and enhance our customer experience."
Allstate,Lead Data Scientist Consultant (Remote - Homebased Worker),"Northbrook, IL","The world isn’t standing still, and neither is Allstate. We’re moving quickly, looking across our businesses and brands and taking bold steps to better serve customers’ evolving needs. That’s why now is an exciting time to join our team. You’ll have opportunities to take risks, challenge the status quo and shape the future for the greater good.
You’ll do all this in an environment of excellence and the highest ethical standards – a place where values such as integrity, inclusive diversity and accountability are paramount. We empower every employee to lead, drive change and give back where they work and live. Our people are our greatest strength, and we work as one team in service of our customers and communities.
Everything we do at Allstate is driven by a shared purpose: to protect people from life’s uncertainties so they can realize their hopes and dreams. For more than 89 years we’ve thrived by staying a step ahead of whatever’s coming next – to give customers peace of mind no matter what changes they face. We acted with conviction to advocate for seat belts, air bags and graduated driving laws. We help give survivors of domestic violence a voice through financial empowerment. We’ve been an industry leader in pricing sophistication, telematics, digital photo claims and, more recently, device and identity protection. We are the Good Hands. We don’t follow the trends. We set them. Job Summary

This role is responsible for leading the use of data to make decisions. This includes: the development and recommendation of new machine learning predictive modeling algorithms, the coding/development of tools that use machine learning/predictive modeling to make business decisions, searching for and integrating new data (both internal and external) that improves our modeling and machine learning results (and ultimately our decisions), and discovery of new business problems that can be solved through the use of machine learning/predictive modeling. The role is responsible for assisting in the recruitment, selection, mentorship and development of junior data scientists. This role will also begin to manage projects of medium to high complexity.
Key Responsibilities

Uses best practices to develop complex statistical, machine learning techniques to build models that address business needs and to improve the accuracy of our data and data-driven decisions
Reviews, evaluates, communicates and makes recommendation on appropriateness of modeling techniques and results to team, leadership and stakeholders to ensure these are well understood and incorporated into business processes. Develops and executes communication strategy, keeping stakeholders informed and influencing business partners and senior leaders on the effectiveness of machine learning/predictive modeling to solve business problems.
Collaborates with outside business units and works on data and complex business problems in order to improve the effectiveness of business decisions and business results through designing, building, and partnering to implement machine learning/predictive models. Effectively understand the business' problems and requirements to identify the optimal modeling approach. Develops frameworks/prototypes that integrate data and machine learning/predictive modeling to make business decisions.
Identifies languages and tools that can bring efficiencies or needed techniques to the team. Identifies new areas of data, research and models and develops data sources that can solve business problems.
Utilizes effective project planning techniques to break down complex machine learning/predictive modeling and/or development projects into tasks, manage scope of projects, and ensure deadlines are kept. Manages various analytical and modeling projects with small number of team members.
Mentors and develops others
This job does not have supervisory responsibilities Preferred Qualifications

Education and Experience
Master’s or PhD and 5 or more years of related experience, preferred
Bachelor's and 8 or more years of related experience

Functional Skills
Proven experience in managing and manipulating large, complex datasets and ability to analyze and interpret moderate to complex concepts
Ability to provide written and oral interpretation of highly specialized terms and data, and ability to present this data to others with different levels of expertise
Experience working with Agile team and demonstrated analytic agility with ability to quickly learn and switch topics
Ability to use and learn a wide variety of tools and languages to achieve results
Proven ability to code and develop prototypes in languages such as Python, Spark
Ability to lead a project team of various skills levels
Ability to manage a wide range of loosely defined moderate to complex situations, which require application of creativity and originality, where guidance and counsel may be unavailable
Ability to train, develop, and teach more junior modelers
Experience in using statistical modeling and/or machine learning techniques to build models that have driven company decision making
Knowledge of advanced machine learning techniques and libraries
The compensation range for this position is $123,000 to $154,000 per year based on experience and qualifications.

The candidate(s) offered this position will be required to submit to a background investigation, which includes a drug screen.

Good Work. Good Life. Good Hands®.

As a Fortune 100 company and industry leader, we provide a competitive salary – but that’s just the beginning. Our Total Rewards package also offers benefits like tuition assistance, medical and dental insurance, as well as a robust pension and 401(k). Plus, you’ll have access to a wide variety of programs to help you balance your work and personal life -- including a generous paid time off policy. For a full description of Allstate’s benefits, visit allstate.jobs/benefits/

Learn more about life at Allstate. Connect with us on Twitter , Facebook , Instagram and LinkedIn or watch a video .

Allstate generally does not sponsor individuals for employment-based visas for this position.

Effective July 1, 2014, under Indiana House Enrolled Act (HEA) 1242, it is against public policy of the State of Indiana and a discriminatory practice for an employer to discriminate against a prospective employee on the basis of status as a veteran by refusing to employ an applicant on the basis that they are a veteran of the armed forces of the United States, a member of the Indiana National Guard or a member of a reserve component.

For jobs in San Francisco, please click “ here ” for information regarding the San Francisco Fair Chance Ordinance.
For jobs in Los Angeles, please click “ here ” for information regarding the Los Angeles Fair Chance Initiative for Hiring Ordinance.

To view the “EEO is the Law” poster click “ here ”. This poster provides information concerning the laws and procedures for filing complaints of violations of the laws with the Office of Federal Contract Compliance Programs

To view the FMLA poster, click “ here ”. This poster summarizing the major provisions of the Family and Medical Leave Act (FMLA) and telling employees how to file a complaint.

It is the Company’s policy to employ the best qualified individuals available for all jobs. Therefore, any discriminatory action taken on account of an employee’s ancestry, age, color, disability, genetic information, gender, gender identity, gender expression, sexual and reproductive health decision, marital status, medical condition, military or veteran status, national origin, race (include traits historically associated with race, including, but not limited to, hair texture and protective hairstyles), religion (including religious dress), sex, or sexual orientation that adversely affects an employee's terms or conditions of employment is prohibited. This policy applies to all aspects of the employment relationship, including, but not limited to, hiring, training, salary administration, promotion, job assignment, benefits, discipline, and separation of employment."
Indeed,Staff Applied Scientist,Remote,"Your Job
The SMB Monetization Group focuses on growth and monetization for Indeed's flagship employer product. Every day, we help employers around the world post jobs and find the best candidates. Our team works on many of the highest impact strategic initiatives at the company's marketplace.

You will be responsible for the team that defines the value proposition for small to medium businesses. The Monetization team builds experiences that help employers select the right products to help them make a hire.
One of our core principles is a dedication to data-driven decision-making. To do that well, we need product scientists with a strong product sensibility to work alongside our product managers and technical leads.
Our Product Science team is a part of the Indeed Data Science group. While machine learning is one tool in our toolbox, Product Scientists use a variety of skills with the goal of driving business impact using whatever tools necessary."
The Home Depot,"Data Scientist, Online Marketing (Remote)","Atlanta, GA","The Home Depot is able to offer virtual employment of this position in the following states: AL, AK, AZ, AR, DE, DC, FL, GA, HI, ID, IL, IN, IA, KS, KY, LA, ME, MD, MA, MI, MN, MS, MO, MT, NE, NH, NJ, NM, NY, NC, ND, OH, OK, OR, PA, RI, SC, SD, TN, TX, UT, VT, VA, WA, WV, WI, WY

POSITION PURPOSE
The Data Scientist is responsible for supporting data science initiatives that drive business profitability, increased efficiencies and improved customer experience. This role applies industry-leading analytical methodologies for working with large datasets to extract meaningful business insight and creatively solve business problems. Data Scientists are also responsible for ensuring that developed codes are documented into a library of reusable algorithms. Based on the specific data science team, this role would need to be knowledgeable in one or more data science specializations, such as optimization, computer vision, recommendation, search or NLP.
As a Data Scientist, you will apply advanced analytics methods and algorithms for identifying trends and providing business solutions. This role is expected to present insights and recommendations to non-technical audiences and explain the benefits and impacts of the recommended solutions. In addition, Data Scientists collaborate with business partners and cross-functional teams, requiring effective communication skills, building relationships, and focus on understanding the overall business area being supported.




This position typically reports to Manager or above
This position has 0 Direct Reports and leads/manages projects



Located in a comfortable indoor area. Any unpleasant conditions would be infrequent and not objectionable.

Typically requires overnight travel less than 10% of the time.





















-"
Apple,"AI/ML - Annotation Analyst, Hebrew Language","San Diego, CA","Summary
Posted: Jan 26, 2022
Weekly Hours: 40
Role Number:200337403
Imagine what you could do here. At Apple, new ideas have a way of becoming extraordinary products, services, and customer experiences very quickly. The people here at Apple don’t just craft products - they build the kind of wonder thatʼs revolutionized entire industries. It’s the diversity of those people and their ideas that inspires the innovation that runs through everything we do, from amazing technology to industry-leading environmental efforts. Join Apple, and help us leave the world better than we found it. Are you interested in being part of a team that continues to innovate the way people and machines interact? The launch of Siri was a defining moment in the history of Artificial Intelligence. Siri offers a faster, easier way to get things done on your Apple devices, even before you ask. Millions of people now use Siri to send messages, play their favorite song or even take a selfie. The AI/ML team is passionate about technology with a focus on enriching the customer experience. We are looking for a motivated Annotation Analyst that demonstrates active listening, integrity, acute attention to detail, and is passionate about impacting our customer's experience. Bring passion and dedication to your job and there's no telling what you could accomplish. This position is located at the Apple corporate campus in San Diego, CA."
