Company Name,Job Title,Job Location,Job Description
"CGI Group, Inc.","Junior Data Scientist, Analytics","Arlington, VA","Junior Data Scientist, Analytics

Position Description
This is an exciting full-time opportunity to work in a fast-paced environment with a team of passionate technologists. We take an innovative approach to supporting our client, working side-by-side in an agile environment using emerging technologies. As a solution builder, you will be working to support the client's mission and goals of building an enterprise analytics platform.

Your future duties and responsibilities
Demonstrate in-depth technical capabilities with the ability to support multiple work streams and drive assimilation of new techniques and solutions.
Apply data and technical expertise in analysis, data mining and visualization of data using Business Intelligence tools and data development platforms.

Required qualifications to be successful in this role
An interim Secret clearance is required to begin working onsite with our client, and a Secret clearance must be maintained throughout the project duration. Due to the nature of the government contract requirements and/or clearance requirements, US citizenship is required.

Basic Qualifications:

#LI-HS2
#CGIFederalJob
#Dice
#ClearanceJobs



It is an extraordinary time to be in business. As digital transformation continues to accelerate, CGI is at the center of this change-supporting our clients' digital journeys and offering our professionals exciting career opportunities.

At CGI, our success comes from the talent and commitment of our professionals. As one team, we share the challenges and rewards that come from growing our company, which reinforces our culture of ownership. All of our professionals benefit from the value we collectively create.

Be part of building one of the largest independent technology and business services firms in the world.

Learn more about CGI at www.cgi.com .

No unsolicited agency referrals please.

CGI is an equal opportunity employer.

Qualified applicants will receive consideration for employment without regard to their race, ethnicity, ancestry, color, sex, religion, creed, age, national origin, citizenship status, disability, pregnancy, medical condition, military and veteran status, marital status, sexual orientation or perceived sexual orientation, gender, gender identity, and gender expression, familial status, political affiliation, genetic information, or any other legally protected status or characteristics.

CGI provides reasonable accommodations to qualified individuals with disabilities. If you need an accommodation to apply for a job in the U.S., please email the CGI U.S. Employment Compliance mailbox at US_Employment_Compliance@cgi.com . You will need to reference the requisition number of the position in which you are interested. Your message will be routed to the appropriate recruiter who will assist you. .

We make it easy to translate military experience and skills! Click here to be directed to our site that is dedicated to veterans and transitioning service members.

All CGI offers of employment in the U.S. are contingent upon the ability to successfully complete a background investigation. Background investigation components can vary dependent upon specific assignment and/or level of US government security clearance held. CGI will consider for employment qualified applicants with arrests and conviction records in accordance with all local regulations and ordinances.

CGI will not discharge or in any other manner discriminate against employees or applicants because they have inquired about, discussed, or disclosed their own pay or the pay of another employee or applicant. However, employees who have access to the compensation information of other employees or applicants as a part of their essential job functions cannot disclose the pay of other employees or applicants to individuals who do not otherwise have access to compensation information, unless the disclosure is (a) in response to a formal complaint or charge, (b) in furtherance of an investigation, proceeding, hearing, or action, including an investigation conducted by the employer, or (c) consistent with CGI's legal duty to furnish information."
National Security Agency,Mathematician,"Fort Meade, MD","NSA Overview The professionals at the National Security Agency (NSA) have one common goal: to protect our nation. The mission requires a strong offense and a steadfast defense. The offense collects, processes, and disseminates intelligence information derived from foreign signals for intelligence and counterintelligence purposes. The defense prevents adversaries from gaining access to sensitive classified national security information. At NSA, mathematics is a core discipline and is present in every aspect of the mission. Mathematicians bring a wealth of expertise including, but not limited to, number theory, finite field theory, coding theory, Fourier analysis, graph theory, probability, and statistics. They work on some of the hardest problems associated with signals intelligence (the interception, collection, and analysis of foreign signals) and information security (assuring confidentiality, integrity, and availability of information). Mathematicians have the opportunity to learn and experiment in areas far from their academic training. These opportunities and core mission needs help make NSA the largest employer of mathematicians in the country. Description of Position NSA is actively seeking mathematicians to join a vibrant community of mathematicians, statisticians, physicists, computer scientists, and other intelligence professionals. Newly-hired mathematicians begin their careers in the Mathematics Development Program (MDP). The goal of the three-year MDP is to train mathematicians to be broadly knowledgeable in the spectrum of mathematical sciences used at NSA. To accomplish this goal, MDP members study cryptologic mathematics and related subjects in Agency taught classes and complete 6-month tours in diverse NSA offices. Graduates of the MDP may choose their first permanent assignments from any of the NSA Directorates, depending on availability. The Agency is unique in its ability to offer the opportunity to work in diverse areas of Applied Mathematics. In addition to cryptologic mathematics, mathematicians work in: - Signals analysis - Data compression - Machine learning - Data science - Human language technology - Speech/image/video processing - Analysis of communication networks - Network vulnerability analysis - Cybersecurity Additionally, computing is an essential component of mathematics at NSA and mathematicians must use a variety of computing platforms to test ideas and implement solutions. While there is no specific requirement for any previous programming or computing experience, a mathematician must be willing to learn to use computers effectively."
The Home Depot,"Data Scientist, Online Marketing (Remote)","Atlanta, GA","The Home Depot is able to offer virtual employment of this position in the following states: AL, AK, AZ, AR, DE, DC, FL, GA, HI, ID, IL, IN, IA, KS, KY, LA, ME, MD, MA, MI, MN, MS, MO, MT, NE, NH, NJ, NM, NY, NC, ND, OH, OK, OR, PA, RI, SC, SD, TN, TX, UT, VT, VA, WA, WV, WI, WY

POSITION PURPOSE
The Data Scientist is responsible for supporting data science initiatives that drive business profitability, increased efficiencies and improved customer experience. This role applies industry-leading analytical methodologies for working with large datasets to extract meaningful business insight and creatively solve business problems. Data Scientists are also responsible for ensuring that developed codes are documented into a library of reusable algorithms. Based on the specific data science team, this role would need to be knowledgeable in one or more data science specializations, such as optimization, computer vision, recommendation, search or NLP.
As a Data Scientist, you will apply advanced analytics methods and algorithms for identifying trends and providing business solutions. This role is expected to present insights and recommendations to non-technical audiences and explain the benefits and impacts of the recommended solutions. In addition, Data Scientists collaborate with business partners and cross-functional teams, requiring effective communication skills, building relationships, and focus on understanding the overall business area being supported.




This position typically reports to Manager or above
This position has 0 Direct Reports and leads/manages projects



Located in a comfortable indoor area. Any unpleasant conditions would be infrequent and not objectionable.

Typically requires overnight travel less than 10% of the time.





















-"
Sapphiros.AI,Machine Learning Scientist,"Boston, MA","ABOUT
SAPPHIROS AI Bio is leading a transformation in the understanding of the correlation of genetics and cellular processes. With access to one of the worlds largest bio banks this individual will be at the heart of the most innovative project in bioscience. This position requires broad technical experience in designing, developing and implementing AI solutions.
Experience with complex data models and organizing structured and unstructured data is a requirement. The candidate should be independent and accustomed to taking initiative. The candidate must be scientifically independent, confident, and accustomed to taking initiative while problem solving. The position requires strong communication and organization skills.
ROLE"
Apple,"AI/ML - Annotation Analyst, Canadian French Language","Austin, TX","Summary
Posted: Jun 28, 2021
Weekly Hours: 40
Role Number:200244250
Imagine what you could do here. At Apple, new ideas have a way of becoming extraordinary products, services, and customer experiences very quickly. The people here at Apple don’t just craft products - they build the kind of wonder thatʼs revolutionized entire industries. It’s the diversity of those people and their ideas that inspires the innovation that runs through everything we do, from amazing technology to industry-leading environmental efforts. Join Apple, and help us leave the world better than we found it. Are you interested in being part of a team that continues to innovate the way people and machines interact? The launch of Siri was a defining moment in the history of Artificial Intelligence. Siri offers a faster, easier way to get things done on your Apple devices, even before you ask. Millions of people now use Siri to send messages, play their favorite song or even take a selfie. The AI/ML team is passionate about technology with a focus on enriching the customer experience. We are looking for a motivated Annotation Analyst that demonstrates active listening, integrity, acute attention to detail, and is passionate about impacting our customer's experience. Bring passion and dedication to your job and there's no telling what you could accomplish. This position will be based out of the Northeast campus in Austin, TX."
Huntsman,Data Scientist,"Houston, TX","Job Description :
Huntsman’s Global Reporting & Analytics team is now searching for a new Data Scientist who will be responsible for the creation of business and functional dashboards and visualizations of financial and functional performance metrics in support of business decisions. You will also work in close collaboration with the global Finance, Supply Chain, Marketing, Commercial and global S&OP teams within the Performance Products division with the potential to expand exposure across the company. This role is an active, full member in our Global Reporting & Analytics team at our corporate office in The Woodlands, Texas.
As the Data Scientist, you will:
Work closely with various teams by providing data visualization around business and functional performance."
Northrop Grumman,GBSD Data Scientist,"Roy, UT","Requisition ID: R10030726
Category: Research and Sciences
Location: Roy - UT, United States of America
Citizenship Required: United States Citizenship
Clearance Type: Secret
Telecommute: No- Teleworking not available for this position
Shift: 1st Shift (United States of America)
Travel Required: Yes, 10% of the Time
Positions Available: 1

At Northrop Grumman, our employees have incredible opportunities to work on revolutionary systems that impact people's lives around the world today, and for generations to come. Our pioneering and inventive spirit has enabled us to be at the forefront of many technological advancements in our nation's history - from the first flight across the Atlantic Ocean, to stealth bombers, to landing on the moon. We look for people who have bold new ideas, courage and a pioneering spirit to join forces to invent the future, and have fun along the way. Our culture thrives on intellectual curiosity, cognitive diversity and bringing your whole self to work — and we have an insatiable drive to do what others think is impossible. Our employees are not only part of history, they're making history.

Embark on a career putting innovative, reliable, and agile products and ideas into orbit, and beyond. Northrop Grumman has opportunities waiting for you that play a vital role in human space exploration, national defense, and scientific discovery, supporting multiple programs across the universe. With us, you’ll discover a culture of curiosity and collaboration that will have you Defining Possible from the day you start. Our space systems connect and protect millions of people on earth every day, now and for the future. Explore your future and launch your career today.Northrop Grumman Space Systems is seeking a Data Scientist. This position will be located in Roy, Utah and will support the Ground Based Strategic Deterrent (GBSD) program. This role may offer a competitive relocation assistance package.As a full-time employee of Northrop Grumman Space Systems, you are eligible for our robust benefits package including:
Preferred Qualifications:"
Northrop Grumman,Principal Data Scientist- Tableau,"Chandler, AZ","Requisition ID: R10026850
Category: Research and Sciences
Location: Chandler - AZ, United States of America
Citizenship Required: United States Citizenship
Clearance Type: Secret
Telecommute: Yes- May Consider Occasional/Part-Time Teleworking for this position
Shift: Days (United States of America)
Travel Required: No
Positions Available: 1

At Northrop Grumman, our employees have incredible opportunities to work on revolutionary systems that impact people's lives around the world today, and for generations to come. Our pioneering and inventive spirit has enabled us to be at the forefront of many technological advancements in our nation's history - from the first flight across the Atlantic Ocean, to stealth bombers, to landing on the moon. We look for people who have bold new ideas, courage and a pioneering spirit to join forces to invent the future, and have fun along the way. Our culture thrives on intellectual curiosity, cognitive diversity and bringing your whole self to work — and we have an insatiable drive to do what others think is impossible. Our employees are not only part of history, they're making history."
Meta,"San Francisco, CA",$102K - $197K (Glassdoor est.),"As a Machine Learning Data Scientist at Meta, you will have the opportunity to do groundbreaking applied machine learning work that will shape the industry and the future of people-facing and business-facing advanced AI solutions we build to solve problems and make user experience better across Meta. Our work spans the spectrum from near-term (working closely with product teams to improve people’s experience within a given half) to medium-term (inventing AI solutions that we then inspire product teams to adopt), to long-term (blue-sky AI research without any specific applications in mind).By applying your Machine Learning/AI knowledge and technical skills, analytical mindset, and product intuition to one of the richest data sets in the world, you will help define the experiences we build for billions of people and hundreds of millions of businesses around the world. You will collaborate on a wide array of product and business problems with a diverse set of cross-functional partners across Product, Engineering, Research, Data Engineering, Marketing, Sales, Finance and others. You will use Machine Learning/AI knowledge, data and analysis to identify and solve advanced AI research and product development’s biggest challenges. You will influence AI research and product strategy and investment decisions with data, be focused on impact, and collaborate with other teams. By joining Meta, you will become part of a world-class analytics community dedicated to skill development and career growth in analytics, data science, machine learning, AI and beyond.About the role:Product leadership: You will use data to understand the product and business ecosystem, quantify new opportunities, identify upcoming challenges, and shape product development to bring value to people, businesses, and Meta. You will help develop strategy and support leadership in prioritizing what to build and setting goals for execution. You will evaluate tradeoffs of shipped features/ML systems, and drive large efforts across multiple teams to reduce technical debt.Analytics: You will guide product teams using data and insights. You will focus on developing hypotheses and employ a diverse toolkit of rigorous analytical approaches, different methodologies, frameworks, and technical approaches including ML to test them. You will research challenging ML questions to inform experimentation and ML development, build and code measurement frameworks, tools, and instrumentation to measure and analyze data used within the ML lifecycle.Communication and influence: You won’t simply present data, but tell data-driven stories. You will convince and influence leaders using clear insights and recommendations. You will build credibility through structure and clarity, and be a trusted strategic partner.














Facebook's mission is to give people the power to build community and bring the world closer together. Through our family of apps and services, we're building a different kind of company that connects billions of people around the world, gives them ways to share what matters most to them, and helps bring people closer together. Whether we're creating new products or helping a small business expand its reach, people at Facebook are builders at heart. Our global teams are constantly iterating, solving problems, and working together to empower people around the world to build community and connect in meaningful ways. Together, we can help people build stronger communities - we're just getting started.

Facebook is proud to be an Equal Opportunity and Affirmative Action employer. We do not discriminate based upon race, religion, color, national origin, sex (including pregnancy, childbirth, or related medical conditions), sexual orientation, gender, gender identity, gender expression, transgender status, sexual stereotypes, age, status as a protected veteran, status as an individual with a disability, or other applicable legally protected characteristics. We also consider qualified applicants with criminal histories, consistent with applicable federal, state and local law.Facebook is committed to providing reasonable accommodations for candidates with disabilities in our recruiting process. If you need any assistance or accommodations due to a disability, please let us know at accommodations-ext@fb.com."
Apple,"AI/ML - Annotation Analyst, Chilean Spanish Language","San Diego, CA","Summary
Posted: Jan 26, 2022
Weekly Hours: 40
Role Number:200337405
Imagine what you could do here. At Apple, new ideas have a way of becoming extraordinary products, services, and customer experiences very quickly. The people here at Apple don’t just craft products - they build the kind of wonder thatʼs revolutionized entire industries. It’s the diversity of those people and their ideas that inspires the innovation that runs through everything we do, from amazing technology to industry-leading environmental efforts. Join Apple, and help us leave the world better than we found it. Are you interested in being part of a team that continues to innovate the way people and machines interact? The launch of Siri was a defining moment in the history of Artificial Intelligence. Siri offers a faster, easier way to get things done on your Apple devices, even before you ask. Millions of people now use Siri to send messages, play their favorite song or even take a selfie. The AI/ML team is passionate about technology with a focus on enriching the customer experience. We are looking for a motivated Annotation Analyst that demonstrates active listening, integrity, acute attention to detail, and is passionate about impacting our customer's experience. Bring passion and dedication to your job and there's no telling what you could accomplish. This position will be based out of the corporate campus in San Diego, CA."
NIKE INC,"Sport Performance Principal Data Scientist - Open to remote work, except the following locations: SD, VT, and WV","Mulino, OR","Become a Part of the NIKE, Inc. Team


NIKE, Inc. does more than outfit the world’s best athletes. It is a place to explore potential, obliterate boundaries and push out the edges of what can be. The company looks for people who can grow, think, dream and create. Its culture thrives by embracing diversity and rewarding imagination. The brand seeks achievers, leaders and visionaries. At NIKE, Inc. it’s about each person bringing skills and passion to a challenging and constantly evolving game.

Who we are looking for"
EDWARD JONES,Data Scientist I,"Saint Louis, MO","At Edward Jones, we help clients achieve their serious, long-term financial goals by understanding their needs and implementing tailored solutions. To ensure a personal client experience, we have located our 15,000+ branch offices where our more than 7 million clients live and work.

In a typical branch office, a financial advisor meets with clients and receives branch office support, so they can focus on building deep relationships with clients. Headquarters associates in St. Louis, Tempe and Mississauga provide support and expertise to help U.S. and Canada branch teams deliver an ideal client experience. We continue to grow to meet the needs of long-term individual investors.
Data Scientist
Firm Analytics

Come join us in Firm Analytics, where we strive to unleash the full potential of data and AI to address business challenges. As a Data Scientist on our team, you will design, develop and deliver data science solutions requiring advanced mathematical methods, statistical and machine learning models in support of data-driven strategies. You will combine data from multiple sources to develop innovative solutions to business problems and collaborate with business partners and other data scientists to develop tailored analytic solutions that inform and influence business decisions across the firm.






Salary: $75962 - $129341
Category: Headquarters"
Amex,Data Scientist - Global Decision Science,"New York, NY","You Lead the Way. We've Got Your Back.

At American Express, we know that with the right backing, people and businesses have the power to progress in incredible ways. Whether we’re supporting our customers’ financial confidence to move ahead, taking commerce to new heights, or encouraging people to explore the world, our colleagues are constantly redefining what’s possible - and we’re proud to back each other every step of the way. When you join #TeamAmex, you become part of a diverse community of over 60,000 colleagues, all with a common goal to deliver an exceptional customer experience every day.

Decision Science colleagues will serve as a key member of the Credit and Fraud Risk organization. We seek a thought-leader and a problem-solver who can blend business, technical, and industry best practices when it comes to developing the analyses, models, and algorithms that power our customers’ digital experiences."
