Company Name,Job Title,Job Location,Job Description
Allstate,Lead Data Scientist Consultant (Remote - Homebased Worker),"Northbrook, IL","The world isn’t standing still, and neither is Allstate. We’re moving quickly, looking across our businesses and brands and taking bold steps to better serve customers’ evolving needs. That’s why now is an exciting time to join our team. You’ll have opportunities to take risks, challenge the status quo and shape the future for the greater good.
You’ll do all this in an environment of excellence and the highest ethical standards – a place where values such as integrity, inclusive diversity and accountability are paramount. We empower every employee to lead, drive change and give back where they work and live. Our people are our greatest strength, and we work as one team in service of our customers and communities.
Everything we do at Allstate is driven by a shared purpose: to protect people from life’s uncertainties so they can realize their hopes and dreams. For more than 89 years we’ve thrived by staying a step ahead of whatever’s coming next – to give customers peace of mind no matter what changes they face. We acted with conviction to advocate for seat belts, air bags and graduated driving laws. We help give survivors of domestic violence a voice through financial empowerment. We’ve been an industry leader in pricing sophistication, telematics, digital photo claims and, more recently, device and identity protection. We are the Good Hands. We don’t follow the trends. We set them. Job Summary

This role is responsible for leading the use of data to make decisions. This includes: the development and recommendation of new machine learning predictive modeling algorithms, the coding/development of tools that use machine learning/predictive modeling to make business decisions, searching for and integrating new data (both internal and external) that improves our modeling and machine learning results (and ultimately our decisions), and discovery of new business problems that can be solved through the use of machine learning/predictive modeling. The role is responsible for assisting in the recruitment, selection, mentorship and development of junior data scientists. This role will also begin to manage projects of medium to high complexity.
Key Responsibilities

Uses best practices to develop complex statistical, machine learning techniques to build models that address business needs and to improve the accuracy of our data and data-driven decisions
Reviews, evaluates, communicates and makes recommendation on appropriateness of modeling techniques and results to team, leadership and stakeholders to ensure these are well understood and incorporated into business processes. Develops and executes communication strategy, keeping stakeholders informed and influencing business partners and senior leaders on the effectiveness of machine learning/predictive modeling to solve business problems.
Collaborates with outside business units and works on data and complex business problems in order to improve the effectiveness of business decisions and business results through designing, building, and partnering to implement machine learning/predictive models. Effectively understand the business' problems and requirements to identify the optimal modeling approach. Develops frameworks/prototypes that integrate data and machine learning/predictive modeling to make business decisions.
Identifies languages and tools that can bring efficiencies or needed techniques to the team. Identifies new areas of data, research and models and develops data sources that can solve business problems.
Utilizes effective project planning techniques to break down complex machine learning/predictive modeling and/or development projects into tasks, manage scope of projects, and ensure deadlines are kept. Manages various analytical and modeling projects with small number of team members.
Mentors and develops others
This job does not have supervisory responsibilities Preferred Qualifications

Education and Experience
Master’s or PhD and 5 or more years of related experience, preferred
Bachelor's and 8 or more years of related experience

Functional Skills
Proven experience in managing and manipulating large, complex datasets and ability to analyze and interpret moderate to complex concepts
Ability to provide written and oral interpretation of highly specialized terms and data, and ability to present this data to others with different levels of expertise
Experience working with Agile team and demonstrated analytic agility with ability to quickly learn and switch topics
Ability to use and learn a wide variety of tools and languages to achieve results
Proven ability to code and develop prototypes in languages such as Python, Spark
Ability to lead a project team of various skills levels
Ability to manage a wide range of loosely defined moderate to complex situations, which require application of creativity and originality, where guidance and counsel may be unavailable
Ability to train, develop, and teach more junior modelers
Experience in using statistical modeling and/or machine learning techniques to build models that have driven company decision making
Knowledge of advanced machine learning techniques and libraries
The compensation range for this position is $123,000 to $154,000 per year based on experience and qualifications.

The candidate(s) offered this position will be required to submit to a background investigation, which includes a drug screen.

Good Work. Good Life. Good Hands®.

As a Fortune 100 company and industry leader, we provide a competitive salary – but that’s just the beginning. Our Total Rewards package also offers benefits like tuition assistance, medical and dental insurance, as well as a robust pension and 401(k). Plus, you’ll have access to a wide variety of programs to help you balance your work and personal life -- including a generous paid time off policy. For a full description of Allstate’s benefits, visit allstate.jobs/benefits/

Learn more about life at Allstate. Connect with us on Twitter , Facebook , Instagram and LinkedIn or watch a video .

Allstate generally does not sponsor individuals for employment-based visas for this position.

Effective July 1, 2014, under Indiana House Enrolled Act (HEA) 1242, it is against public policy of the State of Indiana and a discriminatory practice for an employer to discriminate against a prospective employee on the basis of status as a veteran by refusing to employ an applicant on the basis that they are a veteran of the armed forces of the United States, a member of the Indiana National Guard or a member of a reserve component.

For jobs in San Francisco, please click “ here ” for information regarding the San Francisco Fair Chance Ordinance.
For jobs in Los Angeles, please click “ here ” for information regarding the Los Angeles Fair Chance Initiative for Hiring Ordinance.

To view the “EEO is the Law” poster click “ here ”. This poster provides information concerning the laws and procedures for filing complaints of violations of the laws with the Office of Federal Contract Compliance Programs

To view the FMLA poster, click “ here ”. This poster summarizing the major provisions of the Family and Medical Leave Act (FMLA) and telling employees how to file a complaint.

It is the Company’s policy to employ the best qualified individuals available for all jobs. Therefore, any discriminatory action taken on account of an employee’s ancestry, age, color, disability, genetic information, gender, gender identity, gender expression, sexual and reproductive health decision, marital status, medical condition, military or veteran status, national origin, race (include traits historically associated with race, including, but not limited to, hair texture and protective hairstyles), religion (including religious dress), sex, or sexual orientation that adversely affects an employee's terms or conditions of employment is prohibited. This policy applies to all aspects of the employment relationship, including, but not limited to, hiring, training, salary administration, promotion, job assignment, benefits, discipline, and separation of employment."
Brooksource,Data Scientist,Remote,"Finance Technology Data Scientist
Fully Remote
12 Month Contract-to-Hire
Overview:
Our client (Fortune 10) is developing centralized systems, data and tools that provide a streamlined way to manage their business and solve business problems effectively. We are searching for an industry minded Data Scientist who can help shape and mold the data for our company to build data sets/models and systems to drive prescriptive meaning of the data, forecasting capability and even apply machine learning capabilities within our data governance capabilities."
Selby Jennings,Data Scientist,Remote,"Company Summary: A leading Medical Malpractice Insurance Firm in the US with over a billion dollars in written premium is looking to hire a Data Scientist. The firm is looking to add someone who is passionate about data and applying the latest machine learning technology to solve business problems. This role is fully remote and is an urgent hire!
The Data Scientist will be responsible for:
Developing and implementing machine learning technologies
Identify and propose new technologies and tools that could be of benefit
Leading proactive communication to all departments
Mentor junior level data scientists
The Data Scientist must have the following qualifications:"
"The Travelers Companies, Inc.",Data Scientist,"Hartford, CT","Company Summary
Taking care of our customers, our communities and each other. That’s the Travelers Promise. By honoring this commitment, we have maintained our reputation as one of the best property casualty insurers in the industry for over 160 years. Join us to discover a culture that is rooted in innovation and thrives on collaboration. Imagine loving what you do and where you do it.
Job Category
Analytics & Research
Target Openings
1
Travelers Data Scientists are taking the organization to the next level of intelligence by using advanced statistical techniques and machine learning algorithms. As a Data Scientist, you will work with business partners to tell the story using data by identifying challenges and opportunities for data analysis and experiments. You will build models that solve key business challenges and enhance our customer experience."
Sapphiros.AI,Machine Learning Scientist,"Boston, MA","ABOUT
SAPPHIROS AI Bio is leading a transformation in the understanding of the correlation of genetics and cellular processes. With access to one of the worlds largest bio banks this individual will be at the heart of the most innovative project in bioscience. This position requires broad technical experience in designing, developing and implementing AI solutions.
Experience with complex data models and organizing structured and unstructured data is a requirement. The candidate should be independent and accustomed to taking initiative. The candidate must be scientifically independent, confident, and accustomed to taking initiative while problem solving. The position requires strong communication and organization skills.
ROLE"
Clock Foundation,Data Scientist,"Torrance, CA","Data Scientist
The Clock Foundation seeks a highly motivated individual to join our dynamic team developing epigenetic aging clocks applying them to our mission of speeding the availability of treatments that prolong health and life expectancy.
Essential
A PhD (or equivalent experience) in a relevant scientific subject including but not limited to bioinformatics, biostatistics, or computational biology, with research experience in academia or industry
Proficiency with R for statistical programming
Proven ability to deliver high quality novel research in bioinformatics, biostatistics, or computational biology, for example through journal publications"
Northrop Grumman,GBSD Data Scientist,"Roy, UT","Requisition ID: R10030726
Category: Research and Sciences
Location: Roy - UT, United States of America
Citizenship Required: United States Citizenship
Clearance Type: Secret
Telecommute: No- Teleworking not available for this position
Shift: 1st Shift (United States of America)
Travel Required: Yes, 10% of the Time
Positions Available: 1

At Northrop Grumman, our employees have incredible opportunities to work on revolutionary systems that impact people's lives around the world today, and for generations to come. Our pioneering and inventive spirit has enabled us to be at the forefront of many technological advancements in our nation's history - from the first flight across the Atlantic Ocean, to stealth bombers, to landing on the moon. We look for people who have bold new ideas, courage and a pioneering spirit to join forces to invent the future, and have fun along the way. Our culture thrives on intellectual curiosity, cognitive diversity and bringing your whole self to work — and we have an insatiable drive to do what others think is impossible. Our employees are not only part of history, they're making history.

Embark on a career putting innovative, reliable, and agile products and ideas into orbit, and beyond. Northrop Grumman has opportunities waiting for you that play a vital role in human space exploration, national defense, and scientific discovery, supporting multiple programs across the universe. With us, you’ll discover a culture of curiosity and collaboration that will have you Defining Possible from the day you start. Our space systems connect and protect millions of people on earth every day, now and for the future. Explore your future and launch your career today.Northrop Grumman Space Systems is seeking a Data Scientist. This position will be located in Roy, Utah and will support the Ground Based Strategic Deterrent (GBSD) program. This role may offer a competitive relocation assistance package.As a full-time employee of Northrop Grumman Space Systems, you are eligible for our robust benefits package including:
Preferred Qualifications:"
Huntsman,Data Scientist,"Houston, TX","Job Description :
Huntsman’s Global Reporting & Analytics team is now searching for a new Data Scientist who will be responsible for the creation of business and functional dashboards and visualizations of financial and functional performance metrics in support of business decisions. You will also work in close collaboration with the global Finance, Supply Chain, Marketing, Commercial and global S&OP teams within the Performance Products division with the potential to expand exposure across the company. This role is an active, full member in our Global Reporting & Analytics team at our corporate office in The Woodlands, Texas.
As the Data Scientist, you will:
Work closely with various teams by providing data visualization around business and functional performance."
Attunely,Principal Data Scientist,Remote,"Attunely is looking for a Principal Data Scientist to join our highly experienced team! This role will work with our Data Science group to develop and implement individualized ML models for our customers in the financial sector. The ideal candidate is adept at developing and improving predictive models, as well as rigorously evaluating their effectiveness. They must have significant experience of working with large amounts of data from multiple sources and at translating their insights into production-level code. They must be comfortable working across teams and with a range of stakeholders. The right candidate will have a passion for economic modeling and for working with stakeholders to improve business outcomes, as well as drive for personal growth within the data science field.
Responsibilities:
Work with the Data Science team to develop machine learning models for customers.
Use analytical methods to assess and improve models."
Attunely,Staff Data Scientist,Remote,"Attunely is looking for a Senior Data Scientist to join our highly experienced team! This role will work with our Data Science group to develop and implement individualized ML models for our customers in the financial sector. The ideal candidate is adept at developing and improving predictive models, as well as rigorously evaluating their effectiveness. They must have significant experience of working with large amounts of data from multiple sources and at translating their insights into code. They must be comfortable working across teams and with a range of stakeholders. The right candidate will have a passion for economic modeling and for working with stakeholders to improve business outcomes, as well as drive for personal growth within the data science field.
Responsibilities:
Work with the Data Science team to develop machine learning models for customers.
Use analytical methods and research skills to assess and improve models and modeling techniques and prove their effectiveness."
Tiro L.L.C.,Machine Learning Engineer / Data Scientist,Remote,"Data Scientist / ML Ops Engineer
The position
We are looking for a talented Data Scientist / ML Ops Engineer to join our client’s fast growing team in either in office or Remote. We are looking for a high caliber individual with a passion for building scalable machine learning (ML) platforms for deployment of automated ML based software solutions. In this position, you will be working with a very highly energetic team of engineers, data scientists, and developers, to develop and deploy ML solutions to solve engineering problems. The solutions will focus on improving operational efficiency and predictive maintenance using engineering and data science approaches.
Responsibilities
You will be responsible for:"
EDWARD JONES,Data Scientist I,"Saint Louis, MO","At Edward Jones, we help clients achieve their serious, long-term financial goals by understanding their needs and implementing tailored solutions. To ensure a personal client experience, we have located our 15,000+ branch offices where our more than 7 million clients live and work.

In a typical branch office, a financial advisor meets with clients and receives branch office support, so they can focus on building deep relationships with clients. Headquarters associates in St. Louis, Tempe and Mississauga provide support and expertise to help U.S. and Canada branch teams deliver an ideal client experience. We continue to grow to meet the needs of long-term individual investors.
Data Scientist
Firm Analytics

Come join us in Firm Analytics, where we strive to unleash the full potential of data and AI to address business challenges. As a Data Scientist on our team, you will design, develop and deliver data science solutions requiring advanced mathematical methods, statistical and machine learning models in support of data-driven strategies. You will combine data from multiple sources to develop innovative solutions to business problems and collaborate with business partners and other data scientists to develop tailored analytic solutions that inform and influence business decisions across the firm.






Salary: $75962 - $129341
Category: Headquarters"
"Vanu, Inc.",Data Scientist,"Lexington, MA","A unique position has arisen for a skilled, enthusiastic, and results-oriented data scientist in the budding global mapping group of a growing telecommunications company located in Lexington, Massachusetts. Vanu Inc is a global leader in providing wireless coverage to the 1.2 billion people worldwide currently unable to connect, with a particular focus on markets in Africa and South East Asia.
As a cartographically oriented data scientist you will help us to develop the technology and insight we need to address growing international interest in and application of our unique industry disrupting network planning and mapping capabilities. You will be an integral member of our analytics department focused both on the formulation of novel applications and the streamlining of existing tech.
The necessary credentials:
-Master’s degree or better in engineering or science-related field"
PAIIR Solutions,Sr. Data Scientist,"Suffern, NY","SR. DATA SCIENTIST
Here's your rare opportunity to join our client's exciting, fast-growing, and dynamic team in Suffern, NY!
About you:
You have 3++ years of solid expertise in developing market forecasting, analysis and campaign reporting.
You have strong experience in R and Python
Java, Alteryx, VBA, SQL, ETL a plus.
You’re well-spoken, and can verbally communicate well with Fortune 500 clients.
Your Excel skills are wizard level."
ScienceIO,Lead Data Scientist,"New York, NY","Please apply here: https://app.dover.io/apply/scienceio/1abae491-43da-43f0-a86d-a98e93409912?rs=55634680
ScienceIO is on a mission to build a more transparent, connected, and equitable healthcare system.
As Lead Data Scientist, you’ll be a key member of our growing data science & machine learning team and work closely with the founders to build up data science culture and best practices across the organization. As data scientists ourselves, we care deeply about building infrastructure and aligning incentives to support great data science.
The role & opportunity
You will lead our initiative to build better, fairer, and more transparent machine learning models for healthcare by improving the way we understand and improve our data and models"
Emerald Resource Group,Data Scientist - Remote,Remote,"Position: Data Scientist - REMOTE
Machine Learning / R/ Python / Jupyter /SQL
Must have experience developing Data science solutions to production within Digital Services, Products, and solutions.
Remote role that is Direct Hire-Salaried
Prefer Eastern Standard Time Zone
(At this time, our client cannot accommodate H1B visas or OPT).
************************************************************************************"
Elysian Staffing,Data Scientist/Machine Learning Engineer,"Mountain View, CA","Our client, a global tech brand, is adding a Data Scientist Manager to staff who will be responsible for analyzing data for the optimization of content delivery to consumers. Experience in AI and/or Machine Learning is mandatory. This will be an on-site work schedule - only local candidates to Mountain View, CA and New York, NY will be considered.
RESPONSIBILITIES:
· Deliver and interpret data efficiently with high auto-recognition coverage at low cost
· Build and iterate the label system to be the handle of managing all digital assets and support all business need
· Unlock the value of company’s data to power the whole monetization business
· Work with demand side from collecting requirements through to delivery"
NIKE INC,"Sport Performance Principal Data Scientist - Open to remote work, except the following locations: SD, VT, and WV","Beaverton, OR","Become a Part of the NIKE, Inc. Team


NIKE, Inc. does more than outfit the world’s best athletes. It is a place to explore potential, obliterate boundaries and push out the edges of what can be. The company looks for people who can grow, think, dream and create. Its culture thrives by embracing diversity and rewarding imagination. The brand seeks achievers, leaders and visionaries. At NIKE, Inc. it’s about each person bringing skills and passion to a challenging and constantly evolving game.

Who we are looking for"
Insurity,Data Scientist,Remote,"Who We Are
Insurity is a leading property and casualty insurance software and data analytics provider, working with some of the world’s largest insurers, brokers, and MGAs, including 15 of the top 25 P&C carriers in the US. With 900+ team members globally, 10 office locations, and 300+ customers, we have a deep understanding of the insurance business, unparalleled technology expertise, and a singular focus of delivering a simplified insurance experience to our customers.
Insurity's next Data Scientist
Our Data Scientist will be an integral part of Insurity Analytics, working closely and collaboratively with insurance domain authorities, data analysts, engineers, and customers. They will develop highly robust predictive models that provide significant and measurable results for our customers. Additionally, they will partner with the sales and marketing teams to perform then deliver modeling proofs-of-concept & retro-tests, as well as help craft and deliver compelling product performance reads, product & concept education, and value proposition messaging."
