Company Name,Job Title,Job Location,Job Description
Attunely,Principal Data Scientist,Remote,"Attunely is looking for a Principal Data Scientist to join our highly experienced team! This role will work with our Data Science group to develop and implement individualized ML models for our customers in the financial sector. The ideal candidate is adept at developing and improving predictive models, as well as rigorously evaluating their effectiveness. They must have significant experience of working with large amounts of data from multiple sources and at translating their insights into production-level code. They must be comfortable working across teams and with a range of stakeholders. The right candidate will have a passion for economic modeling and for working with stakeholders to improve business outcomes, as well as drive for personal growth within the data science field.
Responsibilities:
Work with the Data Science team to develop machine learning models for customers.
Use analytical methods to assess and improve models."
"Davidson Technologies, Inc.",Data Scientist,"Huntsville, AL","Davidson is seeking a Data Scientist in Huntsville, AL.
This position is an integral part of a fast-paced, innovative research and development (R&D) program for the US Air Force’s (USAF) Advanced Battle Management System (ABMS) involving the creation of advanced M&S and AI for wired and wireless communications across all 5 warfare domains (land, sea, air, space, and cyberspace). The program works cross-functionally with innovative team members skilled in High-Performance Computing (HPC), Modeling & Simulations (M&S), Artificial Intelligence (AI)/Data Analytics, and Cybersecurity.
The qualified candidate should be able to:
Experiment with innovative theories, ideas, and concepts to expand the realm of the possible
Self-organize and participate in an agile development lifecycle
Ask questions and build consensus within a cross-functional team"
Attunely,Staff Data Scientist,Remote,"Attunely is looking for a Senior Data Scientist to join our highly experienced team! This role will work with our Data Science group to develop and implement individualized ML models for our customers in the financial sector. The ideal candidate is adept at developing and improving predictive models, as well as rigorously evaluating their effectiveness. They must have significant experience of working with large amounts of data from multiple sources and at translating their insights into code. They must be comfortable working across teams and with a range of stakeholders. The right candidate will have a passion for economic modeling and for working with stakeholders to improve business outcomes, as well as drive for personal growth within the data science field.
Responsibilities:
Work with the Data Science team to develop machine learning models for customers.
Use analytical methods and research skills to assess and improve models and modeling techniques and prove their effectiveness."
Conversion Logix,Data Scientist,"Seattle, WA","Conversion Logix®, LLC provides a comprehensive suite of marketing software and services that enable customers to capture, connect, and convert prospects throughout their journey. We advise, plan, and execute digital marketing strategies to help customers maximize their ROI. Our suite of software and services allow customers to easily integrate with common CRM applications and scale lead generation across their business. Conversion Logix has been ranked on the Inc. 5000 and Austin Business Journal's Fast 50 Growing Companies and is a Premier Google Partner and Facebook Business Partner.
*
About the role:
*
*
As the company Data Scientist, you will support our product, sales, leadership and marketing teams by discovering insights gained from analyzing company data.
*
*
What you’ll do:"
PAIIR Solutions,Sr. Data Scientist,"Suffern, NY","SR. DATA SCIENTIST
Here's your rare opportunity to join our client's exciting, fast-growing, and dynamic team in Suffern, NY!
About you:
You have 3++ years of solid expertise in developing market forecasting, analysis and campaign reporting.
You have strong experience in R and Python
Java, Alteryx, VBA, SQL, ETL a plus.
You’re well-spoken, and can verbally communicate well with Fortune 500 clients.
Your Excel skills are wizard level."
Monroe,Data Scientist,"Rochester, MI","Summary
Monroe is a cutting edge, industrial manufacturing and distribution company that is uniquely positioned to offer customers a multitude of value-add, diverse product solutions across many different industries.
We are looking for a self-motivated and experienced Data Scientist to join our internal IT team at our corporate location in Rochester Hills, MI. The Data Scientist will be responsible for understanding Monroe's business objectives and continually working with both internal team members and external vendors to acquire, define, test, maintain, and display data. The desired candidate must have a ""360 degree view"" mindset and be a team player that can multi-task projects/role responsibilities - all while being in a fast-paced environment.
Core Responsibilities
Work with internal team members and external vendors to continually enhance our data warehouse capabilities"
Illumination Works,Data Scientist,Remote,"Join our Data Science Team! Our collaborative and diverse data science team has experience that spans many industries including energy, retail, healthcare, and DoD. Our projects have ranged from natural language processing (NLP) and text analytics to machine learning, predictive analytics, and simulation modeling. We are looking for a data scientist who is career-oriented and eager to grow their skills. The ideal candidate will bring innovative use of scientific research concepts, principles, and practices and will contribute to the application of advanced data science methods and techniques.
Do you have what it takes? Are you driven to implement creative solutions that unravel complex and ever-changing challenges? We value passion, curiosity, and perseverance with an ability to communicate ideas and results to diverse audiences. We look for people who thrive in collaborative and independent assignments, have the aptitude to learn new data quickly, and who are willing to mentor junior team members. Required skills for this job include:
Integrates and extracts relevant information from large amounts of both structured and unstructured data to enable analytical solutions"
SparkCognition,Data Scientist,California,"SparkCognition catalyzes sustainable growth for their clients throughout the world with proven artificial intelligence (AI) systems, award-winning machine learning technology, and a multinational team of AI thought leaders. Clients are trusted with advancing lives, infrastructure, sustainability, and financial systems across the globe. They partner with SparkCognition to understand their industry’s most pressing challenges, analyze complex data, empower decision-making, and transform human and industrial productivity. With leading-edge artificial intelligence products, SparkCognition’s clients can adapt to a rapidly changing digital landscape and accelerate their business strategies.
If you were already working for us, you would be:
Partnering with project teams in developing and applying ML expertise in developing and delivering customer solutions
Independently and effectively engaging with external technical stakeholders and subject matter experts to understand and solve critical business problems through the application of cutting-edge artificial intelligence"
Cleveland Clinic,Data Scientist I,"Cleveland, OH","Responsibilities:
Gathers requirements and program model development under direction of other Data Scientists to inform problem formulation.
Participates in model building.
Utilizes methods particularly in the areas of modeling, Artificial Intelligence (AI), Machine Learning (ML), Deep Learning (DL), Natural Language Processing (NLP) and experience designing/implementing solutions.
Provides insight and recommendations to solve business problem and help inform business decisions.
Documents best practices and solution frameworks. Replicates and scales solutions to business units with common/similar business needs.
Uses expertise in defining (with internal clients) the business challenge that needs to be solved, conducting the analysis/modeling/experiment and then providing the “answer” in a clear and business-friendly manner for our clients to take actionable steps."
Emerald Resource Group,Data Scientist - Remote,Remote,"Position: Data Scientist - REMOTE
Machine Learning / R/ Python / Jupyter /SQL
Must have experience developing Data science solutions to production within Digital Services, Products, and solutions.
Remote role that is Direct Hire-Salaried
Prefer Eastern Standard Time Zone
(At this time, our client cannot accommodate H1B visas or OPT).
************************************************************************************"
"The Travelers Companies, Inc.",Data Scientist,"Hartford, CT","Company Summary

Taking care of our customers, our communities and each other. That's the Travelers Promise. By honoring this commitment, we have maintained our reputation as one of the best property casualty insurers in the industry for over 160 years. Join us to discover a culture that is rooted in innovation and thrives on collaboration. Imagine loving what you do and where you do it.

Job Category

Analytics & Research

Target Openings

1



Travelers Data Scientists are taking the organization to the next level of intelligence by using advanced statistical techniques and machine learning algorithms. As a Data Scientist, you will work with business partners to tell the story using data by identifying challenges and opportunities for data analysis and experiments. You will build models that solve key business challenges and enhance our customer experience.






Travelers is an equal opportunity employer. We value the unique abilities and talents each individual brings to our organization and recognize that we benefit in numerous ways from our differences.

If you are a candidate and have specific questions regarding the physical requirements of this role, please send us an email so we may assist you.

Travelers reserves the right to fill this position at a level above or below the level included in this posting.

To learn more about our comprehensive benefit programs please visit http://careers.travelers.com/life-at-travelers/benefits/."
"Vanu, Inc.",Data Scientist,"Lexington, MA","A unique position has arisen for a skilled, enthusiastic, and results-oriented data scientist in the budding global mapping group of a growing telecommunications company located in Lexington, Massachusetts. Vanu Inc is a global leader in providing wireless coverage to the 1.2 billion people worldwide currently unable to connect, with a particular focus on markets in Africa and South East Asia.
As a cartographically oriented data scientist you will help us to develop the technology and insight we need to address growing international interest in and application of our unique industry disrupting network planning and mapping capabilities. You will be an integral member of our analytics department focused both on the formulation of novel applications and the streamlining of existing tech.
The necessary credentials:
-Master’s degree or better in engineering or science-related field"
Tiro L.L.C.,Machine Learning Engineer / Data Scientist,Remote,"Data Scientist / ML Ops Engineer
The position
We are looking for a talented Data Scientist / ML Ops Engineer to join our client’s fast growing team in either in office or Remote. We are looking for a high caliber individual with a passion for building scalable machine learning (ML) platforms for deployment of automated ML based software solutions. In this position, you will be working with a very highly energetic team of engineers, data scientists, and developers, to develop and deploy ML solutions to solve engineering problems. The solutions will focus on improving operational efficiency and predictive maintenance using engineering and data science approaches.
Responsibilities
You will be responsible for:"
ScienceIO,Lead Data Scientist,"New York, NY","Please apply here: https://app.dover.io/apply/scienceio/1abae491-43da-43f0-a86d-a98e93409912?rs=55634680
ScienceIO is on a mission to build a more transparent, connected, and equitable healthcare system.
As Lead Data Scientist, you’ll be a key member of our growing data science & machine learning team and work closely with the founders to build up data science culture and best practices across the organization. As data scientists ourselves, we care deeply about building infrastructure and aligning incentives to support great data science.
The role & opportunity
You will lead our initiative to build better, fairer, and more transparent machine learning models for healthcare by improving the way we understand and improve our data and models"
NIKE INC,Associate Data Scientist,"Beaverton, OR","Become a Part of the NIKE, Inc. Team


NIKE, Inc. does more than outfit the world’s best athletes. It is a place to explore potential, obliterate boundaries and push out the edges of what can be. The company looks for people who can grow, think, dream and create. Its culture thrives by embracing diversity and rewarding imagination. The brand seeks achievers, leaders and visionaries. At NIKE, Inc. it’s about each person bringing skills and passion to a challenging and constantly evolving game.

Within North America Marketplace Operations we are transforming into a data driven fulfillment network focused on inventory flexibility, and optimization while ensuring Nike delivers an elevated experience to all its customers and consumers. Ensuring we can support our highest growth areas of the business while improving our service levels across all channels, and changing the way we work provides new challenges every day, while providing massive opportunity for innovation and personal growth.

WHO WE ARE LOOKING FOR


WHAT YOU WILL WORK ON


WHO YOU WILL WORK WITH


WHAT YOU BRING"
The Home Depot,"Associate Data Scientist, Marketing & Online (Remote)","Atlanta, GA","The Home Depot is able to offer virtual employment of this position in the following states: AL, AK, AZ, AR, DE, DC, FL, GA, HI, ID, IL, IN, IA, KS, KY, LA, ME, MD, MA, MI, MN, MS, MO, MT, NE, NH, NJ, NM, NY, NC, ND, OH, OK, OR, PA, RI, SC, SD, TN, TX, UT, VT, VA, WA, WV, WI, WY

Position Purpose:
The Associate Data Scientist is responsible for supporting data science initiatives that drive business profitability, increased efficiencies and improved customer experience. This role works closely with Data Scientists and/or Sr. Data Scientists in their team to develop solutions by applying advanced analytics methods and algorithms for identifying trends and providing business solutions. Based on the specific data science team, this role may need to develop skills in one or more data science specializations, such as optimization, computer vision, recommendation, search or NLP.

As an Associate Data Scientist, you will develop skills that effectively leverage data science methodologies to creatively solve business problems and provide strategic insights. This requires effective communication skills as well as continuous learning and development at both the technical and business level.




This position reports to manager or above
This position has 0 direct reports



1. Located in a comfortable indoor area. Any unpleasant conditions would be infrequent and not objectionable.


No travel required.


























-"
Selby Jennings,Data Scientist,Remote,"Company Summary: A leading Medical Malpractice Insurance Firm in the US with over a billion dollars in written premium is looking to hire a Data Scientist. The firm is looking to add someone who is passionate about data and applying the latest machine learning technology to solve business problems. This role is fully remote and is an urgent hire!
The Data Scientist will be responsible for:
Developing and implementing machine learning technologies
Identify and propose new technologies and tools that could be of benefit
Leading proactive communication to all departments
Mentor junior level data scientists
The Data Scientist must have the following qualifications:"
Indeed,Senior Data Scientist - International,Remote,"Your Job
As a Senior Data Scientist embedded in the International Team team, you will be tasked with building machine learning solutions to help improve the efficiency of software delivery at Indeed. You will work on interesting and important challenges that range from designing algorithms for quicker regression testing to building tools that can automate root cause analysis. Through your work, Indeed software developers will be able to quickly get their solutions into production, find and fix bugs, and improve the quality of their code.

The International Team works to make all of Indeed’s products effective at getting people hired, in every market and language. This involves translating the needs of specific markets into configuration patterns that let us scale those variations worldwide. We consider both sides of the experience, meaning that we internationalize employer-facing products (such as posting jobs and managing candidates) and jobseeker-facing products (such as mobile job search, updating profiles, and messaging-app based experiences). Most importantly, the team is expected to deliver results, and be able to demonstrate the impact our changes have on our business.






We are a rapidly growing and highly-capable Engineering organization building the most popular job site on the planet. With engineering hubs in Seattle, San Francisco, Austin, Tokyo, Singapore, Hyderabad, Dublin, Aberdeen and Vancouver, we are improving people's lives all around the world, one job search at a time."
QBE North America,"AVP, Data Scientist (Remote)",Remote,"At QBE, our purpose is to give people the confidence to achieve their ambitions inside and outside of work. From development opportunities, to flexible work options and highly competitive reward and benefits packages, we understand the importance of living our values when it comes to our people. Everything we do at QBE is underpinned by our company’s cultural elements – because we know it's not just what we do that matters, it's how we do it that makes the difference.
This opportunity is accountable for managing a team of modelling and data science partners and provide technical subject matter expertise on work products, including study design, research methodology, and deployment of statistical approaches.
Primary Responsibilities
Partner with analytics manager to size analytical opportunities and create delivery plans to ensure a positive commercial return against investments made while managing relationships with offshore analytics team"
Indeed,Staff Data Scientist,"Chicago, IL","Your Job
About the Team
The Trust & Safety team’s mission is to protect job seekers from exposure to fraudulent activity on indeed.com. Your job will be to build cutting-edge machine learning models and the infrastructure required to support their deployment at scale. You’ll work closely with other data scientists, engineers, and product managers embedded on our small cross-functional team to build the tools that all Indeed products use to keep our platform safe.

Preferred Qualifications
Have full stack experience in data collection, aggregation, analysis, visualization, productionization, and monitoring of data science products
Have experience deploying deep learning solutions into production systems"
NIKE INC,"Senior Data Scientist, Sport Activity Open to remote work, except the following locations: SD, VT, and WV","Warren, OR","Become a Part of the NIKE, Inc. Team

NIKE, Inc. does more than outfit the world’s best athletes. It is a place to explore potential, obliterate boundaries and push out the edges of what can be. The company looks for people who can grow, think, dream and create. Its culture thrives by embracing diversity and rewarding imagination. The brand seeks achievers, leaders and visionaries. At NIKE, Inc. it’s about each person bringing skills and passion to a challenging and constantly evolving game.

Who we are looking for

We are looking for experienced data scientists who are excited to help Nike members along their fitness and wellness journey. You excel at formulating a member need or product strategy into a tractable machine learning or statistical problem. You love diving into the data, modeling it, and engineering the production solution. You think probabilistically and causally. You love the science for itself. You stay up to date on the newest research and are excited to figure out how we can apply it to serve our members.

We are looking for scientists who will continue to strengthen the collaborative, open, and inclusive culture that we have built. Our work in activity is new, so we are looking for scientists who are excited about green space. Who are excited to help build a new team and solve big new problems. Who thrive in a dynamic space and want to drive important efforts independently.

What will you work on

Sport Activity Senior Data Scientists will personalize Nike’s fitness and wellness experiences, building towards a cutting edge AI coach built atop scientific expertise, with hardware and camera integration.

healthy, high energy, balanced, andmotivated. You will partner with our product team and product and platform engineers to deploy models, evolve the experience, and evaluate tests. You will build from the data an understanding of user response to drive strategic goals rather than easy to capture real time measures. You will synthesize findings to help guide product decisions, influencing product roadmaps and strategic direction.

Who will you work with

You will be a Senior Data Scientist reporting to the Senior Director of Sport Activity Data Science. You will work with other senior and principal sport activity data scientists. The team embeds with product and engineering teams that deliver Nike’s physical activity digital experiences including the Nike Running Club (NRC) and Nike Training Club (NTC) apps. You will also work closely with platform and data engineering teams. As a scientist in the Consumer Data Science group, you will participate in our data science labs, study groups, and team activities.

What you bring

Minimum Qualifications

computing, both for data and optimization

Preferred Qualifications

Open to remote work, except cannot work in South Dakota, Vermont, and West Virginia. These candidates will be required to relocate.

For employees based in Colorado, this position starts at $140,000 per year. Information about benefits can be found here.

NIKE, Inc. is a growth company that looks for team members to grow with it. Nike offers a generous total rewards package, casual work environment, a diverse and inclusive culture, and an electric atmosphere for professional development. No matter the location, or the role, every Nike employee shares one galvanizing mission: To bring inspiration and innovation to every athlete* in the world.

NIKE, Inc. is committed to employing a diverse workforce. Qualified applicants will receive consideration without regard to race, color, religion, sex, national origin, age, sexual orientation, gender identity, gender expression, veteran status, or disability."
Amica Mutual Insurance Company,Data Scientist,"Providence, RI","Data Scientist (Enterprise Data Solutions)
100 Amica Way, Lincoln, RI 02865
Want to join a company where doing good is what we do?
The feeling is mutual!
We’re redefining excellent customer experiences. Data drives that process.
As a Data Scientist, you’ll be tasked with leveraging structured and unstructured data sources to drive business outcomes. You’ll develop custom data models and algorithms as well as predictive models to increase and optimize customer experiences. Beyond the data, you’ll also have the opportunity to communicate these complex statistical analyses to non-technical stakeholders with both actionable insights and compelling stories.
Responsibilities:"
